row_id,id,title,year,abstract
1347,US-7102325-B2,Method for determining rotor flux vector of AC electrical machine ,2004,"A method for determining the rotor flux vector of an electrical machine, the method comprising the steps of controlling the electrical machine with an inverter, forming an equation for the reactive power (Qinv) at the output of the inverter, forming an equation for the consumed reactive power ({circumflex over (Q)}mot) in the electrical machine, forming a reactive power balance equation (Qerr) between the reactive power (Qinv) at the output of the inverter and the reactive power ({circumflex over (Q)}mot) consumed in the electrical machine, determining the stator resistance ({circumflex over (R)}s) of the electrical machine from the balance equation (Qerr), determining the stator flux estimate ({circumflex over (ψ)}s) using the determined stator resistance ({circumflex over (R)}s) and the balance equation (Qerr), and determining the rotor flux estimate ({circumflex over (ψ)}R) using the determined stator flux estimate ({circumflex over (ψ)}s)."
1348,US-8320629-B2,Multi-level neural network based characters identification method and system ,2004,"A system and method, which enable precise and automatic identification of characters, perform and calibrate data verification to ensure data reliability. The system can process these identified characters, such as override adverse conditions, adjusting and correcting unclear characters and their images."
1349,US-7822598-B2,System and method for normalization of a string of words ,2004,"The present invention relates generally to a system and method for categorization of strings of words. More specifically, the present invention relates to a system and method for normalizing a string of words for use in a system for categorization of words in a predetermined categorization scheme. A method for adaptive categorization of words in a predetermined categorization scheme may include receiving a string of text, tagging the string of text, and normalizing the string of text. Normalization may be performed with a three-stage algorithm including a literal match processing stage, an approximation match processing stage, and a nearest neighbor match processing stage. The normalized string of text can be compared to a number of sequences of text in the predetermined categorization scheme."
1350,US-8099305-B2,Dental data mining ,2004,"Systems and methods are disclosed providing a database comprising a compendium of at least one of patient treatment history; orthodontic therapies, orthodontic information and diagnostics; employing a data mining technique for interrogating said database for generating an output data stream, the output data stream correlating a patient malocclusion with an orthodontic treatment; and applying the output data stream to improve a dental appliance or a dental appliance usage."
1351,US-7069098-B2,Method and system for prioritizing material to clear exception conditions ,2004,"The present invention is generally directed to various methods and systems for prioritizing material to clear exception conditions. In one illustrative embodiment, the method includes providing a plurality of workpieces, each of the workpieces having an associated quantity of material that cannot be processed until the workpiece has been processed, and determining a priority for processing each of the plurality of workpieces based upon at least the associated quantity of material that cannot be processed."
1352,US-7227567-B1,Customizable background for video communications ,2004,A video telecommunications system100for effecting a communication between at least first and second participants includingan image alteration agent358that (i) removes desired and/or undesired image information370and374from the acquired image information362to form filtered image information378and the removed information and (ii) combines the filtered image information378and/or the image information370and374with substitute image information382to form composite image information366; anda video communication infrastructure304that transmits the composite image information366to a communication device associated with the second participant120. The composite image information366excludes undesired image information374.
1353,US-7933651-B2,Cardiac template generation based on patient response information ,2004,"Cardiac treatment methods and devices provide for templates representative of past tachyarrhythmia events, each template associated with a therapy. Methods involve providing a cardiac waveform representative of a patient's cardiac activity and identifying a portion that indicates an arrhythmic event. A cardiac template corresponding to the portion is generated, and a therapy is associated with the template useful for treating a subsequent arrhythmia. The waveform portion may be identified by a physician using a patient-external device to display the cardiac waveform. The template may be generated by a physician selecting the cardiac waveform, and determining if the therapy associated with the template was satisfactory and/or effective in treating the arrhythmia. Identification may involve matching the event to templates generated using cardiac waveforms other than the patient's cardiac waveforms. The template may be generated in a patient-internal or patient-external medical device such as a programmer, and/or an advanced patient management system."
1354,US-7790160-B2,Method of treating CD30 positive lymphomas ,2004,Methods for treating lymphomas characterized by expression of CD30 using anti-CD30 antibodies and proteasome inhibitors in combination are disclosed.
1355,US-7640488-B2,"System, method, and service for using a focused random walk to produce samples on a topic from a collection of hyper-linked pages ",2004,"A focused random walk system produces samples of on-topic pages from a collection of hyper-linked pages such as Web pages. The focused random walk system utilizes a focused random walk to produce a focused sample, which is a random sample of Web pages focused on a topic. The focused random walk system uniformly samples pages iteratively, where each iteration follows a random link from a union of the in-links and out-links of a page. The system then classifies this randomly selected link to determine whether the page is on-topic. The random walk sampling process could comprise a hard-focus method that selects only on-topic pages at each step of the focused random walk, or a soft-focus method that allows limited divergence to off-topic pages."
1356,US-7948375-B2,Method and apparatus for detecting portable electronic device functionality ,2004,"The present invention is a method and apparatus for the detection of portable electronic device functionality. In a preferred embodiment, the present invention includes a chemically coated antenna to serve as a trigger for device functionality detection. The chemically coated antenna may be passively or actively detected. In active detection, a detection apparatus releases a chemical which reacts or otherwise respods with the chemical trigger in a detectable manner. The detection apparatus detects the reaction, which is specific to the functionality of the portable electronic device. In passive detection, a detection device simply detects the chemical trigger, which is specific to the portable electronic device functionality. Other trigger embodiments utilizing optics, radio frequency (RF) signals, sound waves, and magnetic identification are also disclosed."
1357,US-7742838-B2,Process and device for controlling the robotal device ,2004,"A process is provided for controlling a robotal device, such as a multiaxial industrial robot, by a control unit, with a control core for executing control processes for the robotal device. An interface function checks whether models and/or procedures optionally contained in the control core or additional models and/or transformation procedures and/or special algorithms of kinematic structures, which can be preset at the interface are used as model modules for motion-relevant variables of the robotal device. Special and third-party kinematics can thus also be operated with a control device suitable for executing the process without the control itself having to be modified."
1358,US-7707169-B2,"Specification-based automation methods for medical content extraction, data aggregation and enrichment ",2004,"A method for knowledge generation from raw medical records uses XML-based specifications. The method includes content extraction, data aggregation and data enrichment. The method operates on various sources of medical data including financial data, clinical documents and medical images."
1359,US-9468398-B2,Method and apparatus for detecting and quantifying intrinsic positive end-expiratory pressure ,2004,"The present invention describes a method and apparatus for detecting and quantifying intrinsic positive end-expiratory pressure (PEEPi) of a respiratory patient breathing with the assistance of a ventilator. A processing device receives respiratory airway data from one or more sensors adapted to non-invasively monitor a respiratory patient, calculates from the respiratory airway data two or more parameters that are indicative of or quantify intrinsic positive end-expiratory pressure of the patient, and generates an indication intrinsic positive end-expiratory pressure (PEEPi)."
1360,US-7684643-B2,Mutual information regularized Bayesian framework for multiple image restoration ,2004,"A method for multiple image restoration includes receiving a plurality of images corrupted by noise, and initializing a reduced noise estimate of the plurality of images. The method further includes estimating a probability of distributions of noise around each pixel and the probability of the signal, estimating mutual information between noise on the plurality of images based on the probabilities of distributions of noise around each pixel and the joint distribution of noise, and updating each pixel within a search range to determine a restored image by reducing the mutual information between the noise on the plurality of images."
1361,US-7650332-B2,Database query tools ,2004,"A system that facilitates one or more of querying and updating a multi-dimensional structure comprises a component that receives a statement in a declarative language relating to a typed object associated with a multi-dimensional structure. A conversion component analyzes context associated with the statement and automatically converts the object to a disparate type as a function of the analysis. For example, an execution engine can comprise the conversion component, and the execution engine can be an Online Analytical Processing (OLAP) engine."
1362,US-6783097-B1,Wing-drive mechanism and vehicle employing same ,2004,"A wing-drive mechanism is described that permits, with proper control, movement of a wing about multiple wing trajectories. The wing-drive is capable of independent movement about three rotational degrees of movement; movement about a flap axis is independent of movement about a yaw axis, and both are independent of changes in the pitch of the wing. Methods of controlling the wing-drive mechanism to affect a desired wing trajectory include the use of a non-linear automated controller that generates input signals to the wing-drive mechanism by comparing actual and desired wing trajectories in real time. Specification of wing trajectories is preferably also accomplished in real time using an automated trajectory specification system, which can include a fuzzy logic processor or a neural network."
1363,US-7917460-B2,Systems and methods for generating a decision network from text ,2004,"Systems and methods are provided for generating a decision network from text. An information extraction component extracts a quantum of evidence and an associated confidence value from a given text segment. An evidence classifier associates each quantum of evidence with one of a plurality of hypotheses. A fusion engine builds a decision network from the plurality of hypotheses, an associated base structure, the extracted quanta of evidence, and the confidence values."
1364,US-7280943-B2,Systems and methods for separating multiple sources using directional filtering ,2004,"Systems and methods for performing source separation are provided. Source separation is performed using a composite signal and a signal dictionary. The composite signal is a mixture of sources received by a sensor. The signal dictionary is a database of filtered basis functions that are formed by the application of directional filters. The directional filters approximate how a particular source will be received by the sensor when the source originates from a particular location. Each source can be characterized by a coefficient and a filtered basis function. The coefficients are unknown when the sources are received by the sensor, but can be estimated using the composite signal and the signal dictionary. Various ones of the sources may be selectively reconstructed or separated using the estimated value of the coefficients."
1365,US-7496593-B2,Creating a multi-relational ontology having a predetermined structure ,2004,"The invention relates generally to a system and method for creating one or more structured multi-relational ontologies. The invention may include ontologies comprising assertions made up of concept-relationship-concept triplets. The invention may also include predefined sets of concept and relationship types as well as concept type hierarchies and concept-relationship association parameters. The invention may further include properties as concepts, synonyms of concepts as concepts, and documents or parts thereof as concepts."
1366,US-7823123-B2,Semantic system for integrating software components ,2004,"A system and method for integrating databases and/or web services into a searchable ontological structure. The structure allows free-form searching of the combined system, discovering an execution path through the ontology to provide answers to queries that may require accessing multiple systems to resolve, without a need for knowledge of the available databases and services or of query syntax by the user. The same technologies that integrate databases and web services into a single ontological structure may also provide interoperability between the numerous information systems within modern enterprises. Context ontologies are constructed to capture ubiquitous enterprise concepts and their representations across the enterprise. By mapping information system data models to these context ontologies, information that originates in one part of the enterprise may be used across the enterprise in a highly automated fashion."
1367,US-7444190-B2,"Method for creating a non-linear, stationary or dynamic model of a control variable of a machine ",2004,"A method for creating a non-linear, stationary or dynamic overall model of a control variable of a combustion engine or partial systems thereof is based on simplified partial model functions that are used to determine in a weighted fashion at each desired operating point the total output quantities from the partial model function with an associated weighting function. The difference between the total output quantity and the real value is determined for all real operating points; and in areas of operating points with an absolute value of this difference that is above the preset value, a further model function with a further associated weighting function is used for which the absolute value of the difference stays below the preset value.The steps for determining the difference between the total output quantity of the associated partial model functions and a real value of the control value as well as the application of a further model and weighting function are executed as many times as needed until the statistically evaluated prediction quality of the overall model has reached a desired value."
1368,US-7837543-B2,Reward-driven adaptive agents for video games ,2004,"Adaptive agents are driven by rewards they receive based on the outcome of their behavior during actual game play. Accordingly, the adaptive agents are able to learn from experience within the gaming environment. Reward-driven adaptive agents can be trained at either or both of game-time or development time. Computer-controlled agents receive rewards (either positive or negative) at individual action intervals based on the effectiveness of the agents' actions (e.g., compliance with defined goals). The adaptive computer-controlled agent is motivated to perform actions that maximize its positive rewards and minimize is negative rewards."
1369,ES-2323429-T3,"USE OF ASC, AS A MARKER FOR COLORRECTAL CANCER. ",2004,"The present invention relates to the diagnosis of colorectal cancer. It discloses the use of protein ASC (apoptosis-associated speck-like protein containing a caspase-associated recruitment domain) in the diagnosis of colorectal cancer. It relates to a method for diagnosis of colorectal cancer from a liquid sample, derived from an individual by measuring ASC in said sample. Measurement of ASC can, e.g., be used in the early detection or diagnosis of colorectal cancer."
1370,US-7421438-B2,Metadata editing control ,2004,"A metadata management architecture. The architecture includes a property component that lists one or more properties related to a file, and a viewing component that present files having one or more of the related properties. A synchronization component provides immediate synchronization between property editing fields of the property component and a view in the property-based browser component, providing both instantaneous feedback on property changes and an ability to manipulate properties graphically. Thus, a change in the property pane is immediately reflected in the view component, and a change in the view component is immediately reflected in the property pane."
1371,US-8868554-B1,Associating product offerings with product abstractions ,2004,"Techniques are provided for associating product offerings with product abstractions. The techniques enable generating a second product offering based on a first product offering by mapping items in the first product offering using one or more mapping dictionaries, where a product offering is an offer to sell a particular product by a particular party. Once the second product offering has been generated, a matching score is determined for each of one or more product abstractions; and then one or more product abstractions are associated with the first product offering based on the matching scores for the second product offering."
1372,US-7246040-B2,Process of remote sensing data ,2004,"The invention relates to the processing of remote sensing data, especially remote sensing data recorded by a satellite. A plurality of processing routines for processing the remote sensing data is available or is prepared. A defined requirement on the use of the remote sensing data is entered by the use of an interface. In a linker, the defined requirement is used to select a certain number of processing routines and to link them together, so that the selected processing routines can process the remote sensing data in such a way that the defined requirement is fulfilled."
1373,US-7634417-B2,Cost based control of air pollution control ,2004,"A controller for directing operation of an air pollution control (APC) system, requires a consumable to perform a process to control emissions of a pollutant. The process has multiple process parameters (MPPs). One or more of the MPPs is a controllable process parameters (CTPPs) and one of the MPPs is an amount of the pollutant (AOP) emitted by the system. A defined AOP value (AOPV) represents a limit on an actual value (AV) of the emitted AOP. An interface receives a value corresponding to a unit cost of the consumable. A control processor determines the cost of operating the system based on the received value corresponding to the unit cost of the consumable, and directs control of at least one of CTPPs based on the current value of that CTPP and the determined operating cost."
1374,US-7313707-B2,Systems and methods for configuring ports ,2004,"Systems, methodologies, media and other embodiments associated with configuring a port are described. One exemplary system embodiment includes a computing system that includes a port configured to operably connect an external device to the computing system. The example system may also include a mode controller operably connected to the port and that is configured to configure the port between a powered mode and a non-powered mode in accordance with a programmatically selected port configuration."
1375,US-7360413-B2,"Wireless water flow monitoring and leak detection system, and method ",2004,"A wireless water flow monitoring and leak detection system and method are provided. The system includes a base station, a memory, and a central processing unit configured to control the operation of the system and to analyze stored data. A plurality of highly-sensitive wireless flow sensor nodes are each installed individually on a supply line of a water fixture in a facility having a plurality of water fixtures. The wireless flow sensor nodes can periodically read and store a data point corresponding to either a flow condition or a no flow condition occurring at the water fixture. A plurality of coordinator nodes are configured to wirelessly relay data between the plurality of wireless flow sensor nodes and the base station. The base station is configured to determine based on an analysis of the stream of data points whether a leak exists in any of the water fixtures, and if a leak is determined to exist, a maintenance alert is generated."
1376,US-8271449-B2,Aggregation and retrieval of mote network data ,2004,"Methods, devices, and systems that aggregate and retrieve network sensor data. In one approach, an exemplary method includes receiving a plurality of instances of correlated sensor data from a plurality of remote data storages, each instance of sensor data respectively correlating to an occurrence. In another approach, an exemplary method includes receiving from an input-selector an input selection corresponding to a target-occurrence having at least one representative feature, and searching stored sensor data for sensor data correlating to the target-occurrence."
1377,US-8249698-B2,General diagnostic and real-time applications of discrete hermite functions to digital data ,2004,"General diagnostic and real-time application of digital Hermite functions allows features to be extracted from a measured signal through expansion of the measured signal. Specifically, the digital Hermite functions represent the shape of the measured signal in a set of vectors derived from a symmetrical tridiagonal matrix. This allows for efficient computation of the Hermite expansion coefficients, in real-time, to represent the expanded signal. The signal expansion also allows any artifacts, such as noise, to be isolated and removed, allowing the underlying signal of interest to be revealed."
1378,US-7324921-B2,Container inspection system ,2004,"The container inspection system operates globally at container handling facilities around the world and includes at least one transport apparatus located at a container handling facility having a spreader or other framework for connecting and handling cargo containers of all shapes and sizes. The transport apparatus is in communication with a computer network including several computing devices that provide to the transport apparatus comparison data including load models, load signatures, weight profile, and sensory limits related to a particular container. Sensors can be located on the spreader, inside the container, and invasively through the container and provide scanned characteristic data that is compared to the comparison data to determine a pass status or a fail status for the container. Ancillary data and authority input may be provided to the system by outside sources, such as other inspection systems and governmental entities. The transport apparatuses then move the connected container to a first location if a pass status is determined and a second location if a fail status is determined. The computer network may include a global host computer, a local host computer, and a local transport computer and employs expert system methodology."
1379,US-9725187-B2,Vehicle health management systems and methods ,2004,"A method includes receiving first vehicle data from a sensor on a vehicle at one or more processors executing a first software module. The method includes determining a risk value, a confidence value associated with whether the first vehicle data matches a validated vehicle state, and a benefit value associated with providing the first vehicle data to a second software module. The method includes calculating a health score associated with the first vehicle data based on the risk value, the confidence value, and the benefit value. The method includes, in response to the health score meeting a threshold value, determining whether the first vehicle data is internally consistent, externally consistent, and stable over time. The method further includes, in response to the first vehicle data being internally consistent, externally consistent, and stable over time, providing the first vehicle data to a vehicle flight control system."
