row_id,id,title,year,abstract
596,US-6847733-B2,Retrieval and browsing of database images based on image emphasis and appeal ,2001,"An image is automatically assessed with respect to certain features, wherein the assessment is a determination of the degree of importance, interest or attractiveness of the image. First, a digital image is obtained corresponding to the image. Then one or more quantities are computed that are related to one or more features in the digital image, including one or more features pertaining to the content of the digital image. The quantities are processed with a reasoning algorithm that is trained on the opinions of one or more human observers, and an output is obtained from the reasoning algorithm that assesses the image. More specifically, the reasoning algorithm is a Bayesian network that provides a score which, when done for a group of images, selects one image as the emphasis image or the appeal image. The features pertaining to the content of the digital image include people-related features and/or subject-related features. Moreover, additional quantities may be computed that relate to objective measures of the digital image, such as colorfulness and/or sharpness."
597,US-6678251-B2,Link quality agent ,2001,"A link quality agent running in a computer embedded in a device, such as an optical communication transceiver, to monitor avalanche photodiode (APD) and filter wheel values on each side of the free space link as well as packet errors from a distribution switch. When the link quality agent determines that the free space link is marginal, the link quality agent configures down the port between the distribution switch and the router on the receive end of the free space link, and forces customer traffic over a backup link. When both ends of the free space link are again functional, the link quality agent configures the port up and routes customer traffic to the free space link."
598,US-7266532-B2,Reconfigurable autonomous device networks ,2001,"The present invention describes the use of autonomous devices, which can be arranged in networks, such as neural networks, to better identify, track, and acquire sources of signals present in an environment. The environment may be a physical environment, such as a battlefield, or a more abstract environment, such as a communication network. The devices may be mobile, in the form of vehicles with sensors, or may be information agents, and may also interact with one another, thus allowing for a great deal of flexibility in carrying out a task. In some cases, the devices may be in the form of autonomous vehicles which can collaboratively sense, identify, or classify a number of sources or targets concurrently. The autonomous devices may function as mobile agents or attractors in a network, such as a neural network. The devices may also be aggregated to form a network of networks and provide scalability to a system in which the autonomous devices are operating."
599,US-7143300-B2,Automated power management system for a network of computers ,2001,"A computer system comprising a plurality of computing entities includes automatic power management logic that automatically transitions the system to a state in which less power is consumed when appropriate. The determination as to when this transition should occur is based on determining when demand for the processing abilities of the system are reduced. Once the decision has been made to transition to a reduced power state, the system's power management logic makes this transition in such a way to preferably minimize or at least reduce the performance impact on the system. Also, rather than altering the power state of one of the computing entities in the system, the entity can be deployed as part of another computing system."
600,US-6871160-B2,Intelligent condition-based engine/equipment management system ,2001,"Health management of machines, such as gas turbine engines and industrial equipment, offers the potential benefits of efficient operations and reduced cost of ownership. Machine health management goes beyond monitoring operating conditions, it assimilates available information and makes the most favorable decisions to maximize the value of the machine. These decisions are usually related to predicted failure modes and their corresponding failure time, recommended corrective actions, repair/maintenance actions, and planning and scheduling options. Hence machine health management provides a number of functions that are interconnected and cooperative to form a comprehensive health management system. While these interconnected functions may have different names (or terminology) in different industries, an effective health management system should include four primary functions: sensory input processing, fault identification, failure/life prediction, planning and scheduling. These four functions form the foundation of the method of ICEMS (Intelligent Condition-based Engine/Equipment Management System). To facilitate information processing and decision making, these four functions may be repartitioned and regrouped, such as for network based computer software designed for health management of sophisticated machinery."
601,US-9380588-B2,Resource allocation to users in slotted code division multiple access system using beams ,2002,The invention includes several embodiments for slot assignment in code division multiple access communication systems. One embodiment for fixed beams assigns slots by first detecting a beam having the best received quality and selected the best slot from that beam. Another fixed beam embodiment determines the best slot or slots in a number of beams and determines the overall best beam/slot combination. Another fixed beam embodiment uses a modified interference factor. One embodiment for the uplink using adaptive arrays using a spatial analysis stage followed by a transmission power level estimation stage. An overall interference level associated with each slot is determined and a slot having the best overall quality is determined. Another embodiment for the downlink uses the spatial analysis and slot assignment of the uplink for the downlink. Another embodiment for the downlink uses a spatial and transmission power level estimation stages.
602,ES-2546211-T3,Traffic planning system ,2002,"A method of operating a traffic planning computer system (100) to plan (120) trips for delivery resources comprising multiple elements considered separate, but interrelated, resources comprising the multiple elements one or more of at least one trailer, at minus one vehicle and at least one group of vehicle drivers, each trip having several stop points in transit, the method comprising: receiving planning criteria, including data from stop points in transit and also including availability data for one or more of the at least one trailer, the at least one vehicle and the at least one group of drivers of the vehicle; receive cartographic data, said cartographic data comprising one or more routes, each route being defined by several route sections; receiving speed forecast information for a unit of traffic in each of said route sections, the speed forecast for a given route section of historical speed data for that route section at a predetermined time on a particular day; and plan (120) a trip that includes several transit stop points depending on the planning criteria, including availability data for the one or more of the at least one trailer, the at least one vehicle and the at least one group of vehicle drivers, and speed forecast information."
603,US-7511711-B2,Method for locating an impact on a surface and device therefor ,2002,Apparatus and methods for locating an impact point on a surface of an object. The object is provided with an acoustic sensor that senses the impact from the acoustic waves that are generated when the object is subjected to the impact. The location of the impact on the surface of the object is determined by a recognition step that includes a comparison of the sensed signal to one or more predetermined signals. Each predetermined signal represents an active zone on the surface of the object. A predetermined signal corresponds to the sensed signal when the impact causing the sensed signal is generated in the active zone represented by the predetermined signal. The impact is associated with the active zone represented by a predetermined signal when the sensed signal and the predetermined signal sufficiently correspond to each other.
604,DE-10260614-B4,Plasma parameter control using learning data ,2002,"Apparatus for controlling at least one plasma parameter in a manufacturing process, the apparatus comprising:a real-time measurement analyzer (210) for performing real-time measurements related to at least one physical or chemical property of a plasma (120), anda plasma parameter controller (200) that receives process run data during the manufacturing process, wherein the process run data indicates actual values of the at least one plasma parameter,wherein the plasma parameter controller (200) is arranged to control the at least one plasma parameter of the manufacturing process based on the process run data,wherein the plasma parameter controller (200) is further connected to the real-time measurement analyzer (210) for receiving learning data generated by the real-time measurement analyzer (210) from plasma process parameters, the learning data indicating at least an expected range for the process run data , andwherein the plasma parameter controller (200) is further configured to control the at least one plasma parameter of the manufacturing process based on the process run data and the learning data. "
605,US-7480616-B2,Information recognition device and information recognition method ,2002,"Information relating to an amount of muscle activity is extracted from a myo-electrical signal by activity amount information extraction means, and information recognition is performed by activity amount information recognition means using the information relating to the amount of muscle activity of a speaker. There is a prescribed correspondence relationship between the amount of muscle activity of a speaker and a phoneme uttered by a speaker, so the content of an utterance can be recognized with a high recognition rate by information recognition using information relating to an amount of muscle activity."
606,US-7117185-B1,"Method, system, and apparatus for casual discovery and variable selection for classification ",2002,"A method of determining a local causal neighborhood of a target variable from a data set can include identifying variables of the data set as candidates of the local causal neighborhood using statistical characteristics, and including the identified variables within a candidate set. False positive variables can be removed from the candidate set according to further statistical characteristics applied to each variable of the candidate set. The remaining variables of the candidate set can be identified as the local causal neighborhood of the target variable."
607,US-8706574-B2,Pharmaceutical waste identification system ,2002,"A pharmaceutical waste identification system presents pharmaceutical waste information and, in response to a client entering a pharmaceutical name, the system provides a pharmaceutical waste disposal recommendation. This recommendation can include a labeling recommendation for a container for the pharmaceutical, a disposal recommendation for an empty container previously containing the pharmaceutical, and a disposal recommendation for the pharmaceutical."
608,US-6981423-B1,System and method for sensing torque on a rotating shaft ,2002,"A system and method relating to the measuring of torque in a rotating shaft is provided. An optical torque sensing system comprises a rotating shaft, wherein a sleeve of photo-elastic material overlays a portion of the shaft. A light emitting component delivers light into the photo-elastic material, wherein the light delivered by the light emitting component is directed through the photo-elastic material along an axis of the rotating shaft. A capturing component captures the light that exits the photo-elastic material. The exiting light comprises fringe pattern data, and a computing system computes torsion strain of the shaft based at least in part on the fringe pattern information."
609,US-7152060-B2,Automated database blocking and record matching ,2002,An automated blocking technique is used as a first step to find approximate matches in a database. The technique builds a blocking set to be as liberal as possible in retrieving records that match on individual fields or sets of fields while avoiding selection criteria that are predicted to return more than the maximum number of records defining a particular special requirement. The ability to do blocking without extensive manual setup at low cost is highly advantageous especially when using a machine learning based second-stage matching algorithm.
610,US-7808335-B2,Circuit arrangement and signal processing device ,2002,"A circuit arrangement and signal processing device are disclosed. In one embodiment, the circuit arrangement includes a resonator circuit for generating an output signal from an input signal with a capacitance and with an inductance, with an input at which the input signal can be provided, and with an output at which the output signal can be provided. A control circuit is provided for open-loop or closed-loop control of a quality factor of the resonator circuit, the control circuit being configured to control the quality factor of the resonator circuit in an open-loop manner or in a closed-loop manner depending on a signal profile of the signal amplitude of the input signal and/or of the output signal."
611,US-7685083-B2,System and method for managing knowledge ,2002,An intelligence system is provided that is comprised of several basic components: a system for converting incoming unstructured data into a well described normalized form supported by a dedicated ‘mining’ language tied intimately to a system ontology; a system for accessing and manipulating data held in memory or in persistent storage in its normalized binary form; an ‘ontology’ that represents and contains the items and fields necessary for the target system to perform its function; a memory system tied to the ontology; a memory management system for splitting incoming data into those portions to be directed to each container; a query system for querying each container to retrieve portions of composite objects; a UI to display and interact with data within the system; a memory system that forms collections of datums and enables manipulation and exchange of these collections both within the local machine as well as across the network.
612,US-7712031-B2,System and process for developing a voice application ,2002,"A system for use in developing a voice application, including a dialog element selector for defining execution paths of the application by selecting dialog elements and adding the dialog elements to a tree structure, each path through the tree structure representing one of the execution paths, a dialog element generator for generating the dialog elements on the basis of predetermined templates and properties of the dialog elements, the properties received from a user of the system, each of said dialog elements corresponding to at least one voice language template, and a code generator for generating at least one voice language module for the application on the basis of said at least one voice language template and said properties. The voice language templates include VoiceXML elements, and the dialog elements can be regenerated from the voice language module. The voice language module can be used to provide the voice application for an IVR."
613,US-7711697-B2,System and method for producing electronic business information reports and related products ,2002,"A communication system for producing electronic business information reports comprising: a communication network, a website module, a product fabrication module, a computer system for communicating with and controlling the operation of the group of modules via the network, means for accessing the computer system thereby to enable communication and control of the modules by a user, and means for providing just-in-time business information reports wherein a request therefor is transmitted through the website to the product fabrication module."
614,US-7050863-B2,Integrated model predictive control and optimization within a process control system ,2002,A process control configuration system is provided for use in creating or viewing an integrated optimization and control block that implements an optimization routine and a multiple-input/multiple-output control routine. The configuration system may enable a user to display or configure the optimizer or the control routine. A storage routine may store information pertaining to a plurality of control and auxiliary variables and to a plurality of manipulated variables to be used by the optimization routine and/or the control routine. A display routine may present a display to a user regarding the information pertaining to the plurality of control and auxiliary variables and to the plurality of manipulated variables.
615,US-7318488-B2,Method for classifying data measured during drilling operations ,2002,A method for classifying data measured during drilling operations at a wellbore includes determining a first difference between values of a selected measured parameter between a first time and a second time and assigning a value of a measured parameter to an enhanced data value set when the first difference falls below selected thresholds.
616,US-7136759-B2,Method for enhanced accuracy in predicting peptides using liquid separations or chromatography ,2002,"A method for predicting the elution time of a peptide in chromatographic and electrophoretic separations by first providing a data set of known elution times of known peptides, then creating a plurality of vectors, each vector having a plurality of dimensions, and each dimension representing the elution time of amino acids present in each of these known peptides from the data set. The elution time of any protein is then be predicted by first creating a vector by assigning dimensional values for the elution time of amino acids of at least one hypothetical peptide and then calculating a predicted elution time for the vector by performing a multivariate regression of the dimensional values of the hypothetical peptide using the dimensional values of the known peptides. Preferably, the multivariate regression is accomplished by the use of an artificial neural network and the elution times are first normalized using a transfer function."
617,US-7685097-B2,Method and system for aggregating and disseminating time-sensitive information ,2002,"A method of aggregating and disseminating time sensitive information. A data source is searched to identify recently-posted information items matching predetermined selection criteria. A respective relevance score is calculated for each identified information item. A respective urgency rating is determined for each identified information item. Each information item is triaged using the urgency rating, and disseminated to at least one client based on the triage result."
618,US-6877435-B2,Dual-stage gas generator utilizing eco-friendly gas generant formulation ,2002,"This invention relates to a gas generator having two or more compartments, each with a separate initiator, with one compartment discharging before another, i.e., the compartments discharge sequentially. Each compartment has the same propellants, but the propellants have different geometries in each compartment, which results in different rates of gas evolution from each compartment.The new gas generator is designed to reach maximum inflation at the same time as the current, single stage gas generators. However, the new generator has a more rapid initial inflation, followed by a more gradual inflation rate in the subsequent stages, improving safety to occupants.The propellant used in new generator comprises (1) ammonium nitrate as the oxidizer, which is less toxic and corrosive than the currently-used azide, (2) a fuel such as CL-20, and (3) a binder such as polycaprolactone. No hot metal particles (e.g., CuO) are generated in the new system. This means that the complex, expensive filtering system in the current airbag systems is not needed, nor is there a need to use coated airbags."
619,US-7142694-B2,Image processing apparatus ,2002,"An image processor includes an imaging unit that captures an image of a target area, a face region extraction unit that extracts a face region, which corresponds to a face of a person, from the image captured by the imaging unit, a distance estimation unit that estimates a distance from the imaging unit to each position of the image captured by the imaging unit, a distance distribution calculation unit that sets up a distance estimation area below the face region by a predetermined distance and calculates distance distribution from the imaging unit in the distance estimation area, using the distance estimated by the distance estimation unit, and a wheelchair presence determination unit that determines whether a person corresponding to the face region extracted is sitting in a wheelchair, by comparing the distance from the imaging unit of the face region estimated by the distance estimation unit with the distance distribution in the distance estimation area."
620,US-7174491-B2,Digital system and method for testing analogue and mixed-signal circuits or systems ,2002,"A method of optimising a digital test signal for testing an analogue or mixed-signal circuit comprising determining a measure, for example a figure of merit, that is indicative of differences between the output of a fault free and the output of a known faulty circuit in response to an applied digital input signal. The digital input signal is then varied and another figure of merit is calculated for the fault free and the known faulty circuit for the new input signal. This is repeated a number of times, the digital input signal being varied each time. An optimum test signal is selected based on the determined figures of merit."
621,US-8126713-B2,Conversation control system and conversation control method ,2002,"The present invention includes a morpheme extracting unit420configured to extract, based on a character string corresponding to input information, at least one morpheme constituting a minimum unit of the character string, as first morpheme information, a topic search unit340configured to compare the first morpheme information extracted at the morpheme extracting unit420with topic titles, and to search a topic title corresponding to the first morpheme information from among the topic titles, and a reply retrieval unit350configured to retrieve, based on the topic title searched at a topic identification information search unit320, a reply sentence associated with the topic title."
622,US-8114635-B2,Methods for obtaining microbial trypsin mutants having chymotrypsin activity ,2002,"The present invention relates to microbial trypsin variants having chymotrypsin-like activity, comprising: (a) a one or more substitutions corresponding to positions 144, 193, 198, 201, 218, 223, 227, 228, 229, 230, and 231 of amino acids 25 to 248 of SEQ ID NO: 2, (b) one or more deletions corresponding to positions 192, 197, and 226 of amino acids 25 to 248 of SEQ ID NO: 2; and (c) an insertion between positions corresponding to positions 224 and 225 of amino acids 25 to 248 of SEQ ID NO: 2. The present invention further relates to nucleotide sequences encoding microbial trypsin variants having chymotrypsin-like activity; nucleic acid constructs, expression vectors, and recombinant host cells comprising such nucleotide sequences; and methods of producing microbial trypsin variants having chymotrypsin-like activity or a precursor thereof."
623,US-10552698-B2,System for multiple algorithm processing of biometric data ,2002,"A system performs processing of biometric information to create multiple templates. This allows biometric systems to be flexible and interact with a plurality of vendors' technologies. Specifically, a biometric sample is captured from a sensor and transmitted to a processing component. The biometric sample is then processed by a first algorithm to yield a biometric template and the template is stored and associated with a record identifier. The biometric sample is also processed by a second algorithm to yield a second template. The second template is stored and associated with the record identifier."
624,US-6974082-B2,Hardware integration system ,2002,"An integrated marking system is described wherein means for marking or encoding information, preferably in the form of a plurality of machines, are linked and controlled in conjunction with means for processing information. Essentially, the means for processing information can be a software program, implemented via a single computer or a computer network. Likewise, the means for linking and controlling the aforementioned machines is possible via the software in conjunction with the same computer or network. Despite the numerous advantages provided by this system, this level of functionality and control was heretofore unseen in the marking industry."
