row_id,id,title,year,abstract
2501,US-8605808-B2,Method to detect data transmitted by multiple antennas ,2008,"Disclosed is a method and system to detect data transmitted by multiple transmit antennas. The method comprises selecting a starting data block that is either a random data block or an output data block from known detectors. Also, the method comprises changing each symbol of the starting data block one symbol at a time to identify a data block which has minimum euclidean distance from the starting data block as detected data block. Next, changing two symbols of the detected data block at a time to identify a data block which has minimum euclidean distance from the starting data block as second data block and assigning the second data block as the starting data block. Repeating the above steps, if the minimum euclidean distance of second data block is better than that of the detected data block, and determining the detected data block as the data transmitted."
2502,US-8541732-B2,Optical module having a multifocal optical system with an additional optical element for covering a far range and a near range in one image ,2008,"The invention relates to an optical module having a semiconductor element (4) with a surface that is sensitive to electromagnetic radiation and with an objective lens (1) for the projection of electromagnetic radiation onto the sensitive surface of the semiconductor element (4), in particular for the use thereof in motor vehicles. An additional optical element (11) is arranged in a defined partial volume in the space between the objective lens (1) and the sensitive surface of the semiconductor element (4) so that, by the additional optical element (11), a first distance range (8) is imaged in a first region of the sensitive surface of the semiconductor element (4) and a second distance range (9) is imaged in a second region of the visual range where the additional optical element (11) is not located."
2503,US-8137283-B2,Method and apparatus for retrieval of similar heart sounds from a database ,2008,The present invention exploits a visual rendering of heart sounds and models the morphological variations of audio envelopes through a constrained non-rigid translation transform. Similar heart sounds are then retrieved by recovering the corresponding alignment transform using a variant of shape-based dynamic time warping.
2504,US-8670592-B2,Clear path detection using segmentation-based method ,2008,"A method for detecting a clear path of travel for a vehicle by segmenting an image generated by a camera device located upon the vehicle includes monitoring the image, analyzing the image with a plurality of analysis methods to segment a region of the image that cannot represent the clear path of travel from a region of the image that can represent the clear path of travel, defining the clear path of travel based upon the analyzing, and utilizing the clear path of travel to navigate the vehicle."
2505,US-8265922-B2,Method and apparatus for applying translation memory in automatic translation system ,2008,"A translation-memory application method for automatic translation includes: generating TM-expanded forms by applying TM expansion rules respectively to source sentences whose morphemes have been analyzed; storing in an expanded TM database translated sentences corresponding to the generated TM-expanded source sentences; analyzing morphemes if an input sentence does not match any of the source sentences stored in basic TM database; generating a TM-expanded form by applying pertinent ones among the TM expansion rules to the input sentence whose morphemes have been analyzed; and producing, if the TM-expanded input sentence matches one of the TM-expanded source sentences stored in the expanded TM database, a translated output corresponding to the matched TM-expanded source sentence."
2506,ES-2349526-B1,AUTOMATIC SALES MACHINE WITH RECOGNITION FUNCTION OF THE USER IDENTITY. ,2008,"Automatic sales machine with function User identity recognition. The automatic machine for the sale of items controlled includes a main unit, a control unit of cards, a unit for bill acceptance and a unit for the acceptance of coins. The main unit has installed on its front face multiple display compartments of the items to sell, and an opening for the exit of said items near their bottom edge. The card reader unit It has a slot on the front panel of the main unit and a recognition module and image sensor to recognize the user identity The bill acceptance unit has a card or bill insertion slot, a device transmission for the passage of each inserted ticket or card, and a recognition device to recognize the authenticity of same."
2507,US-7962438-B2,Suggesting concept-based domain names ,2008,"Methods and systems of the present invention allow for displaying suggested concept-based results. An exemplary method may comprise the steps of receiving a domain name, determining from ontological calculations suggested domain names related to the concept of the domain name and displaying the suggested domain names."
2508,US-8699956-B2,Polyphase sequences for wireless communications ,2008,"Polyphase sequence generation is provided for sequences having good aperiodic correlation properties. The sequences can allow lengths not attainable by other types of sequences (such as Frank sequences) and can yield increase merit factors and more desirable peak-to-side-peak ratios (and therefore decreased sidelobe energy) than other sequences (such as Chu sequences). Perfect root-of-unity sequences of lengths up to 32, achieving the minimum phase alphabets and the maximum merit factors and/or peak-to-side-peak ratios, are searched, and the results are tabulated. Comparing the merit factors and peak-to-side-peak ratios of the best search results to other sequences, a common construction pattern of the improved sequences of length 2m2are obtained. The improved sequences can be utilized in a variety of configurations, including spread spectrum communication, radar, channel estimation, system identification, and/or the like."
2509,US-8255351-B2,System and method for fault prediction in home network ,2008,"A system for fault prediction in a home network includes: a context generator for generating context information based on status data collected in real time about components of the home network; a specification interpreter for generating knowledge rules for fault detection by using specifications of the components of the home network; a context analyzer for analyzing if the context information meet the knowledge rules to classify the context information into normal situation contexts and abnormal situation contexts; a context pattern learner for generating new knowledge rules based on the abnormal situation contexts and fault rules corresponding to the abnormal situation contexts; a knowledge rule database for storing and managing the knowledge rules and the new knowledge rules; and a fault predictor for analyzing a correlation between the knowledge rules or the new knowledge rules and the generated context information, thereby predicting faults to be generated."
2510,DE-102008027016-B4,Method and device for analyzing noises of a motor vehicle ,2008,"Method for the analysis of noises, which are generated by an internal combustion engine of a motor vehicle, the method comprising the steps of: determining, from a waveform of a time-dependent measured signal for structure-borne noise and / or airborne sound, a plurality of modulation frequency spectrums Pm (n, m) by means of a Fourier transform; Calculating a modulation index (Pmi) characteristic of the modulation in the modulation frequency spectrums Pm (n, m); and calculating, from the plurality of modulation frequency spectrums, a parameter characteristic of the noise to be analyzed in real-time during operation of the motor vehicle, wherein said characteristic parameter is calculated based on values of the modulation index (Pmi)."
2511,US-8005862-B2,Classifying content resources using structured patterns ,2008,Methods and apparatus are described for classifying content resources in a data set according to an external classification scheme using structural patterns associated with the data set.
2512,US-9020705-B2,Biological signal measuring device and biological state analyzing system ,2008,"A configuration is adopted where elastic members made of expanded rein beads and having a size covering air cushions are disposed between a skin member and the air cushions of a human body supporting device. By arranging a plurality of elastic members made of expanded rein beads and in a stacking manner, preferably, arranging two elastic members made of expanded resin beads, spring constants of the elastic members obtained from load-deflection characteristics when they are pressed to a deflection amount of 1 mm by a pressing plate with a diameter of 30 mm being higher than that of the air cushion and being different from each other, a biological signal can be transmitted to the air cushions without damping the biological signal, though the elastic members made of expanded rein beads and are provided."
2513,US-9946782-B2,System and method for message clustering ,2008,"The disclosure describes systems and methods delivering communications associated with delivery conditions in which the occurrence of the delivery condition is determined by monitoring information received from a plurality of sources via multiple communication channels. The message delivery systems allow messages to be delivered to any “Who, What, When, Where” from any “Who, What, When, Where” upon the detection of an occurrence of one or more “Who, What, When, Where” delivery conditions. A message (which may be any data object including text-based messages, audio-based message such as voicemail or other audio such as music or video-based prerecorded messages) is delivered in accordance with delivery conditions based on any available data, including topical, spatial, temporal, and/or social data. Furthermore, because the systems coordinate delivery of messages via multiple communication channels and through multiple devices, the communication channel for delivery of a message may be dynamically determined based on the delivery conditions."
2514,DE-102008003081-B4,Method and device for crash classification for a vehicle safety system ,2008,"A crash classification method for a vehicle safety system which, based on a machine learning process, classifies a currently determined driving situation as to whether there is a first crash class (K1) requiring activation of at least one personal protection device (7) of the vehicle safety system (5) or if a second crash class ( K2) is present, which does not require activation of the at least one passenger protection device (7) of the vehicle safety system (5), wherein at least one optimized classification parameter (3) is generated during the machine learning process based on a training process with at least one predetermined input data set, and wherein the crash classes (K1, K2) are defined by predetermined crash characteristics (M1, M2, .., Mn), characterized in that at least one characteristic variable (2) is extracted during the machine learning process with a physical substitute model (10) of the vehicle from sensor data (1) where the at least one extracted characteristic quantity (2) relates to at least two crash characteristics (M1, M2,..., Mn) and is specifically integrated into the training process for generating the optimized classification parameters (3), based on the at least one characteristic variable (2) a search space of the machine learning process is restricted, wherein to limit the search space, a feature space of the at least two crash features (M1, M2, .., Mn) is subdivided into suitable subspaces as a function of the at least one characteristic variable (2) Depending on current values of the at least two crash characteristics (M1, M2, .., Mn) a corresponding subspace is selected, wherein within the selected subspace based on the at least one characteristic size (2) search space boundaries are determined, and wherein within the determined search space boundaries Optimization algorithm for generating the at least one optimized classification parameter (3) is executed, which separates the at least two crash classes (K1, K2)."
2515,US-8831554-B2,Management of a multi-application mobile carrier tree ,2008,"Efficient utilization and management of integrated mobile base station carrier trees is provided herein. Such trees provide an organizational structure for allocating calls in a code division, tone division, time division and/or like mobile infrastructure. Calls can be allocated to portions of the carrier tree as a function of characteristic(s) associated with the call. Accordingly, like calls are grouped within the carrier tree with like calls. In addition, portions of the carrier tree can be re-allocated to different types of traffic to meet fluctuations in traffic demand. Further, calls can be re-packed from existing segments of the carrier tree to other segments to maintain calls having common characteristics in contiguous groups, and to maintain idle segments another contiguous group(s). Accordingly, the wireless carrier tree can be packed and managed more efficiently, providing greater throughput and reduced contention for resources."
2516,US-8443329-B2,Trustworthy structural synthesis and expert knowledge extraction with application to analog circuit design ,2008,"A system and method that does trustworthy multi-objective structural synthesis of analog circuits, and extracts expert analog circuit knowledge from the resulting tradeoffs. The system defines a space of thousands of possible topologies via a hierarchically organized combination of designer-trusted analog building blocks, the resulting topologies are guaranteed trustworthy. The system can perform a search based on a multi-objective evolutionary algorithm that uses an age-layered population structure to balance exploration vs. exploitation, with operators that make the search space a hybrid between vector-based and tree-based representations. A scheme employing average ranking on Pareto fronts is used to handle a high number of objectives. Good initial topology sizings are quickly generated via multi-gate constraint satisfaction. To explicitly capture expert analog design knowledge, data mining is employed on the sized circuits to: automatically generate a decision tree for navigating from performance specifications to topology choice, to do global nonlinear sensitivity analysis, and to generate analytical models of performance tradeoffs."
2517,US-9646074-B2,Method for discovering relationships in data by dynamic quantum clustering ,2008,"Data clustering is provided according to a dynamical framework based on quantum mechanical time evolution of states corresponding to data points. To expedite computations, we can approximate the time-dependent Hamiltonian formalism by a truncated calculation within a set of Gaussian wave-functions (coherent states) centered around the original points. This allows for analytic evaluation of the time evolution of all such states, opening up the possibility of exploration of relationships among data-points through observation of varying dynamical-distances among points and convergence of points into clusters. This formalism may be further supplemented by preprocessing, such as dimensional reduction through singular value decomposition and/or feature filtering."
2518,US-8799926-B1,Active node detection in a failover computing environment ,2008,"A method, system, and medium are provided for determining whether a program (e.g., a queue manager) is currently an active program in a failover computing environment. A failover environment includes pairs of programs capable of performing the same functions. One program in the pair is the primary program and the other is the backup program. Only one of the two programs is active at any given time. Embodiments of the present invention may determine whether a program is active by looking for a core configuration file in the file directory associated with the program. The program only has access to the core configuration file when the program is active. The activation status of a program may be communicated to other components that monitor the program so that the program's activity or lack of activity can be correctly interpreted."
2519,US-8756190-B2,Apparatus and a method for automatic treatment adjustment after nervous system dysfunction ,2008,The present invention relates to an apparatus for automatic adjustment of a treatment of a target person to be treated based on calculated recovery prediction data for predicting a change of a sensory function of said target person in response to said treatment.
2520,US-8351650-B2,Foreground action estimating apparatus and foreground action estimating method ,2008,"The present invention provides a foreground action estimating apparatus and a foreground action estimating method, wherein the foreground action estimating apparatus includes: a training image inputting means for inputting a foreground image, a background image and an image having the foreground and background images as training images; a basis matrix calculating means for calculating a foreground basis matrix and a background basis matrix by respectively extracting a foreground feature and a background feature from the foreground image and the background image, respectively, and combining the foreground basis matrix and the background basis matrix to obtain a combined basis matrix; a feature suppressing means for calculating the feature coefficients of the training images in accordance with the combined basis matrix obtained by the basis matrix calculating means so as to obtain image features of the background-feature-suppressed training images; and a foreground action information acquiring means for estimating foreground action information in accordance with a feature mapping matrix from the image feature to an action information set, by using the background-feature-suppressed image features."
2521,US-8358336-B2,"Frontal hand capture of fingerprints, palm prints and hand geometry using contactless photography ",2008,"The present invention is a system and method that captures hand geometry, full-length fingerprints, and/or palm prints from a frontal view of a freely posed hand using contactless photography. A system and method for capturing biometric data of a hand includes the steps of and means for (a) digitally photographing a designated contactless capture area not having any predefined hand-positioning structures or platen for receiving a hand, to obtain a captured image of the capture area that includes a naturally-posed hand; (b) extracting a frontal hand image of the naturally-posed hand by applying an Active Appearance Model (AAM) to the captured image; (c) computing a plurality of hand geometry measurements of the frontal hand image; and (d) comparing the plurality of hand geometry measurements from the frontal hand image to corresponding existing hand geometry measurements, wherein the comparison results in a best match."
2522,US-8219577-B2,Apparatus and method product for presenting recommended information ,2008,"A recommended information presentation apparatus, including a display unit which displays text data, an extraction unit which extracts keyword candidates from the text data, a storage unit which stores semantic attributes of the keyword candidates, semantic attribute rules which contain scoring criteria for semantic attributes, descriptive phrases describing the keyword candidates and descriptive phrase rules which contain scoring criteria for descriptive phrases. The scores of the keyword candidates are calculated by a selection unit based on the semantic attribute rules and descriptive phrase rules and the highest scoring keyword candidates are selected as keywords. The selected keyword is used to search an information database by a search unit which also receives the search results which are displayed on the display unit by a control unit as recommended information with regards to the text information."
2523,US-9996844-B2,Age-targeted online marketing using inferred age range information ,2008,Particular embodiments of the invention are directed to generating marketing-based age range products based at least on inferred data regarding the age of various network users. The age range products may be used for age-targeted online marketing.
2524,US-8690769-B2,Metabolic energy monitoring system ,2008,"A metabolic energy monitoring system having one or more physiological measurement platforms and displays enabling the calculation and display of energy balance, kilocalorie energy expenditure and kilocalorie intake is described. In preferred embodiments, the system utilizes one or more on-body monitoring platforms to enable measurement of change in body composition and kilocalorie energy expenditure over a period of time thereby enabling a comparator to calculate net energy balance over this period of time and to calculate kilocalorie intake over this same period of time. Such data may then be displayed on a display device in wireless communication with the on-body monitoring platform to provide the user of the system with useful information and guidance in weight management applications."
2525,US-8799801-B2,Interactive ticker ,2008,Ticker functionality provides filtering and displaying information relevant to a user. The ticker can be employed to parse information from a broadcast stream and insert the information into a ticker display area. The information presented in the display area can be animated in order to maximize and control the amount of information available to the user. The information offered in the ticker is interactive so that it allows the user to customize this abbreviated data and how the data is presented.
2526,US-8396620-B2,Patrol device and patrol path planning method for the same ,2008,"The present invention relates to a patrol device and a patrol path planning method. The patrol device includes an operating unit configured to establish a plurality of patrol paths, each of which has an Average Patrol Omission (APO) value and an Average Patrol Quality (APQ) value, and to determine an optimum patrol path from the plurality of patrol paths according to the APO value and the APQ value; and a moving unit configured to move along the optimum patrol path. The method includes providing a plurality of patrol paths, each of which has an Average Patrol Omission (APO) value and an Average Patrol Quality (APQ) value; and evaluating the plurality of patrol paths according to the respective APO values and the respective APQ values so as to select an optimum patrol path therefrom."
2527,US-8643644-B2,Multi-stage tessellation for graphics rendering ,2008,"This disclosure describes a multi-stage tessellation technique for tessellating a curve during graphics rendering. In particular, a first tessellation stage tessellates the curve into a first set of line segments that each represents a portion of the curve. A second tessellation stage further tessellates the portion of the curve represented by each of the line segments of the first set into additional line segments that more finely represent the shape of the curve. In this manner, each portion of the curve that was represented by only one line segment after the first tessellation stage is represented by more than one line segment after the second tessellation stage. In some instances, more than two tessellation stages may be performed to tessellate the curve."
2528,US-8238563-B2,"System, devices and methods for predicting the perceived spatial quality of sound processing and reproducing equipment ",2008,"The present invention relates to a method and corresponding system for predicting the perceived spatial quality of sound processing and reproducing equipment. According to the invention a device to be tested, a so-called device under test (DUT), is subjected to one or more test signals and the response of the device under test is provided to one or more means for deriving metrics, i.e. a higher-level representation of the raw data obtained from the device under test. The derived one or more metrics is/are provided to suitable predictor means that “translates” the objective measure provided by the one or more metrics to a predicted perceived spatial quality. To this end said predictor means is calibrated using listening tests carried out on real listeners. By means of the invention there is thus provided an “instrument” that can replace expensive and time consuming listening tests for instance during development of various audio processing or reproduction systems or methods."
