row_id,id,title,year,abstract
6371,US-11681364-B1,Gaze prediction ,2021,"An image processing system may receive image data from a camera of a user device and perform gaze prediction processing of the image data to predict one or more gaze patterns. The gaze prediction processing may include processing the image data using a neural network to detect faces and/or objects and generate an image feature map. The gaze prediction processing may include performing gaze direction prediction operations using the feature map and detected faces and/or objects to determine gaze direction probability data. The gaze prediction processing may include predicting a gaze pattern based on the gaze direction probability data and the image feature map. The gaze pattern may be short-term (e.g., atomic-level) or long-term (e.g., event-level)."
6372,US-11853696-B2,Automated text amendment based on additional domain text and control text ,2021,Aspects of the present disclosure provide techniques for automated text amendment. Embodiments include identifying a first plurality of n-grams in first text associated with a domain. Embodiments include identifying a second plurality of n-grams in second text associated with the domain. Embodiments include identifying a third plurality of n-grams in third text that is not associated with the domain. Embodiments include determining candidate n-grams that are overexpressed in the second plurality of n-grams compared to the third plurality of n-grams. Embodiments include determining a match between a candidate n-gram of the candidate n-grams and a given n-gram of the first plurality of n-grams based on one or more matching factors. Embodiments include amending the first text based on the match between the candidate n-gram and the given n-gram.
6373,US-11790885-B2,Semi-structured content aware bi-directional transformer ,2021,"A method, computer system, and a computer program product for natural language processing are provided. A first text corpus that includes semi-structured content that includes hierarchical nodes may be received. Some of the hierarchical nodes may be masked. Node embeddings and level embeddings may be generated from the semi-structured content of the first text corpus and from the masked hierarchical nodes. The node embeddings and the level embeddings may be included in a bi-directional transformer model. The bi-directional transformer model may be trained on the first text corpus by reducing loss from the bi-directional transformer model predicting the masked hierarchical nodes."
6374,US-11657260-B2,Neural network hardware accelerator data parallelism ,2021,"Neural network hardware acceleration data parallelism is performed by an integrated circuit including a plurality of memory banks, each memory bank among the plurality of memory banks configured to store values and to transmit stored values, a plurality of computation units, each computation unit among the plurality of computation units including a processor including circuitry configured to perform a mathematical operation on an input data value and a weight value to produce a resultant data value, and a computation controller configured to cause a value transmission to be received by more than one computation unit or memory bank."
6375,US-11556335-B1,Annotating program code ,2021,"Annotating programming code by receiving a first version of programming code, determining annotations for the code according to a first machine learning model, identifying a user, altering a generative model according a persona of the user, and generating altered annotations using the altered generative model."
6376,US-12039269-B2,Domain adaptation of AI NLP encoders with knowledge distillation ,2021,"Systems, methods, devices, instructions, and other examples are described for natural language processing. One example includes accessing natural language processing general encoder data, where the encoder data is generated from a general-domain dataset that is not domain specific. A domain specific dataset is accessed and filtered encoder data using a subset of the encoder data is generated. The filtered encoder data is trained using the domain specific dataset to generate distilled encoder data, and tuning values for the distilled encoder data are generated to configure task outputs associated with the domain specific dataset."
6377,US-12008058-B2,Classifying relevance of natural language text for topic-based notifications ,2021,"Aspects of the disclosure include a natural language processing model by which topics of interest within a text are identified, such as by a predictive model that infers (e.g., based on scores associated with a text) a topic of interest associated with the text. The computer system may train or configure the prediction model, such as a machine learning model, to facilitate identification of topics of interest based on inputs, like one or more chunks of text, such as by keywords or phrases or combinations of keywords and associated metrics for nearness or frequency. The computer system may determine a measure of predicted impactfulness of the content item in relation to a topic of interest identified for the content item and determine whether to generate a notification transmitted to client devices of users having indicated the topic as of interest."
6378,US-11693570-B2,Machine learning to improve caching efficiency in a storage system ,2021,"A system and method improve caching efficiency in a data storage system by performing machine learning processes on metadata relating to extents of data blocks, rather than individual blocks themselves. Thus, once the storage devices are divided into extents, various metadata regarding access to the blocks within each extent are aggregated, and per-extent features are extracted. These features are used to train a data regression model that is subsequently used to infer a most likely “hotness” value for each extent at a future time. These predicted values, which may be further classified as e.g. “hot”, “warm”, and “cold” using thresholds, are used to implement the cache replacement policy. Embodiments scale to large and multi-layered caches, and may avoid common caching problems like thrashing, by adjusting the extent size. Policy goal functions may be optimized by dynamically adjusting the classification thresholds."
6379,US-12033193-B2,Machine-learning driven pricing guidance ,2021,"A data processing system for machine-learning driven price guidance implements obtaining location information indicative of a location associated with a user; obtaining prescription information for a first prescription and first cost prescription; obtaining, from one or more pharmacy benefits managers, prescription cost information for a prescription from a plurality of pharmacies; analyzing the prescription cost information, the location associated with the user, and the prescription information using a machine learning model to obtain a prescription cost information prediction indicating that a first subset of the plurality of pharmacies provide the prescription at a second prescription cost lower than the first prescription cost; providing the prescription cost information prediction to a pharmacy recommendation unit as an input; generating a prescription savings opportunity report that presents the prescription cost information; and causing a user interface of a display of a computing device to present the prescription savings opportunity report."
6380,US-11338131-B1,Guiding implantation of an energy delivery component in a body ,2021,"A system for guiding implantation of an energy delivery component of a cardiac pacing device at a fixation location within a heart of a patient is provided. During a procedure to implant an energy pulse delivery component, the system receives a patient cardiogram collected during pacing of the energy pulse delivery component while the energy pulse delivery component is positioned at a current location within the heart. The system then determines based on the patient cardiogram the current location of the energy pulse delivery component. The system then outputs an indication of the current location to guide affixing of the energy pulse delivery component at the intended fixation location. This process is repeated until the energy pulse delivery component is at the fixation location. The system also evaluates the effectiveness of pacing at intermediate location to optimize the final location based upon simulated electro-mechanics of the system in near-real time."
6381,NL-2027519-B1,A food processing line and method for controlling a food processing line ,2021,"The present invention relates to a the processing line and a method for controlling a food 5 processing line, the food processing line comprising a plurality of processing stations and at least one utility supply station. Further at least one food product sensor is provided, and at least one utility sensor and at least one processing sensor. A processing line controller is provided comprising a data collection module, input means for specifying at least one desired food product output characteristic, input means for specifying a nominal operating condition, an 10 anomaly detection module configured to detect an anomaly, and a root cause module configured to determine a root cause of the detected anomaly. A corrective measure module is configured to determine a corrective measure in response to a detected anomaly and to provide the corrective measure to at least one physical actuator."
6382,US-11869507-B2,"Methods, systems and apparatuses for improved speech recognition and transcription ",2021,"Methods, systems, and apparatuses for improved speech recognition and transcription of user utterances are described herein. A user utterance may be processed by a speech recognition computing device. One or more acoustic features associated with the user utterance may be used to determine whether one or more actions are to be performed based on a transcription of the user utterance."
6383,US-11875496-B2,Dimension estimation using duplicate instance identification in a multiview and multiscale system ,2021,"A method for dimension estimation based on duplication identification. In some embodiments, the method includes receiving a set of images of an object. The method then includes detecting, using a first machine learning system trained to perform image segmentation, a first image segmentation representing a damage of the object on a first image and a second image segmentation representing a damage of the object on a second image. The method further includes determining, using a second machine learning system trained to perform dimension estimation, a first dimension for the damage represented by the first image segmentation and a second dimension for the damage represented by the second image segmentation. The method includes determining whether the first and second image segmentations represent a same damage. If these image segmentations represent the same damage, the method intelligently combines the first and second dimensions to obtain a final dimension for the damage."
6384,US-11475225-B2,"Method, system, electronic device and storage medium for clarification question generation ",2021,"A method, a device and electronic device for clarification question generation are provided in one or more embodiments of this disclosure. The method includes: extracting entity information from a fuzzy context input by a user; inputting the fuzzy context into a template generating module of a pre-built CQG neural network model so as to obtain a clarification question template; inputting the entity information into an entity rendering module of the CQG neural network model so as to obtain at least one entity phrase; and generating a clarification question for a fuzzy question based on the clarification question template and the at least one entity phrase for presenting to the user."
6385,US-11543890-B2,Custom gesture collection and recognition system having machine learning accelerator ,2021,"A custom gesture collection and recognition system having a machine learning accelerator includes a transmission unit, a first reception chain, a second reception chain, a customized gesture collection engine and a machine learning accelerator. The transmission unit transmits a transmission signal to detect a gesture. The first reception chain receives a first signal and generates first feature map data corresponding to the first signal. The second reception chain receives a second signal and generates second feature map data corresponding to the second signal. The first signal and the second signal are generated by the gesture reflecting the transmission signal. The customized gesture collection engine generates gesture data according to at least the first feature map data and the second feature map data. The machine learning accelerator performs machine learning with the gesture data. The accuracy and correctness of gesture recognition may be improved by means of machine learning."
6386,US-11930302-B2,Enhanced sensor operation ,2021,"A two-dimensional image of a vehicle occupant in a vehicle is collected. The collected two-dimensional image is input to a machine learning program trained to output one or more reference points of the vehicle occupant, each reference point being a landmark of the vehicle occupant. One or more reference points of the vehicle occupant in the two-dimensional image is output from the machine learning program. A location of the vehicle occupant in an interior of the vehicle is determined based on the one or more reference points. A vehicle component is actuated based on the determined location. For each of the one or more reference points, a similarity measure is determined between the reference point and a three-dimensional reference point, the similarity measure based on a distance between the reference point and the three-dimensional reference point."
6387,US-11604513-B2,Methods and systems for individualized content media delivery ,2021,"Aspects relate to systems and methods for individualized content media delivery. An exemplary system includes a sensor configured to detect a biofeedback signal as a function of a biofeedback of a user, a display configured to present content to the user, and a computing device configured to control an environmental parameter for an environment surrounding the user as a function of the biofeedback signal, wherein controlling the environmental parameter additionally includes generating an environmental machine-learning model as a function of an environmental machine-learning algorithm, training the environmental machine-learning model as a function of an environmental training set, wherein the environmental training set comprises biofeedback inputs correlated to environmental parameter outputs and generating the environmental parameter as a function of the biofeedback signal and the environmental machine-learning model."
6388,US-11731657-B2,Malicious event detection for autonomous vehicles ,2021,"A system comprises an autonomous vehicle (AV) and a control device operably coupled with the AV. The control device detects a series of events within a threshold period of time, where a number of series of events in the series of events is above a threshold number. The series of events taken in the aggregate within the threshold period of time deviates from a normalcy mode. The normalcy mode comprises events that are expected to the encountered by the AV. The control device determines whether the series of events corresponds to a malicious event, where the malicious event indicates tampering with the AV. In response to determining that the series of events corresponds to the malicious event, the series of events are escalated to be addressed."
6389,US-11663320-B2,System and methods for automated software analysis and classification ,2021,"Embodiments of the invention are directed to systems, methods, and computer program products for creating an effective baseline for controlling software and programs running on a user device or virtual machine environment of an enterprise network. Historical data may be used to train one or more iterative machine learning processes for intelligently identifying relevant program characteristics and aiding or automating a determination as to a software or program's need, usage, redundancy, or security. Determinations regarding software or program classifications may be used for further review or automated control of software or program execution within a network environment."
6390,US-11631195-B2,Indoor positioning system and indoor positioning method ,2021,"An indoor positioning system and method are provided. The indoor positioning method includes: establishing an image database through a BIM model of a target area, and using a trained deep learning model to extract features of a virtual image; after obtaining a captured image in the target area, using the trained deep learning model to extract features thereof, and performing similarity matching with the image database to calculate a spatial position of a most similar image; calculating the most similar image and its essential matrix through multiple sets of feature points, and obtaining capturing positions and capturing pose parameters as positioning results; projecting the BIM model to a tracking captured image, and updating the positioning results and the capturing pose parameters with a visual inertial odometer; and continuously correcting the positioning results and the capturing pose parameters by detecting horizontal and vertical planes from the tracking captured image."
6391,US-12063948-B2,Method and system for foodservice with instant feedback ,2021,"Methods, systems, and apparatuses, including computer programs encoded on computer storage media, for automated foodservice are described. An example method includes receiving one or more images from one or more cameras capturing a food container comprising a plurality of compartments; determining, using a first machine learning model based on the one or more images, a user action comprising a user taking food from a first compartment of the plurality of compartments; receiving a plurality of pieces of weight sensor data from a plurality of weight sensors coupled to a frame hosting the food container; determining, using a second machine learning model based on the plurality of pieces of weight sensor data, a second compartment of the plurality of compartments; in response to the first compartment being the same as the second compartment, displaying the weight and the food information of the food taken by the user."
6392,US-11886359-B2,AI accelerator apparatus using in-memory compute chiplet devices for transformer workloads ,2021,"An AI accelerator apparatus using in-memory compute chiplet devices. The apparatus includes one or more chiplets, each of which includes a plurality of tiles. Each tile includes a plurality of slices, a central processing unit (CPU), and a hardware dispatch device. Each slice can include a digital in-memory compute (DIMC) device configured to perform high throughput computations. In particular, the DIMC device can be configured to accelerate the computations of attention functions for transformer-based models (a.k.a. transformers) applied to machine learning applications. A single input multiple data (SIMD) device configured to further process the DIMC output and compute softmax functions for the attention functions. The chiplet can also include die-to-die (D2D) interconnects, a peripheral component interconnect express (PCIe) bus, a dynamic random access memory (DRAM) interface, and a global CPU interface to facilitate communication between the chiplets, memory and a server or host system."
6393,US-11922946-B2,Speech transcription from facial skin movements ,2021,"Systems and methods are disclosed for determining textual transcription from minute facial skin movements. In one implementation, a system may include at least one coherent light source, at least one sensor configured to receive light reflections from the at least one coherent light source; and a processor configured to control the at least one coherent light source to illuminate a region of a face of a user. The processor may receive from the at least one sensor, reflection signals indicative of coherent light reflected from the face in a time interval. The reflection signals may be analyzed to determine minute facial skin movements in the time interval. Then, based on the determined minute facial skin movements in the time interval, the processor may determine a sequence of words associated with the minute facial skin movements, and output a textual transcription corresponding with the determined sequence of words."
6394,US-11461300-B2,Dynamic model server for multi-model machine learning inference services ,2021,"Implementations include receiving, by an application programming interface (API) server of a plurality of API servers, a prediction request from a client system, each of the plurality of API servers including a stateless server, selecting, by the API server, a model server from a plurality of model servers based on the prediction request, each of the plurality of model servers including a stateful server, calling, by the API server, the model server to execute inference using a ML model loaded to memory of the model server, receiving, by the API server, an inference result from the ML model, and sending, by the API server, the inference result to the client system."
6395,US-11839471-B2,Autoregulation monitoring using deep learning ,2021,"In some examples, a system is configured to determine, using a neural network algorithm of a cerebral autoregulation model, a cerebral autoregulation status of the patient based at least in part on a blood pressure of the patient over a period of time and regional cerebral oxygen saturation of the patient over the period of time."
6396,NL-2028640-B1,Robotized imaging system ,2021,"A system for echography is described wherein the system comprises: a robotic system configured to position and move a probe over a surface of a body part of a 5 object positioned on a support structure; a computer system and a user interface connected to the computer system for controlling the robotic system, the computer system comprising: a data generating module for generating training data for a plurality of target views, the data generating module being configured to receive a target position from the user interface and to store images associated with random positions relative to the target position as training 10 data on a storage medium; a training module for training a machine learning model, preferably a deep neural network, based on the training data, the machine learning model being trained to receive an image from the probe and to determine based on the received image a position prediction associated with a target view; and, a robot controller for controlling the robotic system configured to receive the position prediction from the trained 15 machine learning model and to move the probe towards the target view. + Fig. 1"
6397,US-11734522-B2,Machine learning enabled text analysis with support for unstructured data ,2021,A method for analyzing an electronic document including structured data and unstructured data may include applying a machine learning model to determine whether one or more rows of the electronic document correspond to a header row. The machine learning model may be trained to determine whether one or more cells of a row corresponds to a header field by determining whether a text value included in the cells corresponds to an entity. A row may be identified as a header row based on an output of the machine learning model indicating more than a threshold quantity of cells included in the row correspond to a header field. At least a portion of the structured data included in the electronic document may be extracted based on the entity included in the cells of the row identified as the header row. Related systems and computer program products are also provided.
6398,US-11250637-B1,Multimodal 3D deep learning fusion system and method for reducing the need of 3D training dataset of 3D object tracking for enterprise digital twin mixed reality ,2021,"A mixed reality (MR) system and method performs three dimensional (3D) tracking using 3D deep neural network structures in which multimodal fusion and simplified machine learning to only cluster label distribution (output of 3D deep neural network trained by generic 3D benchmark dataset) is used to reduce the training data requirements of to directly train a 3D deep neural network structures for non-generic user case. In one embodiment, multiple 3D deep neural network structures, such as PointCNN, 3D-Bonet, RandLA, etc., may be trained by different generic 3D benchmark datasets, such as ScanNet, ShapeNet, S3DIS, inadequate 3D training dataset, etc."
6399,US-11615345-B2,Systems and methods for optimizing a machine learning model ,2021,"A system for optimizing a machine learning model. The machine learning model generates predictions based on at least one input feature vector, each input feature vector having one or more vector values; and an optimization module with a processor and an associated memory, the optimization module being configured to: create at least one slice of the predictions based on at least one vector value, determine at least one optimization metric of the slice that is based on at least a total number of predictions for the vector value, and optimize the machine learning model based on the optimization metric."
