row_id,id,title,year,abstract
4869,US-11226831-B2,Customizing content based on predicted user preferences ,2016,"A system provides content describing an object, for example, a physical object or a customizable service. The system presents an interactive user interface displaying a customized version of a physical object. The interactive user interface allows the user to further customize the physical object. The user interface displays a plurality of options for customizing various components of the physical object. The system customizes the physical object presented via the interactive user interface based on the user profile and user interactions of the user with other users via an online system. The system allows the user to further customize the physical object via the interactive user interface. The interactive user interface presents various options for customization of the physical object based on predicted user preferences."
4870,US-10747758-B2,Methods and systems for identifying an information resource for answering natural language queries ,2016,"A media guidance application may detect that results provided in response to a natural language query entered by the user are not relevant to the user. The media guidance application may then identify a media asset type and a media asset name that corresponds to the natural language query. Based on the media asset type and the media asset name, the media guidance application may select an information resource, transmit the natural language query to the information resource, and retrieve and generate for display an answer to the natural language query from the information resource."
4871,US-11082433-B2,System and method of analyzing and authenticating scenarios and actions that are taking place in a plant or a factory ,2016,"The present invention discloses a system and a method for analyzing and authenticating scenarios and actions that are taking place in a plant or a factory. Said analysis comprising the steps of: monitoring a plurality of data streams, originating from a plurality of independent sources within the plant. Said sources including at least part of production machines, machine sub-units, and independent indicators and sensors within the plant. •correlating between two or more monitored data streams, each relating to a specific action occurring within the plant, but originating from different data sources, or are of different data types; •analyzing said data stream correlations; and •obtaining specific characteristics that indicate the occurrence of specific actions within the plant."
4872,US-9967693-B1,Advanced binaural sound imaging ,2016,"Monaurally-recorded mono or stereo recordings may be processed and converted into binaurally-recorded audio recordings. An analog process of performing this involves output of at least subsets of the monaurally-recorded recording, such as isolated instrument/vocal tracks, to be played to a dummy with two microphones. A digital process of performing this includes simulating audio input from simulated locations corresponding to audio sources. A neural network process of performing this includes training a neural network using speakers and microphones and then automating conversion from monaural audio to binaural audio based on the training of the neural network. The neural network can also be trained with output speakers to eliminate or reduce dead zones and/or speaker crosstalk."
4873,US-11449678-B2,"Deep learning based dialog method, apparatus, and device ",2016,"A deep learning based dialog method, apparatus, and device are provided and belong to the field of artificial intelligence. The method includes: obtaining a to-be-replied statement, encoding the to-be-replied statement to obtain a first vector , where the first vector is a representation of the to-be-replied statement; obtaining dialog history information corresponding to the to-be-replied statement, and the attention vector is used to represent search intent; making each dialog statement interact with the attention vector, so as to extract information related to the search intent from the dialog statement to obtain a plurality of result vectors, generating a to-be-decoded vector based on the plurality of result vectors, and decoding the to-be-decoded vector to obtain a next word in the reply statement. In the method, the reply statement refers to a dialog history."
4874,US-10733503-B2,Technologies for shifted neural networks ,2016,Technologies for using a shifted neural network include a compute device to determine a shift-based activation function of the shifted neural network. The shift-based activation function is a piecewise linear approximation of a transcendental activation function and is defined by a plurality of line segments such that a corresponding slope of each line segment is a power of two. The compute device further trains the shifted neural network based on shift-based input weights and the determined shift-based activation function.
4875,US-9760978-B1,Missing region prediction ,2016,"Missing region prediction techniques are described. In implementations, an image pair is obtained that includes first and second images. The first image is corrupted by removing a region of content, resulting in a corrupted image having a missing region. The corrupted image and the second image of the image pair are then used to generate a training-image pair. Then, based on a plurality of training-image pairs including the generated training-image pair, a model is trained using machine learning. The model can subsequently be used to predict pixel values of pixels within a subsequent missing region of a subsequent image that is not used as part of the training."
4876,US-10009364-B2,Gathering flow characteristics for anomaly detection systems in presence of asymmetrical routing ,2016,"In one embodiment, a first device in a network identifies a first traffic flow between two endpoints that traverses the first device in a first direction. The first device receives information from a second device in the network regarding a second traffic flow between the two endpoints that traverses the second device in a second direction that is opposite that of the first direction. The first device merges characteristics of the first traffic flow captured by the first device with characteristics of the second traffic flow captured by the second device and included in the information received from the second device, to form an input feature set. The first device detects an anomaly in the network by analyzing the input feature set using a machine learning-based anomaly detector."
4877,US-11468337-B2,System and methods for facilitating pattern recognition ,2016,"The present invention is directed to a system and methods by which the determination of pattern recognition may be facilitated. More specifically, the present invention is a system and methods by which a plurality of computations may be conducted simultaneously to expedite the efficient determination of pattern recognition."
4878,US-10692013-B2,Solar irradiation modeling and forecasting using community based terrestrial sky imaging ,2016,"Solar irradiation may be predicted based on input terrestrial sky images comprising cloud images, the terrestrial sky images taken from a plurality of geographic locations by a plurality of devices; for example, wherein the terrestrial sky images are crowd sourced from the plurality of devices. A model may be generated that predicts solar irradiation in a geographic area based on the input terrestrial sky images and the geographic locations from where the terrestrial sky images were taken. A signal representing the solar irradiation predicted by the model is output."
4879,US-10049279-B2,Recurrent networks with motion-based attention for video understanding ,2016,"A method of predicting action labels for a video stream includes receiving the video stream and calculating an optical flow of consecutive frames of the video stream. An attention map is generated from the current frame of the video stream and the calculated optical flow. An action label is predicted for the current frame based on the optical flow, a previous hidden state and the attention map."
4880,US-9720707-B1,Generating a set of user interfaces ,2016,"A device may communicate with a first server to obtain first information regarding a plurality of groups of entities. The device may process the first information to generate a data model relating to attributes of the plurality of groups of entities. The device may communicate with a second server to obtain second information regarding a particular group of entities. The device may process the second information using the data model to identify a set of recommendations relating to the particular group of entities. The device may select a particular recommendation, of the set of recommendations, based on a corresponding score of the set of scores. The device may generate a user interface including the particular recommendation based on selecting the particular recommendation. The device may communicate with a plurality of client devices to cause the particular recommendation to be provided for display."
4881,US-10817790-B2,Automated distractor generation by identifying relationships between reference keywords and concepts ,2016,"A method, system and computer-usable medium are disclosed for using a context dependency graph to automate the generation of an incorrect answer to a question suitable for a multiple choice exam. A reference corpus is used to generate a concept dependency graph that contains reference keywords and concepts associated with the subject domain of an input corpus. Relationships between the reference keywords and concepts within the concept dependency graph are identified. Once identified, they are used to process a set of input keywords and concepts extracted from the input corpus, and the reference keywords and concepts, to generate a set of distractor words. The resulting set of distractor words is then processed with a set of QA pairs associated with the input corpus to generate a set of multiple choice question-answers that include various distractor answers."
4882,US-11055883-B2,Magnetic resonance system and method for producing images ,2016,"A method, system, and computer-readable medium for producing images is described. The system comprises an input image providing unit for providing input images in which structures that are in fact spatially separated are represented in a spatially superimposed manner in at least one spatial direction. The system further comprises a neural network providing unit for providing a neural network which is adapted to produce, on the basis of input images in which structures that are in fact spatially separated are represented in a spatially superimposed manner in at least one spatial direction, output images in which the structures that are in fact spatially separated are represented in a spatially separated manner in the at least one spatial direction. Finally, an image producing unit produces images on the basis of the input images provided and the neural network provided."
4883,US-9736309-B1,Real-time transcription and interaction with a caller based on the transcription ,2016,"Receiving a telephone call to an auto-attendant, artificial intelligence, or person takes place. While this phone call is being conducted, a speech to text transcription is created and sent in real-time to another person at another network node. This person can read the transcript and interact with the phone call by sending his or her own commands, text, or speech to be made part of the phone call."
4884,US-10949223-B2,"Interface generation method, apparatus, and system ",2016,"The present disclosure relates to an interface generation method. In one example method, an interface generation apparatus obtains a service requirement of a user. The interface generation apparatus determines, based on the service requirement of the user, interface elements for implementing the service requirement and an association relationship between the interface elements for implementing the service requirement. The interface generation apparatus generates a user interface based on the interface elements for implementing the service requirement and the association relationship between the interface elements for implementing the service requirement."
4885,US-11520075-B2,Augmented geological service characterization ,2016,"Methods and systems for augmented geological service characterization are described. An embodiment of a method includes generating a geological service characterization process in response to one or more geological service objectives and a geological service experience information set. Such a method may also include augmenting the geological service characterization process by machine learning in response to a training information set. Additionally, the method may include generating an augmented geological service characterization process in response to the determination information."
4886,US-10475447-B2,Acoustic and domain based speech recognition for vehicles ,2016,"A processor of a vehicle speech recognition system recognizes speech via domain-specific language and acoustic models. The processor further, in response to the acoustic model having a confidence score for recognized speech falling within a predetermined range defined relative to a confidence score for the domain-specific language model, recognizes speech via the acoustic model only."
