row_id,id,title,year,abstract
7139,DE-102023102994-B3,Method for operating a motor vehicle and motor vehicle ,2023,"Method for operating a motor vehicle (1), comprising the steps:- Determining a maximum target speed (2),- Detecting an accelerator pedal position (3) of an accelerator pedal (4) of the motor vehicle (1) by an accelerator pedal sensor (5),- Determining control information (6) depending on the accelerator pedal position (3), the maximum target speed (2) and driver information (7), which shows a determined or expected actuation behavior of a driver (8) of the motor vehicle (1) when the accelerator pedal is actuated ( 4) concerns,- Controlling at least one drive motor (9) depending on the control information (6), the control information (6) in particular specifying a torque to be provided by the drive motor (9)."
7140,US-11937047-B1,Ear-worn device with neural network for noise reduction and/or spatial focusing using multiple input audio signals ,2023,"An ear-worn device may include two or more microphones configured to generate time-domain audio signals, each of the two or more microphones configured to generate one of the time-domain audio signals; processing circuitry comprising analog processing circuitry, digital processing circuitry, beamforming circuitry, and short-time Fourier transformation (STFT) circuitry, the processing circuitry configured to generate, from the time-domain audio signals, one or more frequency-domain non-beamformed audio signals and one or more frequency-domain beamformed signals; and enhancement circuitry comprising neural network circuitry configured to receive multiple frequency-domain input audio signals originating from the one or more frequency-domain non-beamformed audio signals and the one or more frequency-domain beamformed signals, and implement a single neural network trained to generate, based on the multiple frequency-domain input audio signals, a noise-reduced and spatially-focused output audio signal or an output for generating a noise-reduced and spatially-focused output audio signal."
7141,US-11979537-B1,Incorporation of source-identifying information in scanned documents ,2023,"An embedding component is described which embeds information in a scanned document. The embedding component includes a document acquisition component, which acquires a scanned document from an associated scanning device. An information acquisition component acquires variable information associated with the scanned document. An encoding component generates a machine-readable representation of the variable information. A pattern insertion component uses the machine-readable representation to insert at least one machine readable pattern in the scanned document, to generate a modified document. An output component outputs the modified document to an associated output device, such that when the modified document is rendered on print media, the machine-readable pattern is not noticeable to the unaided eye of a person. A processor implements the document acquisition component, information acquisition component, encoding component, pattern insertion component, and output component."
7142,US-12072863-B1,Data ingestion using data file clustering with KD-epsilon trees ,2023,"A data tree for managing data files of a data table and performing one or more transaction operations to the data table is described. The data tree is configured as a KD-epsilon tree and includes a plurality of nodes and edges. A node of the data tree may represent a splitting condition with respect to key-values for a respective key. A leaf node of the data tree may correspond to a data file for a data table that includes a subset of records having key-values that satisfy the condition for the node and conditions associated with parent nodes of the node. A parent node may correspond to a file including a buffer that stores changes to data files reachable by this parent node, and also includes dedicated storage to pointers of the child nodes. By using the data tree, the data processing system may efficiently cluster the data in the data table while reducing the number of data files that are rewritten."
7143,US-11947343-B1,System and method for optimizing industrial assembly processes ,2023,"A system and method for optimizing industrial assembly process in an industrial environment is disclosed. A system operates on artificial intelligence (AI) based conversational/GUI platform, where it receives user commands related to industrial assembly process improvement queries. By analyzing received user commands, system identifies type of industrial assembly process mentioned by extracting relevant keywords or other attributes. Using trained AI-based classification table, system determines performance attributes associated with identified type of process. The system leverages various sources such as domain knowledge, organization-specific knowledge bases, data from tools/internet-based services, and statistical measurements from industrial environment. Based on results from language model, system generates a response to user command, which can include insights on performance level of industrial assembly or packaging process, recommendations for improvements, and actuation commands for operating machinery in industrial environment. Finally, system outputs generated response on AI-based conversational/GUI platform in multiple representation forms."
7144,US-11987172-B1,Automatic control of high beam operation ,2023,"Methods, systems, and non-transitory computer readable media are configured to perform operations comprising determining a plurality of predetermined situations in which lighting operation of an ego vehicle should automatically transition; determining occurrence of a predetermined situation of the plurality of predetermined situations; and causing an automatic transition in lighting operation of the ego vehicle."
7145,US-11936015-B1,Battery event monitoring system for thermal managed battery ,2023,"The present invention provides a system and method for determining when a battery, or one or more batteries within a battery pack, undergoes an undesired thermal event such as thermal runaway. A sensor pack is mounted in close proximity to, or in contact with, an external surface of the battery or batteries to be monitored and communicates battery information, including battery compartment information, to a battery package monitor outside the battery compartment. Cloud connectivity can be provided via a mobile application to a battery thermal management package."
7146,US-11931118-B1,Robotic surgical system for remotely monitoring surgical robots ,2023,"Methods, apparatuses, and systems for providing updates to a surgical robot in which a surgical robot receives a notification that there is an update available or detects a new hardware component that has been attached to the surgical robot. The surgical robot then determines if it is currently in use or is inactive and if inactive the surgical robot downloads the latest update. Additionally, the system provides a process of remote monitoring of telesurgical robots for safety and redundancy, in which the surgical robot collects data representing at least one assistance parameter of the surgical robot during a surgical procedure. The data is assessed, and it is determined if non-surgical assistance is required and connecting the medical professional to a technician to resolve the potential issue."
7147,US-11902098-B1,Computerized systems and methods for adaptive device protection ,2023,"Disclosed are systems and methods that provide a computerized device management framework that adaptively determines and applies security and configuration parameters to a device on a first network, and enables the adaptive application of such parameters as the device disconnects and connects to other networks. The disclosed framework enables the automatic detection of different networks being relied upon by the device for access to the Internet, upon which, management control policies of the device's activities can be controlled and managed in a unified manner. Accordingly, the disclosed framework can enable security and configuration mechanisms applied on a first network, upon which they are associated, to be seamlessly applied on another disparate network via a virtual private network connection enabled via proprietary mechanisms implemented on the device."
7148,US-11919514-B1,Safety filter with preview data to improve the safety of steer commands ,2023,"Methods, systems, and non-transitory computer readable media are configured to perform operations comprising obtaining, by a computing system, a lane-keeping safe set associated with constraints on lateral movement of a vehicle traveling on a road, generating, by the computing system, a lane-keeping safe set with preview based on the lane-keeping safe set and preview data, the preview data associated with characteristics of the road ahead of the vehicle, receiving, by the computing system, a steer command to control the lateral movement of the vehicle, and generating, by the computing system, a safe steer command by modifying the steer command based on the lane-keeping safe set with preview."
7149,US-11966845-B1,Service document generation using large language models ,2023,"A method for creating generated formatted data, that includes receiving, by a sequential data generator, raw data, where the raw data includes formation data at a drilling environment, processing the raw data to obtain generated recommendation data, where the generated recommendation data includes a proposed drilling location, and creating the generated formatted data, where the generated formatted data includes the generated recommendation data."
7150,LU-505959-B1,Method for Identifying the Grade of Graphite Ore ,2023,"The present invention discloses a method for identifying the grade of graphite ore, which relates to the technical field of graphite ore grade classification. The method includes: collecting image data of graphite ore; replacing the fully connected layer in the ConvNeXt model with a normalized linear layer to construct the ConvNeXt-NL model; this model comprises 18 consecutive stacked ConvNeXt Blocks, as well as a global average pooling layer, normalized linear layer, and SoftMax layer; the normalized linear layer includes a set of two-dimensional weight matrices; inputting the graphite ore image data to be identified into the ConvNeXt-NL model, outputting the predicted probability of the image grade category, and identifying the grade of graphite ore. This method significantly enhances the model's small sample learning ability and generalization capability on unknown samples by using the normalized linear layer in the model, thereby achieving rapid and accurate identification of graphite ore grades."
7151,US-12055055-B1,Rotor blade inspection system ,2023,"An inspection system for rotating fan rotor blades in a gas turbine engine is provided. The system includes a plurality of cameras and lids, and a cleaning system. The cameras are each controllable to capture an image of a leading edge of a fan rotor blade and produce signals representative thereof. Each camera is mounted to a static structure disposed forward of the fan rotor blade stage. The lids are attached to the static structure and is selectively movable between closed and open positions. In the closed position at least one camera is enclosed. In the open position the camera is at least partially exposed and has a field of view of the rotating fan rotor blades. The cleaning system is controllable to selectively produce a body of fluid relative to the at least one camera when the respective lid is in the open position."
7152,US-12001752-B1,Voice assistance in virtual reality environments and augmented reality environments ,2023,"In some implementations, a voice assistance device may receive an indication of a visualization change associated with the virtual or augmented reality environment. The voice assistance device may determine that a change value, calculated based on the indication of the visualization change, satisfies a relevance threshold. The voice assistance device may apply, based on the indicator of change satisfying the relevance threshold, a description model to determine at least one sentence describing the virtual or augmented reality environment. The voice assistance device may apply a text-to-speech model to the at least one sentence to generate a digital sound signal and may transmit, to an output component, the digital sound signal."
7153,US-12038941-B1,Data mesh for unstructured data ,2023,"An apparatus and method for using a data mesh to structure unstructured data is provided. The apparatus and method involves transmitting an unstructured dataset from a first node to a data mesh, transmitting receiving the unstructured dataset at a data ingestion engine, analyzing data included in the unstructured dataset, splitting the data included in the dataset into a plurality of data fragments, assigning a level of structure to each data fragment aggregating the data fragments to form a plurality of data segments, transmitting each data segment that is assigned a level of structure to a corresponding data silo, storing each data segment in the corresponding data silo, creating a data structure map of where each data segment is stored, receiving a data request at the data ingestion engine from a second node, using the data structure map to locate the plurality of data segments of the dataset, determining if one or more of the data segments has an assigned level of structure that is less than an assigned level of structure of the second node, and restructuring based on the assigned level of structure of data."
7154,US-12034801-B1,Cloud-based fleet and asset management for edge computing of machine learning and artificial intelligence workloads ,2023,"A process can include receiving monitoring information associated with a machine learning (ML) or artificial intelligence (AI) workload implemented by an edge compute unit of a plurality of edge compute units. Status information corresponding to a plurality of connected edge assets can be received, the plurality of edge compute units and connected edge assets included in a fleet of edge devices. A remote fleet management graphical user interface (GUI) can display a portion of the monitoring or status information for a subset of the fleet of edge devices, based on a user selection input, and can receive a user configuration input indicative of an updated configuration for at least one workload corresponding to a pre-trained ML or AI model deployed on the at least one edge compute unit. A cloud computing environment can transmit control information corresponding to the updated configuration to the at least one edge compute unit."
7155,US-12072913-B1,Unhandled data protection for programmatic input/output routing to datasets with user-defined partitions ,2023,"Systems and methods are described for implementing programmatic input/output (I/O) routing to datasets with user-defined partitions while providing unhandled data protection. As disclosed herein, a user may define a dataset as including one or more partitions, each partition including criteria for storing data objects written to the partitioned dataset in the individual partitions. Data objects written to the dataset can then be evaluated according to the criteria, and routed to an appropriate partition. To provide unhandled data protection, a dataset definition can include a default partition to which data objects are routed when the data object fails to satisfy the criteria of any of the set of user-defined partitions identified in the specification. Processing I/O operations according to a user-defined partitioning schema can enable data objects to be arranged according to any partitioning schema without tethering the partitioning to a particular underlying storage system."
7156,US-12007524-B1,Method and system for non-destructive testing of tunnel lining ,2023,"A method and system are provided for non-destructive testing of a tunnel lining, and relate to the field of tunnel quality testing technologies. The method includes: obtaining tunnel design information; extracting rebar arrangement information and lining information; determining theoretical arrangement interval information; determining location information of a signal conducting bar group; pre-embedding signal conducting bars in sequence based on the location information of the signal conducting bar group; and manufacturing the lining, mounting an interface slot based on a location of the signal conducting bar, and marking a location of each interface slot as input point location information or receiving point location information, wherein the input point location information indicates a location corresponding to the signal input connection point, and the receiving point location information indicates a location corresponding to the signal receiving point."
7157,DE-102023204518-B3,Classification of dynamic contrast-enhanced medical image data of a liver ,2023,"The invention relates to a method for classifying medical image data comprising at least three image data sets, each depicting the examination area at a respective recording time within a period of less than two hours, by means of a classification algorithm designed for an image-based correlation between an image data set and a phase of several defined phases relative to a time of administration of a contrast agent with additional plausibility check."
7158,LU-505695-B1,RISK EARLY WARNING METHOD FOR LOGISTICS TRANSPORTATION OF DANGEROUS CHEMICALS ,2023,"The invention belongs to the field of monitoring and early warning, in particular to a risk early warning method for logistics transportation of dangerous chemicals, including: obtaining environmental parameters and logistics activity parameters in the process of logistics transportation of dangerous chemicals; integrating the environmental parameters and the logistics activity parameters into a data storage structure for data structure processing to obtain a chemical logistics data set; constructing a calculation model based on a circulating neural network and a feedforward neural network, and calculating the chemical logistics data set based on the calculation model to obtain risk assessment results; and carrying out risk early warning on the logistics transportation of dangerous chemicals through the risk assessment results. The invention can achieve the effect of processing data in real time, and can give an early warning of the risk situation of logistics and transportation of dangerous chemicals in real time."
7159,US-12067068-B1,Data retrieval using machine learning ,2023,"The present disclosure provides techniques for data retrieval using machine learning. One example method includes receiving a plurality of training episodes associated with different environments, wherein each training episode of the plurality of training episodes includes a sequence of states, computing, based on the plurality of training episodes, total counts of a plurality of values in the states, initializing, for each state of the sequence of states in each training episode of the plurality of training episodes, a reward based on the total counts of the plurality of values, and training a reinforcement learning agent using the rewards."
7160,US-11928730-B1,Training machine learning models with fairness improvement ,2023,"A method including training a machine-learning model, based on historical data, with a maximization problem and one or more minimization problems to improve one or more fairness metrics. The method also can include receiving real-time data. The method additionally can include generating a risk score based on the machine-learning model, as trained, and the real-time data. Other embodiments are described."
7161,US-11887558-B1,Method and apparatus for memory management in a video processing system ,2023,"An integrated circuit (IC) includes a video buffer memory and display driver circuitry. The video buffer memory includes a buffer memory map. The video buffer memory stores one or more raster lines of video data organized as tiled lines. Each of the tiled lines including two quartiles. The display driver circuitry is coupled to the video buffer memory. The display driver circuitry writes data associated with a portion of a first data line to a first one of the two quartiles of a first one of the tiled lines, and updates the buffer memory map. Further, the display driver determines a full display line being present within the video buffer memory based on the buffer memory map. The display driver further outputs the full display line to a display device."
7162,NL-2035773-B1,Intelligent safety management system for ski resorts ,2023,"The invention provides an intelligent safety management system for ski resorts, which 5 comprises: a target positioning and tracking module, which is used for position monitoring and tracking of tourists, staff and ski equipment in ski resorts, and for personnel scheduling and management; a safety monitoring management module, which is used for tracking the skiing and playing trajectories of tourists, and for tracking the trajectories of safety monitoring personnel, to ensure the execution of safety monitoring work; an emergency handling module, which is used 10 for quickly and accurately locating tourists or staff in emergency situations, and sending call signals to the management and control centre, and carrying out rescue work in a timely and effective manner; an management control centre, which is used for receiving signals sent by each module separately, and conducting target positioning, data acquisition, and wireless paging of the identified object through wireless communication technology. This system can transmit relevant 15 data in real-time, providing important basis for the management, scheduling, decision-making, and rescue work of ski resorts."
7163,US-12020140-B1,Systems and methods for ensuring resilience in generative artificial intelligence pipelines ,2023,"The systems and methods described herein relate to generative artificial intelligence systems using retrieval-augmented generation pipelines to supply information to large language models (LLMs). The potential for failures by such LLMs to return responses to prompts significantly increases with system complexity. To improve the resilience of the pipelines in handling such failures, various aspects described herein provide mechanisms for early detection and remediation of such prompt failure events. Thus, prompt failure events may be identified based upon (i) an elapsed time between sending a prompt and receiving a first token from the LLM exceeding a first threshold or (ii) an elapsed time between receiving such first token and receiving a last token exceeding a second threshold. Remediation may be achieved by causing a copy of the failed prompt to be sent to the LLM, without waiting for an error from the LLM provider or a standard network request timeout."
7164,US-11907462-B1,Screen mapping and spatial arrangement system ,2023,"Systems and methods of automatic screen mapping are presented. In one exemplary embodiment, a method is performed by a controller device that is coupled to at least one of a set of display devices that are spatially arranged so that each display device is positioned adjacent to at least one other display device and wherein each display device includes a screen structure having a set of presence sensitive sensors. Each display device is operable, for each presence sensitive sensor of the corresponding screen structure, to detect a presence signal and to radiate a presence signal. The method includes receiving an indication that a second display device of the set of display devices has detected a presence signal radiated from a presence sensitive sensor of a first display device of the set of display devices so as to determine a spatial arrangement of the first and second display devices."
7165,US-11762969-B1,Systems and methods for facilitating biometric recognition ,2023,"The present disclosure provides a method for facilitating biometric recognition. Further, the method includes receiving, using a communication device, a biometric data from a user device. Further, the biometric data includes an eyeball image data. Further, the eyeball image data includes a periocular region image and an iris image. Further, the method includes processing, using a processing device, the biometric data using a machine learning model. Further, the method includes determining, using the processing device, an iris feature based on the processing. Further, the method includes determining, using the processing device, a periocular feature based on the processing. Further, the method includes concatenating, using the processing device, the iris feature and the periocular feature. Further, the method includes generating, using the processing device, an enrolled image data based on the concatenating. Further, the method includes storing, using a storage device, the enrolled image data in a database."
7166,US-12032748-B1,Devices and methods for activating an asset tracker ,2023,"A method of activating an asset tracker from an ultra-low power shipping mode to a motion detection mode. The method includes detecting an activation trigger activity including double-tapping on the housing of the asset tracker, mid-air gestures comprising orientation changes, touch sensing, optical sensing, and loss of proximity with a proximity object in the packaging of the asset container."
