row_id,id,title,year,abstract
6227,US-12055658-B2,Method and device for detecting objects ,2020,"A method is provided for detecting objects by using a radar sensor and by using a device configured to establish a neural network. A plurality of raw radar data points is captured. At least one object class is defined comprising a predefined object type and a geometrical shape for enclosing an object. Via a first stage of the neural network, a semantic segmentation is performed for the data points regarding the object class and background, and for each data point, a rough approximation is estimated for a spatial condition of the geometrical shape. Based on this rough approximation and via a second stage of the neural network, a subset of the data points is selected based on the semantic segmentation, and for each data point of the subset, a refined approximation for the spatial condition of the geometrical shape and a confidence score for the refined approximation are estimated."
6228,US-11837029-B2,Biometric authentication device and biometric authentication method ,2020,"The objective is to achieve highly accurate authentication even when there is variation in the ambient light environment during biometric imaging. A biometric authentication device includes an image capturing unit that captures images of a living body, a light source for capturing images of the living body, an optical filter that selectively passes and blocks light according to wavelength, a spectroscopic processing unit that separates multiple wavelengths captured simultaneously, respectively, and a calculation unit that calculates the shape and posture of a predetermined part of the living body in the captured images, a background removal unit that removes the background from the image of the living body using the spectral images of the living body and the spectral image of the unwanted ambient light, and an authentication unit that performs biometric authentication using the image of the predetermined part."
6229,US-11341759-B2,Image classification using color profiles ,2020,"A device may receive a target document. The device may segment the target document into multiple segments. The device may determine, for each segment of the multiple segments, a set of color parameters for a corresponding set of pixels included in that segment. The device may determine, for each segment of the multiple segments, an average color parameter for that segment based on the set of color parameters for the corresponding set of pixels included in that segment. The device may generate a target color profile for the target document based on determining the average color parameter for each segment. The device may compare the target color profile and a model color profile associated with classifying the target document. The device may classify the target document based on comparing the target color profile and the model color profile."
6230,US-11776156-B2,Pose empowered RGB-flow net ,2020,"A method includes receiving video data that includes a series of frames of image data. Here, the video data is representative of an actor performing an activity. The method also includes processing the video data to generate a spatial input stream including a series of spatial images representative of spatial features of the actor performing the activity, a temporal input stream representative of motion of the actor performing the activity, and a pose input stream including a series of images representative of a pose of the actor performing the activity. Using at least one neural network, the method also includes processing the temporal input stream, the spatial input stream, and the pose input stream. The method also includes classifying, by the at least one neural network, the activity based on the temporal input stream, the spatial input stream, and the pose input stream."
6231,US-11646900-B2,Subscription service for networks ,2020,"An example operation may include one or more of releasing, by a subscription service node, at least one blockchain transaction to a plurality of subscribing blockchain nodes requiring direct entitlement access, executing, by the subscription service node, a smart contract to calculate secondary entitlements triggered by the at least one blockchain transaction, determining, by the subscription service node, portions of second entitlement data sets allowed to be accessed by a subset of the plurality of the subscribing blockchain nodes, and sending verification data to the plurality of the subscribing blockchain nodes for verification of the second entitlement data sets."
6232,US-12079769-B2,Automated recalibration of sensors for autonomous checkout ,2020,Automated techniques provide for recalibrating cameras in a real space in which puts and takes of items are tracked. The method includes first processing one or more selected images selected from a plurality of sequences of images received from a plurality of cameras calibrated using a set of calibration images that were used to calibrate the cameras previously. The first processing includes a process step to match one or more features from the selected images with features extracted from the set of calibration images using a trained neural network classifier. The features correspond to points located at displays or structures that remain substantially immobile. Camera calibrations can be updated when transform information between features matched meets or exceeds a threshold.
6233,US-12039731-B2,Prediction of candidates for spinal neuromodulation ,2020,"Described herein are various implementations of systems and methods for determining likelihood of a patient favorably responding to a neuromodulation procedure based on a quantitative or objective score or determination based on a plurality of indicators of pain (e.g., chronic low back pain stemming from one or more vertebral bodies or vertebral endplates of a patient). The systems and methods may involve application of artificial intelligence techniques (e.g., trained algorithms, machine learning or deep learning algorithms, and/or trained neural networks)."
6234,US-11537813-B1,System for synthesizing data ,2020,"During a training phase, a first machine learning system is trained using actual data, such as multimodal images of a hand, to generate synthetic image data. During training, the first system determines latent vector spaces associated with identity, appearance, and so forth. During a generation phase, latent vectors from the latent vector spaces are generated and used as input to the first machine learning system to generate candidate synthetic image data. The candidate image data is assessed to determine suitability for inclusion into a set of synthetic image data that may be used for subsequent use in training a second machine learning system to recognize an identity of a hand presented by a user. For example, the candidate synthetic image data is compared to previously generated synthetic image data to avoid duplicative synthetic identities. The second machine learning system is then trained using the approved candidate synthetic image data."
6235,US-11315041-B1,Machine learning with data sharing for clinical research data across multiple studies and trials ,2020,"Methods, systems, and apparatus, including computer-readable media, for machine learning in a multi-tenant data sharing platform. In some implementations, a server system provides a multi-tenant data sharing platform configured to selectively use stored data collected for different tenant organizations according to policy data for the respective tenant organizations. A request from one organization is received to perform a machine learning task involving a data set of a different tenant organization. The server system uses stored policy data to determine an applicable data policy, and based on the determination, the server system performs the machine learning task and provides the results of the machine learning task."
6236,US-11423236-B2,Computer-based systems for performing a candidate phrase search in a text document and methods of use thereof ,2020,A method for identifying phrases in a text document having a similar discourse to a candidate phrase includes separating text in a document file into a plurality of phrases and generating a plurality of embedding vectors in a textual embedding space by inputting the plurality of phrases into an embedding engine. A mapping of each embedding vector in the textual embedding space is generated with each corresponding phrase and a document location of each corresponding phrase in the document file. A candidate phrase is received by a user and a candidate embedding vector is generated using the embedding engine. Similarity scores are computed based on the plurality of embedding space distances between the candidate phrase embedding vector location and each respective location of each embedding vector in the textual embedding space. A listing of phrases with the highest similarity scores are outputted with respective document locations in the text.
6237,US-11488022-B2,Systems and methods for secure authentication based on machine learning techniques ,2020,"A system described herein may provide a technique for the use of machine learning techniques to perform authentication, such as biometrics-based user authentication. For example, user biometric information (e.g., facial features, fingerprints, voice, etc.) of a user may be used to train a machine learning model, in addition to a noise vector. A representation of the biometric information (e.g., an image file including a picture of the user's face, an encoded file with vectors or other representation of the user's fingerprint, a sound file including the user's voice, etc.) may be iteratively transformed until the transformed biometric information matches the noise vector, and the machine learning model may be trained based on the set of transformations that ultimately yield the noise vector, when given the biometric information."
6238,US-11556311-B2,Reconfigurable input precision in-memory computing ,2020,"Technology for reconfigurable input precision in-memory computing is disclosed herein. Reconfigurable input precision allows the bit resolution of input data to be changed to meet the requirements of in-memory computing operations. Voltage sources (that may include DACs) provide voltages that represent input data to memory cell nodes. The resolution of the voltage sources may be reconfigured to change the precision of the input data. In one parallel mode, the number of DACs in a DAC node is used to configure the resolution. In one serial mode, the number of cycles over which a DAC provides voltages is used to configure the resolution. The memory system may include relatively low resolution voltage sources, which avoids the need to have complex high resolution voltage sources (e.g., high resolution DACs). Lower resolution voltage sources can take up less area and/or use less power than higher resolution voltage sources."
6239,US-11176505-B2,Multi-channel tracking and control system ,2020,"Arrangements for providing multi-channel tracking and control are provided. In some examples, a request for a quantity of product may be received. The request may be processed and the order transmitted to a destination. During shipping, tracking of the order may be performed to determine whether an order has arrived at a destination. In some examples, quality data may be captured at the destination to determine whether a portion of the order was damaged or destroyed during shipping. In some arrangements, upon detecting delivery of the order the system may generate one or more instructions to update an inventory of the requesting entity based on delivery of the order. In some examples, machine learning may be used to predict when an entity may submit a subsequent request for product, a recommended amount of product, and the like. This information may be transmitted to a requesting entity to simplify future processing requests."
6240,US-11936452-B2,Neural network based channel state information feedback ,2020,"Various aspects of the present disclosure generally relate to neural network based channel state information (CSI) feedback. In some aspects, a device may obtain a CSI instance for a channel, determine a neural network model including a CSI encoder and a CSI decoder, and train the neural network model based at least in part on encoding the CSI instance into encoded CSI, decoding the encoded CSI into decoded CSI, and computing and minimizing a loss function by comparing the CSI instance and the decoded CSI. The device may obtain one or more encoder weights and one or more decoder weights based at least in part on training the neural network model. Numerous other aspects are provided."
6241,US-11736899-B2,Training in communication systems ,2020,"An apparatus, method and computer program is described comprising: generating a first loss function component comprising comparing first location data with first location estimates, wherein the first location estimates are based on channel state data, wherein the first location estimates are generated using a model, and wherein the model comprises a plurality of trainable parameters; generating a second loss function component comprising comparing the first location data with second location estimates, wherein the second location estimates are based on channel state data that have been subjected to a first augmentation and wherein the second location estimates are generated using the model; generating a third loss function component comprising comparing third location estimates based on channel state data and fourth location estimates based on channel state data that have been subjected to a second augmentation, wherein the third and fourth location estimates are generated using the model; and training the trainable parameters of the model by minimising a loss function based on a combination of the first, second and third loss function components."
6242,US-11321842-B1,Spatial-and-context aware virtual biopsy radiogenomic maps to target tumor mutational status ,2020,"Embodiments discussed herein facilitate determination of tumor mutation status based on context and spatial information. One example embodiment can access a MRI scan of a tumor comprising voxels; extract radiomic feature(s) from the voxels; generate a spatial feature descriptor indicating probabilities the tumor has a first mutation status and a second mutation status, based on the MRI scan, a first population atlas for the first mutation status, and a second population atlas for the second mutation status; provide the radiomic feature(s) and the spatial feature descriptor to a machine learning model; and receive, via the machine learning model, a map indicating, for each voxel of the voxels, a probability of the first mutation status for that voxel and a probability of the second mutation status for that voxel, wherein the map is based at least on the one or more radiomic features and the spatial feature descriptor."
6243,US-12033044-B2,Interactive and dynamic mapping engine (IDME) ,2020,"Methods, systems, and apparatuses, among other things, may provide for an interactive dynamic mapping engine (iDME) for business intelligence, which may interactively obtain information for user devices from sources and schema unknown to the user devices."
6244,US-11343940-B2,Configurable cold-plates of datacenter cooling systems ,2020,"A cold plate that is configurable and for a datacenter liquid cooling system is disclosed. The cold plate includes a first section, a second section, and an intermediate layer, which is changeable and has first channels to enable flow of a coolant through the intermediate layer, and has second channels or at least one adapted second channel to concentrate the coolant or the flow of the coolant to at least one area within the configurable cold plate corresponding to at least a heat generating feature of an associated computing device."
6245,US-11718410-B2,Systems and methods for multi-module control of a hydrogen powered hybrid electric powertrain ,2020,The present disclosure provides systems and methods for a hydrogen-powered hybrid electric powertrain and the associated hydro-electro-aero-thermal management system (HEATMS).
6246,US-11921488-B2,System and method for machine-learning-enabled micro-object density distribution control with the aid of a digital computer ,2020,"System and method that to shape micro-object density distribution (how densely the micro-objects are assembled in particular spatial regions) are provided. A high speed camera tracks existing object density distribution. An array of photo-transistor-controlled electrodes is used to generate a dynamic potential energy landscape for manipulating objects with both DEP and EP forces, and a video projector is used actuate the array. One or more computing devices are used to: process images captured by the camera to estimate existing density distribution of objects; receive a desired density distribution of micro-objects; define a model describing a variation of micro-object density over time due to capacitance-based interactions; generate a sequence of electrode potential that when generated would minimize error between the existing density distribution and a desired density distribution; and use the sequences of electrode potentials to actuate the electrodes."
6247,US-11709180-B2,Atomic force microscope using artificial intelligence object recognition technology and operation method thereof ,2020,"An atomic force microscope includes a sample stage on which a sample is placed, a cantilever including a probe tip, a laser radiating a laser beam to the cantilever, a photodetector receiving a laser beam reflected from the cantilever, a first camera photographing the sample and the cantilever, a second camera photographing the cantilever and the spot of the laser beam, and a processor electrically connected to the first and second cameras and the photodetector to process data acquired by the first and second cameras and the photodetector. An operation method of the atomic force microscope includes detecting the positions of the cantilever and the sample using the first camera, adjusting the position of the sample, detecting the positions of the laser and the cantilever using the second camera, aligning the laser, detecting the position of the laser beam using the photodetector, and aligning the position of the photodetector."
6248,US-11509675-B2,Systems and methods for cyber monitoring and alerting for connected aircraft ,2020,"A method of monitoring network traffic of a connected vehicle. The method includes receiving network traffic information from a vehicle gateway, the network traffic information including malicious and/or benign information. The method also includes storing the network traffic information on a data server and periodically updating the network traffic information stored on the data server. The method further includes: pre-processing the network traffic information, the pre-processing the network traffic information including filtering and normalizing the network traffic information; generating a learning model based on the pre-processed network traffic information, the learning model being generated by an artificial intelligence learning; updating the learning model based on additional network traffic information, the additional network traffic information including real-time network data; in accordance with the updated learning model, detecting an anomaly event in the incoming network data; and generating a notification and/or blocking one or more packets associated with the incoming network data."
6249,US-11896323-B2,"System, method, and computer-accessible medium for automatically tracking and/or identifying at least one portion of an anatomical structure during a medical procedure ",2020,"Exemplary system, method, and computer-accessible medium can be provided for effectuating a video overlay during a medical procedure(s) performed on a patient(s) can include, for example, receiving a live video(s) of the medical procedure(s) performed on the patient(s), identifying, in real time, a target area(s), an area of danger(s) and/or at least partially obscured anatomical structures of significance on a patient's anatomy by applying a machine learning procedure to the live video(s), and providing the video overlay based on the identification of the target area(s) and the area of danger(s). The video overlay can be continuously modified, in real-time, using the machine learning procedure. The medical procedure(s) can be a gallbladder surgery. The machine learning procedure can include a neural network, which can be a convolutional neural network."
6250,US-11704579-B2,Earth modeling methods using machine learning ,2020,"Aspects of the present disclosure relate to earth modeling using machine learning. A method includes receiving detected data at a first depth point along a wellbore, providing at least a first subset of the detected data as first input values to a machine learning model, and receiving first output values from the machine learning model based on the first input values. The method includes receiving additional detected data at a second depth point along the wellbore, providing at least a second subset of the additional detected data as second input values to the machine learning model, and receiving second output values from the machine learning model based on the second input values. The method includes combining the first output values at the first depth point and the second output values at the second depth point to generate an updated model of the wellbore, the updated model comprising an earth model."
6251,US-12089255-B2,Multi-link RTS and CTS transmissions ,2020,"In a wireless local area network system, a reception multi-link device (MLD) may not transmit a CTS frame, even if the reception multi-link device receives an RTS frame via a second link, in the case that an STA operating via a first link is a TXOP responder. In detail, the reception MLD may include at least one non-simultaneous transmit and receive (NSTR) link pair. A first STA affiliated with the MLD may determine to respond with the CTS frame to the RTS frame. The first STA does not respond with the CTS frame based on another STA being a transmission opportunity (TXOP) responder on another link."
6252,US-11954932-B2,Systems and methods for automatic detection of features on a sheet ,2020,"A computer-implemented method for detecting a target object on a document page that includes detecting a sample target area on a sample document page, generating an image by overlapping a plurality of sample document pages with one another, and detecting one or more cells within the sample target area on the image. The sample target area includes a sample target object. The method further includes extracting one or more informational features from each of the one or more cells. The one or more informational features define characteristics of a corresponding cell of the one or more cells. A machine learning model is trained using the one or more informational features extracted from each of the one or more cells, to detect the sample target object. A target object on a document page is detected using the trained machine learning model."
6253,US-11321607-B2,"Machine learning network implemented by statically scheduled instructions, with compiler ",2020,"A compiler receives a description of a machine learning network and generates a computer program that implements the machine learning network. The computer program includes statically scheduled instructions that are executed by a mesh of processing elements (Tiles). The instructions executed by the Tiles are statically scheduled because the compiler can determine which instructions are executed by which Tiles at what times. For example, for the statically scheduled instructions, there are no conditions, branching or data dependencies that can be resolved only at run-time, and which would affect the timing and order of the execution of the instructions."
6254,US-11683717-B2,Method and apparatus for determining wireless MNO coverage and efficiently operating an enterprise wireless communication network ,2020,"A transfer management system for efficiently operating an enterprise wireless communication network (EN) at a campus location enables the EN to control congestion, selectively and smoothly admit UEs, and manage UE exits from the EN. An MNO Network (MN) footprint learning system learns the different MN footprints on the campus, relative to the BS/APs deployed by the individual enterprise, which defines a footprint of wireless coverage for each MNO that has wireless coverage. The MN footprint provides useful information that enables successfully transitioning a UE between an EN and an MNO, which provides the EN with the ability to utilize other networks to offload one or more UEs to manage congestion, delay or deny admission of UEs, and proactively exit UEs to manage congestion or for other reasons."
6255,US-11508361-B2,Sentiment aware voice user interface ,2020,"Described herein is a system for responding to a frustrated user with a response determined based on spoken language understanding (SLU) processing of a user input. The system detects user frustration and responds to a repeated user input by confirming an action to be performed or presenting an alternative action, instead of performing the action responsive to the user input. The system also detects poor audio quality of the captured user input, and responds by requesting the user to repeat the user input. The system processes sentiment data and signal quality data to respond to user inputs."
