row_id,id,title,year,abstract
6001,US-11541763-B2,Hybrid energy storage system optimization strategy with intelligent adaptive control ,2020,"A control system implementing a hybrid energy storage system (ESS) optimization strategy is disclosed. The hybrid ESS optimization strategy may be implemented in a machine that comprises a power system that includes a plurality of power sources and a power controller that includes one or more processors. The power controller may receive information related to a set of brake-specific fuel consumption (BSFC) maps associated with the plurality of power sources, determine a performance indicator using a cost function associated with the plurality of power sources, and generate a command to operate the power system based on a power distribution that minimizes an energy cost to operate the power system based on the information related to the set of BSFC maps, the performance indicator, and a load associated with the power system."
6002,US-11470201-B2,Systems and methods for providing real time assistance to voice over internet protocol (VOIP) users ,2020,"Systems and methods are provided that may be implemented in a real time manner by an information handling system (the “client system”) to monitor one or more characteristics of a voice over internet protocol (VOIP) discussion, to use these monitored VOIP characteristics to identify one or more condition/s in real time as they are identified to occur during the current VOIP discussion, and to determine to take one or more automatic actions based on the identified VOIP condition/s so as to inform and/or alert a current human user of the client system to the occurrence of the identified VOIP condition/s as they occur."
6003,US-11645206-B2,Distributed memory-augmented neural network architecture ,2020,"A method for using a distributed memory device in a memory augmented neural network system includes receiving, by a controller, an input query to access data stored in the distributed memory device, the distributed memory device comprising a plurality of memory banks. The method further includes determining, by the controller, a memory bank selector that identifies a memory bank from the distributed memory device for memory access, wherein the memory bank selector is determined based on a type of workload associated with the input query. The method further includes computing, by the controller and by using content based access, a memory address in the identified memory bank. The method further includes generating, by the controller, an output in response to the input query by accessing the memory address."
6004,US-11961385-B2,"Hand hygiene device, system, and method ",2020,"In one embodiment, a process may obtain sensor data associated with a motion event captured by a wearable device. The process may identify, using the sensor data as input to one or more machine learning-based classifiers, a hand hygiene protocol associated with the motion event. The process may recognize, from the sensor data associated with the motion event, a deviation from a step of the hand hygiene protocol. The process may provide, based on recognizing the deviation, remediation instructions to achieve compliance with the step of the hand hygiene protocol."
6005,US-11915138-B2,Method and device for reducing a size of a neural network model ,2020,"Methods and apparatus for reducing a size of a neural network model, the method including: compressing data of the neural network model; identifying structure information of a vector register, wherein the structure information includes a number of registers included in the vector register; comparing a number of elements in the compressed data with a first condition, wherein the first condition is determined based on the number of registers in the vector register; and in response to the number of elements satisfying the first condition, associating the compressed data with the vector register to enable loading the compressed data to the vector register."
6006,US-11734559-B2,Automated structured textual content categorization accuracy with neural networks ,2020,"To provide automated categorization of structured textual content individual nodes of textual content, from a document object model encapsulation of the structured textual content, have a multidimensional vector associated with them, where the values of the various dimensions of the multidimensional vector are based on the textual content in the corresponding node, the visual features applied or associated with the textual content of the corresponding node, and positional information of the textual content of the corresponding node. The multidimensional vectors are input to a neighbor-imbuing neural network. The enhanced multidimensional vectors output by the neighbor-imbuing neural network are then be provided to a categorization neural network. The resulting output can be in the form of multidimensional vectors whose dimensionality is proportional to categories into which the structured textual content is to be categorized. A weighted merge takes into account multiple nodes that are grouped together."
6007,US-11989747-B2,Smart feedback system ,2020,"Methods and systems are used for providing a traveling avatar in a smart feedback system (SFS). As an example, a user associated with a first interaction with the SFS from a first device at a first location is identified. A first visualization of a personalized avatar associated with the user is provided to the first device. A first personalized feedback request is provided to the first device during the first visualization. First feedback of the user captured by the first device is received in response to the first personalized feedback request. The user associated with a second interaction with the SFS from a second device at the first location is identified. A second visualization of the personalized avatar is provided to the second device. A second personalized feedback request is provided to the second device. Second feedback of the user captured by the second device is received."
6008,US-11995891-B2,Computer program and method for training artificial neural network model based on time-series biosignal ,2020,"Disclosed is a computer program stored in a computer-readable storage medium for achieving the above-described objects. When the computer program is executed by one or more processors, the computer program causes the one or more processors to perform the following operations of generating video data for diagnosing a health condition and a pathological symptom on the basis of a biosignal. The operations include receiving a biosignal of a user, preprocessing the biosignal to generate a plurality of pieces of video sub-data, and selecting at least two of the plurality of pieces of video sub-data to generate one or more pieces of video data."
6009,US-11531131-B2,Seismic interpretation using flow fields ,2020,"A method for modeling a subsurface volume includes receiving a plurality of ordered seismic images including representations of objects in the subsurface volume, generating flow fields based on a difference between individual images of the plurality of ordered seismic images, and identifying the objects in the seismic images based on the flow fields and the plurality of ordered seismic images."
6010,US-10713493-B1,4D convolutional neural networks for video recognition ,2020,"This disclosure includes technologies for video recognition in general. The disclosed system can automatically detect various types of actions in a video, including reportable actions that cause shrinkage in a practical application for loss prevention in the retail industry. The temporal evolution of spatio-temporal features in the video are used for action recognition. Such features may be learned via a 4D convolutional operation, which is adapted to model low-level features based on a residual 4D block. Further, appropriate responses may be invoked if a reportable action is recognized."
6011,US-11099396-B2,Depth map re-projection based on image and pose changes ,2020,"A method implemented by an extended reality (XR) display device includes rendering a current image frame received from an external electronic device associated with the XR display device. The current image frame is associated with a current pose of the XR display device. The method further includes receiving an updated image frame from the external electronic device, calculating an updated pose based on one or more characteristics of the updated image frame, and determining whether the updated pose is within a pose range with respect to the current pose. The method thus further includes re-rendering, on one or more displays of the XR display device, a previous image frame based on whether the current pose is determined to be within the pose range."
6012,US-11521479-B2,Fire warning system and devices ,2020,"Various embodiments include a fire detection system (FDS) device and methods for operating an FDS device to detect a potential fire and communicate information regarding fire detection events to a central fire detection system via a wireless communication network. Various embodiments include receiving information from one or more sensors configured to detect an indication of a possible fire, determining whether information received from the one or more sensors satisfy one or more threshold criteria indicative of a fire event, generating a fire warning message comprising a fire alarm object in response to determining that the information received from the one or more sensors satisfy one or more threshold criteria indicative of a fire event, and sending the generated fire warning message to a remote server via a communication network."
6013,US-11782681-B1,Providing resolution suggestions in a program development tool ,2020,"User interactions and states of a program development tool utilized to develop an application are tracked. Input features associated with the tracked user interactions and the states are provided to a trained machine learning model to determine a prediction result associated with whether a user is likely unable to proceed in the development of the application and likely needs assistance. In response to a determination that the prediction result at least meets a threshold, one or more resolution suggestions are automatically provided. The one or more resolution suggestions is at least one of: automatically selected based on at least a portion of the tracked user interactions and states, or automatically selected based at least in part the prediction result."
6014,US-11947928-B2,Multi-die dot-product engine to provision large scale machine learning inference applications ,2020,"Systems and methods are provided for a multi-die dot-product engine (DPE) to provision large-scale machine learning inference applications. The multi-die DPE leverages a multi-chip architecture. For example, a multi-chip interface can include a plurality of DPE chips, where each DPE chip performs inference computations for performing deep learning operations. A hardware interface between a memory of a host computer and the plurality of DPE chips communicatively connects the plurality of DPE chips to the memory of the host computer system during an inference operation such that the deep learning operations are spanned across the plurality of DPE chips. Due to the multi-die architecture, multiple silicon devices are allowed to be used for inference, thereby enabling power-efficient inference for large-scale machine learning applications and complex deep neural networks. The multi-die DPE can be used to build a multi-device DNN inference system performing specific applications, such as object recognition, with high accuracy."
6015,US-11521595-B2,End-to-end multi-talker overlapping speech recognition ,2020,"A method for training a speech recognition model with a loss function includes receiving an audio signal including a first segment corresponding to audio spoken by a first speaker, a second segment corresponding to audio spoken by a second speaker, and an overlapping region where the first segment overlaps the second segment. The overlapping region includes a known start time and a known end time. The method also includes generating a respective masked audio embedding for each of the first and second speakers. The method also includes applying a masking loss after the known end time to the respective masked audio embedding for the first speaker when the first speaker was speaking prior to the known start time, or applying the masking loss prior to the known start time when the first speaker was speaking after the known end time."
6016,US-11494370-B2,Hardware-controlled updating of a physical operating parameter for in-field fault detection ,2020,"Latency of in-system test (IST) execution for a hardware component of an in-field (deployed) computing platform may be reduced when a value of a physical operating parameter can be changed without rebooting the computing platform. A test (e.g., patterns or vectors) is executed for varying values of the physical operating parameter (e.g., supply voltage, clock speed, temperature, noise magnitude/duration, operating current, and the like), providing the ability to detect faults in the hardware components."
6017,US-11928739-B2,Method and system for vehicular collision reconstruction ,2020,"A system for accident reconstruction can include and/or be configured to interface with any or all of: a set of models, a set of modules, a processing system, client application, a user device (equivalently referred to herein as a mobile device), a set of sensors, a vehicle, and/or any other suitable components. A method for accident reconstruction includes collecting a set of inputs; detecting a collision and/or one or more features of the collision; reconstructing the collision; and producing an output based on the reconstruction. Additionally or alternatively, the method can include training a set of models and/or modules, and/or any other suitable processes."
6018,US-11704562-B1,Architecture for virtual instructions ,2020,"A system including a machine learning accelerator (MLA) hardware configured to perform machine-learning operations according to native instructions; an interpreter computing module configured to: generate, based on virtual instructions, machine language instructions configured to be processed by a processing hardware implementing the interpreter computing module; and cause the processing hardware to perform machine-learning operations according to the machine language instructions; and a compiler computing module associated with the MLA hardware, the compiler computing module configured to: receive instructions for performing an inference using a machine-learning model; based on the received instructions: generate the native instructions configured to be processed by the MLA hardware, the native instructions specifying first machine-learning operations associated with performing the inference; and generate the virtual instructions configured to be processed by the interpreter computing module, the virtual instructions specifying second machine-learning operations associated with performing the inference."
6019,US-11803397-B2,"Determining sequences of interactions, process extraction, and robot generation using artificial intelligence / machine learning models ",2020,"Use of artificial intelligence (AI)/machine learning (ML) models is disclosed to determine sequences of user interactions with computing systems, extract common processes, and generate robotic process automation (RPA) robots. The AI/ML model may be trained to recognize matching n-grams of user interactions and/or a beneficial end state. Recorded real user interactions may be analyzed, and matching sequences may be implemented as corresponding activities in an RPA workflow."
6020,US-11252723-B1,Modifying a vehicular radio based on a schedule of point-to-point vehicular communications ,2020,"The disclosure includes embodiments for modifying a vehicle-to-everything (V2X) radio of an ego vehicle that is a connected vehicle. In some embodiments, a method includes analyzing, by a machine learning module executed by a processor, a local dynamic map generated by the ego vehicle to determine schedule data describing a schedule for the ego vehicle to transmit a millimeter wave (mmWave) message to a remote vehicle. The method includes transmitting a V2X message including the schedule data for receipt by the remote vehicle so that the remote vehicle has access to the schedule. The method includes modifying an operation of the V2X radio of the ego vehicle based on the schedule so that the V2X radio transmits the mmWave message to the remote vehicle in compliance with the schedule. The method includes transmitting the mmWave message to the remote vehicle in compliance with the schedule."
6021,US-11816711-B2,System and method for predicting personalized payment screen architecture ,2020,"A computer-implemented method and system are provided to utilize machine learning technology to process user financial transaction data to predict a personalized payment screen architecture. A plurality of feature datasets associated with transaction data of a plurality of electronic invoices are obtained by a computing device. Each feature dataset comprises a plurality of features, a payment screen and a payment method configured to be presented on at least one payment screen. The computing device is configured to train a machine learning model with the feature datasets to produce a probability matrix with probabilities of each payment method used to pay the invoices through each payment screen. The computing device may weigh the probability matrix to generate a recommendation matrix and determine a prediction of a payment screen based on the recommendation matrix."
6022,US-11722510-B2,Monitoring and preventing remote user automated cyber attacks ,2020,"Aspects of the disclosure relate to monitoring virtual desktops accessed by devices at remote locations using machine-learning models to mitigate potential cyber-attacks. In some embodiments, a computing platform may monitor data associated with a series of activities from a virtual desktop accessed by a remote computing device. Subsequently, the computing platform may detect new activity data on the virtual desktop accessed by the remote computing device, and evaluate the new activity data relative to the data associated with the series of activities, wherein evaluating includes applying a machine learning model to the new activity data. Based on evaluating the new activity data, the computing platform may determine if the new activity data is indicative of a potential cyber-attack. In response to determining that the new activity data is indicative of a potential cyber-attack, the computing platform may initiate one or more security response actions."
6023,US-11425017-B2,Systems and methods for utilizing a neural network model to perform packet capture data analysis ,2020,"A device may receive packet data identifying packets exchanged between client devices via a network of network devices. The device may classify the packet data based on timestamps and protocols associated with the packets and to generate classified packet data. The device may group the classified packet data into packet data sets corresponding to packet flows between pairs of the client devices. The device may select a packet data set, from the packet data sets, based on one or more filtering criteria. The device may process the packet data set to determine whether the packet data set is associated with one or more problem packets. The device may perform one or more actions based on determining whether the packet data set is associated with one or more problem packets."
6024,US-11593648-B2,Methods and systems for detection and isolation of bias in predictive models ,2020,"This disclosure involves detecting biases in predictive models and the root cause of those biases. For example, a processing device receives test data and training data from a client device. The processing device identifies feature groups from the training data and the test data generates performance metrics and baseline metrics for a feature group. The processing device detects biases through a comparison of the performance metrics and the baseline metrics the feature group. The processing device then isolates a portion of the training data that corresponds to the detected bias. The processing device generates a model correction usable to remove the bias from the predictive model."
6025,US-11820398-B2,Learning apparatus and model learning system ,2020,"A learning apparatus configured to be able to communicate with a plurality of equipment in which learning models are mounted, wherein when first equipment among the plurality of equipment in which a learning model trained using training data sets acquired in a predetermined first area is mounted and which is controlled by the same is used in a predetermined second area, the learning apparatus uses training data sets acquired in the second area to relearn the learning model mounted in the first equipment."
6026,US-11328732-B2,Generating summary text compositions ,2020,"A method for generating a summary text composition can include obtaining historical reading data of a user. The method can include generating, based on the historical reading data, a reading proficiency level of the user. The method can include selecting, based on the reading proficiency level, a summarization model from a set of summarization models. The method can include obtaining a target composition. The target composition can be selected from the group consisting of a literary work, a video recording, and an audio recording. The method can include generating, by the summarization model, the summary text composition. The summary text composition can correspond to the target composition and have a first reading level classification that matches the reading proficiency level. The method can include transmitting the summary text composition to a computing device."
6027,US-11493387-B2,Correction and calibration of spectral sensor output ,2020,"An spectral sensor system includes an array of optical sensors arranged on an integrated circuit, an interface between the plurality of optical sensors and a first processing device, a plurality of sets of optical filters configured as a layer located atop the plurality of optical sensors, with each set of optical filters including a plurality of optical filters, each optical filter configured to pass light in a different wavelength range. The spectral sensor system includes a memory configured to interface with the first processing device, the memory configured to store calibration data associated with the plurality of sets of optical sensors. The spectral sensor system further includes second processing device includes an artificial neural network configured to correct a spectral response generated by the plurality of optical sensors and an interface between the first processing device and the second processing device is configured to transmit information therebetween."
6028,US-11775271-B1,Annotations for developers ,2020,"Techniques are described herein for translating source code in one programming language to source code in another programming language using machine learning. A method includes: receiving first source code in a first higher-level programming language; processing the first source code, or an intermediate representation thereof, using a sequence-to-sequence neural network model to generate a sequence of outputs, each including a probability distribution; generating second source code in a second higher-level programming language by, for each output in the sequence of outputs: determining a highest probability in the probability distribution associated with the output; in response to the highest probability exceeding a first threshold, generating a predicted portion of the second source code based on a token that corresponds to the highest probability; and in response to the highest probability not exceeding the first threshold, generating a placeholder; and outputting the second source code."
6029,US-11756551-B2,System and method for producing metadata of an audio signal ,2020,"An audio processing system is provided. The audio processing system comprises an input interface configured to accept an audio signal. Further, the audio processing system comprises a memory configured to store a neural network trained to determine different types of attributes of multiple concurrent audio events of different origins, wherein the types of attributes include time-dependent and time-agnostic attributes of speech and non-speech audio events. Further, the audio processing system comprises a processor configured to process the audio signal with the neural network to produce metadata of the audio signal, the metadata including one or multiple attributes of one or multiple audio events in the audio signal."
