row_id,id,title,year,abstract
6113,US-11783710-B2,Appearance and movement based model for determining risk of micro mobility users ,2020,"The systems and methods disclosed herein provide a risk prediction system that uses trained machine learning models to make predictions that a VRU will take a particular action. The system first receives, in a video stream, an image depicting a VRU operating a micro-mobility vehicle and extract the depictions from the image. The extraction process may be determined by bounding box classifiers trained to identify various VRUs and micro-mobility vehicles. The system feeds the extracted depictions to machine learning models and receives, as an output, risk profiles for the VRU and the micro-mobility vehicle. The risk profile may include data associated with the VRU/micro-mobility vehicle determined based on classifications of the VRU and the micro-mobility vehicles. The system may then generate a prediction that the VRU operating the micro-mobility vehicle will take a particular action based on the risk profile."
6114,US-11233973-B1,Mixed-reality teleconferencing across multiple locations ,2020,"Aspects of the invention include overlaying a graphical representation of a first user onto a real-world image of a first location, wherein the first user is physically located at a second location different than the first location. Detecting an interaction between the first user and a second user, wherein the second user is physically located at the first location. Determining a current position of the second user within the first location. Causing the graphical representation of the first user to face in a direction of the current position of the second user."
6115,US-11036613-B1,Regression analysis for software development and management using machine learning ,2020,A device configured to obtain project information identifying a set of programs and to generate a program matrix. The device is further configured to identify entries in the program matrix where a row and a column correspond with the same program and to set the identified entries with a value of one. The device is further configured to identify programs from among the set programs that are called by a program and to set the identified entries in the program matrix that correspond with the identified programs with a value of one. The device is further configured to input the program matrix into a first machine learning model to obtain relationship information. The relationship information maps the set of programs to a spatial domain where a distance between a pair of programs in the spatial domain corresponds with a level of impact between the pair of programs.
6116,US-11532153-B2,Splash detection for surface splash scoring ,2020,"A method of surface splash scoring includes receiving, at an electronic device, a set of camera frames corresponding to images of a water surface. The electronic device processes the set of camera frames with a trained machine learning model to generate one or more quantifications associated with fish activity proximate the water surface. In some embodiments, a surface splash score is computed that represents an appetite level anticipated to be exhibited for a first time period. Subsequently, the electronic device generates an output indicative of the surface splash score."
6117,US-11269456-B1,Enhanced mutual capacitance touch screen display with water compensation and methods for use therewith ,2020,"A capacitive touch screen display operates by: receiving a plurality of sensed signals indicating variations in mutual capacitance associated with a plurality of cross points formed by a plurality of electrodes; generating capacitance image data associated with the plurality of cross points that includes positive capacitance variation data corresponding to positive variations of the capacitance image data from a nominal value and negative capacitance variation data corresponding to negative variations of the capacitance image data from the nominal value; identifying a presence of water on the touch screen display based on the positive capacitance variation data, and the negative capacitance variation data; generating compensated capacitance image data to compensate for effects of the water on the touch screen display in the capacitance image data; and processing the compensated capacitance image data to determine a proximal condition of the touch screen display."
6118,US-11691648-B2,Drivable surface identification techniques ,2020,"The present disclosure relates generally to identification of drivable surfaces in connection with autonomously performing various tasks at industrial work sites and, more particularly, to techniques for distinguishing drivable surfaces from non-drivable surfaces based on sensor data. A framework for the identification of drivable surfaces is provided for an autonomous machine to facilitate it to autonomously detect the presence of a drivable surface and to estimate, based on sensor data, attributes of the drivable surface such as road condition, road curvature, degree of inclination or declination, and the like. In certain embodiments, at least one camera image is processed to extract a set features from which surfaces and objects in a physical environment are identified, and to generate additional images for further processing. The additional images are combined with a 3D representation, derived from LIDAR or radar data, to generate an output representation indicating a drivable surface."
6119,US-11586182-B2,System and device to automatically identify data tags within a data stream ,2020,"A method including receiving a data packet over a network, the data packet having a size. The method also includes parsing the data packet into a header and a body. The method also includes identifying a protocol type from the header and the size. The method also includes identifying a signal characteristic of signal data in the body. The method also includes identifying a classification of a source sensor which generated the data packet based on the protocol type and the signal characteristic. The method also includes generating a metadata file based on the source sensor. The method also includes labeling the data packet with the metadata file to form a labeled data packet."
6120,US-11068908-B1,Skill-based credential verification by a credential vault system (CVS) ,2020,"Methods and systems are provided for skill-based/JHE credential verification using robotic contact and analysis, social media search, and/or peer affirmation within a blockchain-based database that holds verified trustor records. In one embodiment, a credential vault system (CVS) identifies a set of skill-based canonical JHEs for a trustor based on a description of job history and experience (JHE) of the trustor using a recurrent neural network (RNN) model with natural language process/natural language understanding (NLP/NLU), wherein a trustor record in the CVS is uniquely identified by a trustor identification in a blockchain-based database of the CVS, collects one or more corroborations for each canonical JHE by the CVS, evaluates each canonical JHE based on the collected one or more corroborations using a deep learning model to verify the corresponding canonical JHE, and appends each verified canonical JHE to the trustor record in a blockchain-based database of the CVS."
6121,US-11102269-B1,Media stream patching using dynamic frame prediction ,2020,"Techniques for media stream patching using dynamic frame prediction are described. A frame loss detector of a decoder can detect a frame loss condition of an input media stream and cause a request for a substitute frame to be sent to a frame predictor. The frame predictor uses one or more machine learning models to infer a substitute frame, which is inserted into the media stream for further processing and distribution."
6122,US-11169716-B2,Prediction of maintenance window of a storage system ,2020,"A method in one embodiment comprises detecting one or more storage arrays in an information technology infrastructure, and receiving input-output (IO) operation performance data recorded over a given time period from the one or more storage arrays. The performance data comprises a plurality of IO operation counts, each IO operation count comprising a number of IO operations per time unit for a component of a given storage array. The method also includes analyzing metadata for the IO operation counts to generate a time series comprising the IO operation counts sorted over a plurality of ordered time intervals of the given time period, and identifying a plurality of time blocks within the time series, each of the time blocks comprising a subset of the ordered time intervals. A proposed time interval for performance of a planned maintenance activity is generated based on one or more of the time blocks."
6123,US-12061480-B2,Causing a mobile robot to move according to a planned trajectory determined from a prediction of agent states of agents in an environment of the mobile robot ,2020,"A mobile robot can be caused to move according to a planned trajectory. The mobile robot can be a vehicle. Information about agents in an environment of the mobile robot can be received from sensors. At a first time, a spatiotemporal graph can be produced. The spatiotemporal graph can represent relationships among the agents in the environment. The mobile robot can be one of the agents in the environment. Information from the spatiotemporal graph can be input to neural networks to produce information for a mixture of affine time-varying systems. The mixture of affine time-varying systems can represent an evolution of agent states of the agents. Using the mixture of affine time-varying systems and information associated with the first time, a prediction of the agent states at a second time can be calculated. The mobile robot can be caused to move according to the planned trajectory determined from the prediction."
6124,US-11816894-B2,Method and apparatus for determining a game status ,2020,Embodiments are generally directed to methods and apparatuses for determining a game status. An embodiment of a method for determining a game status comprises: detecting players and a ball in a plurality of continuous frames captured by a plurality of cameras; obtaining tracking data of the players and the ball of the plurality of continuous frames; and determining a game status for each of the plurality of continuous frames based on the tracking data of the players and the ball of the plurality of continuous frames.
6125,US-10922850-B1,Augmented reality system for persona simulation ,2020,"A computer-implemented augmented reality essence generation platform has a processor. An interaction and location synchronization engine synchronizes interaction data between an active user and an inactive user with location data of a geographical location at which the active user and the inactive user participated in a real-world experience during a time period in which the inactive user was active. Moreover, an essence generation engine generates, via the processor, a virtual persona model of the inactive user based upon the interaction data and the location data. Additionally, a neural network engine generates, via the processor, a neural network that simulates, during a time period in which the inactive user is inactive, a virtual persona of the inactive user based on the virtual persona model during a virtual interaction between the active user and a virtual representation of the inactive user."
6126,US-11914670-B2,Methods and systems for product quantization-based compression of a matrix ,2020,"Methods and systems for compressing a matrix are described. The matrix, having a plurality of rows formed by a respective plurality of vectors, is partitioned into a plurality of submatrices, each submatrix containing sub-vectors from a respective group of one or more contiguous columns of the matrix. For each given submatrix, the sub-vectors are clustered into a plurality of clusters. For each given cluster, a centroid and a variance are computed and stored, based on the sub-vectors belonging to the given cluster. A mapping relating each vector to a respective cluster in each submatrix is stored. The stored centroids, stored variances and stored mapping form a set of compressed data for reconstruction of the matrix."
6127,US-11704581-B1,Determining crop-yield drivers with multi-dimensional response surfaces ,2020,"A system and method for visualizing one or more crop response surfaces. The system includes a geospatial database associated with a crop prediction engine. The geospatial database receives soil composition information for plots of land. The crop prediction engine identifies covariates from the soil composition information, which has a feature matrix. The crop prediction engine generates a multi-dimensional covariate training data set from the covariates. The crop prediction engine then applies the multi-dimensional covariate training data set to a machine learning training model to generate at least one predictive crop-yield predictive model. The crop prediction engine ranks covariates having feature set interactions. Subsequently, the crop prediction engine determines a dominant crop-yield feature set interaction from the ranked covariates having feature set interactions. The crop prediction engine generates a crop response surface from the dominant crop-yield feature set interaction. The crop prediction engine then visualizes the crop response surface."
6128,US-11589299-B2,Method of implementing self-organizing network for plurality of access network devices and electronic device for performing the same ,2020,"An electronic device configured to adjust a state of an access network including at least one cell may include: at least one processor, and a memory connected to the at least one processor, wherein the at least one processor is configured to control the electronic device to: obtain state history information of the access network at a first time point, determine, based on the obtained state history information, a first time period required to adjust a state of the access network, determine, based on the first time point and the first time period, a second time point, the second time point being a reference time point at which the state of the access network is to be adjusted, estimate a state of the access network at the second time point based on the obtained state history information, determine values of state control parameters for adjusting the state of the access network, based on the estimated state of the access network at the second time point, and transmit the determined values of the state control parameters to the access network, wherein the values of the state control parameters transmitted to the access network are applied, at the second time point, to the state control parameters of the access network, to adjust the state of the access network."
6129,US-11409839-B2,Programmable and hierarchical control of execution of GEMM operation on accelerator ,2020,"The present disclosure relates to a method for controlling execution of a GEMM operation on an accelerator comprising multiple computation units, a first memory device, and a second memory device. The method comprises determining an execution manner of the GEMM operation, the execution manner comprising partition information of the GEMM operation and computation unit allocation information of the partitioned GEMM operation; generating one or more instructions to compute the partitioned GEMM operation on one or more allocated computation units; and issuing the one or more instructions to at least one of a first queue and a second queue, which enables at least one of a first local controller and a second local controller to execute the one or more instructions, wherein the first local controller and the second local controller are configured to control data movement between the computation units, the first memory device, and the second memory device."
6130,US-11875167-B2,Method for deploying containerized protocols on very small devices ,2020,"A method includes: accessing a set of hardware parameters characterizing an embedded device; identifying a set of supported container functions based on the set of hardware parameters; accessing a selection of container functions; identifying a set of selected container functions based on the selection of container functions and the set of supported container functions; generating a hardware abstraction layer (HAL) including a set of libraries supporting the set of selected container functions; generating a container runtime environment (CRE) configured to execute, at the embedded device, a containerized application via the HAL, the containerized application including the set of selected container functions; installing the HAL and the CRE onto the embedded device; installing the containerized application onto the embedded device via the CRE; and at the embedded device, executing the containerized application via the CRE and the HAL."
6131,US-11734937-B1,Creating text classification machine learning models ,2020,"Techniques for creating a text classifier machine learning (ML) model are described. According to some embodiments, a language processing service finetunes a language ML model on unlabeled documents of a user, and then trains that finetuned language ML model on labeled documents of the user to be a text classifier that is customized for that user’s domain, e.g., the user’s documents. Additionally, the finetuned language ML model may be trained on labeled documents of the user, for prediction objectives for unlabeled data, before being trained as the text classifier."
6132,US-11848915-B2,Multi-party prediction using feature contribution values ,2020,"Techniques are provided for multi-party prediction using feature contribution values. One method comprises obtaining a first set of feature contribution values associated with respective ones of a plurality of machine learning models, wherein each machine learning model is trained using training data of a different party and each feature contribution value indicates a contribution by a corresponding feature to a prediction generated by the associated machine learning model; training an aggregate machine learning model using the obtained first sets of feature contribution values; receiving a second set of feature contribution values generated by applying data of at least one party to at least one machine learning model; and applying the second set of feature contribution values to the trained aggregate machine learning model to obtain a global prediction. Each feature contribution value may correspond to a masked feature, and the feature contribution values may not expose the source data of one party to another party."
6133,US-11611355-B2,Techniques for parameter set and header design for compressed neural network representation ,2020,"Systems and methods for encoding and decoding neural network data is provided. A method includes: receiving a neural network representation (NNR) bitstream including a group of NNR units (GON) that represents an independent neural network with a topology, the GON including an NNR model parameter set unit, an NNR layer parameter set unit, an NNR topology unit, an NNR quantization unit, and an NNR compressed data unit; and reconstructing the independent neural network with the topology by decoding the GON."
6134,US-11475313-B2,"Unsupervised, semi-supervised, and supervised learning using deep learning based probabilistic generative models ",2020,"Embodiments of the present systems and methods may provide techniques to discover features such as object categories that provide improved accuracy and performance. For example, in an embodiment, a method may comprise extracting, at the computer system, features from a dataset comprising a plurality of data samples using a backbone neural network to form a features vector for each data sample, training, at the computer system, using the features vectors for at least some of the plurality of data samples, an unsupervised generative probabilistic model to perform clustering of extracted features of the at least some of the plurality of data samples by minimizing a negative Log-Likelihood function, wherein clusters of extracted features form categories, and categorizing, at the computer system, at least some different data samples of the plurality of data samples, into the formed categories."
6135,US-11651498-B2,Method for accelerating three-dimensional object segmentation with point cloud simplifications ,2020,"Aspects of the subject disclosure may include, for example, a device that has a processing system including a processor; and a memory that stores executable instructions that, when executed by the processing system, facilitate performance of operations, including downsampling a full point cloud to obtain a downsampled point cloud, wherein the downsampling reduces a data size of the full point cloud; and using a machine-learning model to assign labels for segmentation and object identification to points in the downsampled point cloud, wherein the machine-learning model is trained on the full point cloud. Other embodiments are disclosed."
6136,US-11348300-B2,Avatar customization for optimal gaze discrimination ,2020,"Examples of systems and methods for rendering an avatar in a mixed reality environment are disclosed. The systems and methods may be configured to automatically select avatar characteristics that optimize gaze perception by the user, based on context parameters associated with the virtual environment."
6137,US-11800862-B2,Performing multiple actions on a plant object on a moving platform ,2020,"Various embodiments of an apparatus, methods, systems and computer program products described herein are directed to an agricultural observation and treatment system and method of operation. The system uses a pump in combination with a fluid regulator to obtain and disperse fluid from the fluid tanks. The fluid regulator includes a fluid input port, a fluid output port and a fluid control valve. A first tube fluidly coupled from the fluid pump to the fluid input port. The system includes a moveable treatment head having one or more spraying tips, including a first spraying tip. A second tube is fluidly coupled from the fluid output port to the moveable treatment head. A system includes a controller configured to provide to the fluid regulator to open and close the fluid control valve to release an amount of the first fluid."
6138,US-11779406-B2,Systems and methods for guidance of intraluminal devices within the vasculature ,2020,"System for guiding an instrument within a vascular network of a patient are disclosed. In some embodiments, the system receives a medical image from a medical imaging device and identifies a distal tip and a direction the instrument in the image. The system may then determine a waypoint for the distal tip of the instrument based at least in part on the position and direction of the distal tip of the instrument. The system may then generate a trajectory command for moving the instrument through the vascular network from the current position to the waypoint. The system may operate in a closed loop. The system may provide the trajectory command to a robotic medical system configured to move the instrument according to the command."
6139,US-11436715-B2,Image brand ranking ,2020,A method ranks image brands. An image brand model is trained to generate an image brand rank from image features. An augmented image brand model is trained to generate an augmented image brand rank from the image brand rank. Predicted financial features are generated from the augmented image brand rank using a feature generation model. A neural network model is trained to generate a predicted augmented image brand rank from the predicted financial features.
6140,US-11580012-B2,Smart test case generator ,2020,"Embodiments provide systems, methods, and computer-readable storage media for automated and objective testing of applications or processes. Graphical representations of the application may be analyzed to derive attribute data and identify flows (e.g., possible processing paths that may be accessed during utilization of the application by a user). Test cases may be automatically generated based on the attribute data and the identified flows. Additionally, testing scripts for testing the portions of the application corresponding to each identified flow may be generated using machine learning logic. Once generated, the testing scripts may be executed against the application to test different portions of the application functionality (or processes). Execution of the testing scripts may be monitored to generate feedback used to train the machine learning logic. Reports may be generated based on the monitoring and provided to users to enable the users to resolve any errors encountered during the testing."
