row_id,id,title,year,abstract
4501,US-10474147-B2,Autonomous vehicle ,2015,"An autonomous vehicle includes an input unit configured to receive selection input of at least one of a time mode for driving to a set destination, a fuel efficiency mode, a safety mode, or a comfort mode. The autonomous vehicle further includes a power source driver configured to control an engine comprising a supercharger or a turbocharger or both and a controller configured to control the power source driver to turn the supercharger or the turbocharger on or off according to the selected mode."
4502,US-10102189-B2,Construction of a phonetic representation of a generated string of characters ,2015,"Provided are methods, devices, and computer-readable media for generating a string of characters based on a set of rules; parsing the string of characters into string of graphemes; determining one or more phonetic representations for one or more graphemes in the string of graphemes based on a first data structure; determining at least one grapheme representation for one or more of the one or more phonetic representations based on a second data structure; and constructing the phonetic representation of the string of characters based on the grapheme representation that was determined."
4503,US-11652373-B2,Wireless charging method and apparatus thereof ,2015,"An electronic device is provided. The electronic device includes a housing, a wireless charging coil disposed inside the housing, a fan disposed inside the housing and in proximity to the coil, a temperature sensor disposed inside the housing and in proximity to the coil, a wireless charging circuit having the coil and configured to transmit power wirelessly to an external device via the coil, and a control circuit electrically connected to the fan, the temperature sensor, and the wireless charging circuit. The control circuit may be configured to receive a signal from the external device, receive data related to a temperature of the coil from the temperature sensor, and control the fan at least partially on the basis of at least one of the signal and the data."
4504,US-11601450-B1,Suspicious message report processing and threat response ,2015,"The present invention relates to methods, network devices, and machine-readable media for an integrated environment for automated processing of reports of suspicious messages, and furthermore, to a network for distributing information about detected phishing attacks."
4505,US-10146414-B2,Augmented physical and virtual manipulatives ,2015,"Techniques are disclosed for detecting, tracking, and recording data associated with physical manipulatives in a physical environment, and a corresponding set of virtual manipulatives in a virtual environment. Physical manipulative sensor devices may be configured to detect the position and/or movements of physical manipulatives within a physical environment, including simple or multi-step user interactions with physical manipulatives. The sensor devices and/or associated user computing devices may use the sensor data to determine updated positions, orientations, and configurations for one or more physical manipulatives within the physical environment, as well as defining relationships between sets of the physical manipulatives. Data identifying updated positions, orientations, configurations, and relationship of the physical manipulatives may be transmitted to associated user devices, and a corresponding virtual environment having virtual manipulatives may be output and updated via a graphical display screen to reflect the changes to the physical manipulatives within the physical environment."
4506,US-9582264-B1,Application rating prediction for defect resolution to optimize functionality of a computing device ,2015,"A computer-implemented method, system, and/or computer program product improves a functionality of a computing device by optimizing improvements to an application running on the computing device. Defects in an application identified by user reviews are prioritized by one or more processors to create a representational model of user reviews. A rating improvement to the application caused by changing the application to resolve complaints represented by top-k negative review representations that are clustered within the predetermined distance from the defect representation is predicted by the processor(s). Based on the predicted rating improvement, the processor(s) apply defect solutions that correct problems described in the top-k negative review representations that are clustered within the predetermined distance from the defect representation to generate an improved version of the application, and then install the improved version of the application on the computing device to improve the functionality of the computing device."
4507,US-10437717-B2,Defect reporting in application testing ,2015,"The present subject matter relates to defect reporting in application testing. In an implementation, a category of application testing is determined based on a testing instance of an application. The category of application testing is indicative of an aspect of the application, being tested. A list of previously reported defects associated with the determined category of application testing is displayed in a display layer over the testing instance of the application. A first user-input indicative of one of acceptance and rejection of a previously reported defect, from the list, with respect to the testing instance of the application is received. The first user-input is aggregated with previous user-inputs indicative of one of acceptance and rejection of the previously reported defect. It is determined whether the previously reported defect is irrelevant to the testing instance of the application based on the aggregation."
4508,US-10102421-B2,Method and device for face recognition in video ,2015,A method for face recognition in the video comprises: performing feature extraction on a target face in multiple image frames in the video to generate multiple face feature vectors respectively corresponding to the target face in the multiple image frames; performing time sequence feature extraction on the plurality of face feature vectors to convert the plurality of face feature vectors into a feature vector of a predetermined dimension; and judging the feature vector of the predetermined dimension by using a classifier so as to recognize the target face.
4509,US-11463786-B2,Cross-screen optimization of advertising placement ,2015,The current invention relates to a computer-generated method for optimizing placement of advertising content across multiple different devices. The system can allocate advertising campaigns and plans to various inventory types based on the probability of accurate consumer matching. Consumer matching can be achieved by generation of look-alike models in a consumer's device graph to predict future consumption behavior. The system includes an interface through which an advertiser can access relevant information about inventory and success of a given placement.
4510,US-10834218-B2,Event information system classifying messages using machine learning classification model and pushing selected message to user ,2015,"The present disclosure provides an event information push method performed at a computer system, the method including: collecting network messages from a social networking platform; performing aggregation on the network messages, to obtain corresponding event information; obtaining, for each piece of event information, one or more attributes from the corresponding category of network messages; obtaining, from an event information and user database, a user group corresponding to the one or more attributes of each piece of event information; and pushing each piece of event information to a user in the user group corresponding to the event information."
4511,US-10728012-B2,Method for operating switch and electronic device supporting the same ,2015,"An electronic device is provided. The electronic device includes a housing; a communication circuit in the housing and configured to generate a signal for a time division duplexer (TDD) and a frequency division duplexer (FDD); an antenna electrically connected with the communication circuit; a plurality of electrical paths; and a control circuit, wherein each electrical path comprises a first transistor configured to connect with each electrical path in series, and a second transistor configured to connect with each electrical path and a ground, wherein the control circuit is configured to receive a wireless signal, select at least one of the TDD and the FDD to transmit the received wireless signal, and selectively activate a first transistor and a second transistor disposed in at least one electrical path and first and second transistors disposed in at least another electrical path among the plurality of electrical paths based on the selection."
4512,US-10275209-B2,Sharing of custom audio processing parameters ,2015,Ambient sound is converted into an ambient audio stream. A processed ambient audio stream is generated by processing the ambient audio stream in accordance with a selected set of processing parameters selected from the plurality of processing parameter sets stored in the memory. Trigger data is searched and a new set of processing parameters is requested. The trigger data identifies the new set of processing parameters that is available for use in processing the ambient audio stream. A received new set of processing parameters is selected as the selected set of processing parameters. The processed ambient audio stream is converted into processed output sound.
4513,US-10394869-B2,Dynamically linking information in a network ,2015,"A method for dynamically linking information in a network using natural language processing on a computer system, the information being contained in a message of a user in the network, where a user interface of a user is provided being adapted for receiving and playing natural language input. The method including: (i) recording information from a first user in the network in natural language; (ii) translating the recorded information in natural language to a text information; (iii) identifying topics in the text information based on topics stored in a predefined database; (iv) combining the identified topics in the message with the set of weighted topics in the user profile of the first user; (v) updating a weight of each of the identified topics in the user profile of the first user; and (vi) publishing the text information."
4514,US-11073006-B2,Directional permeability upscaling of a discrete fracture network ,2015,A method for performing a borehole and/or subsurface formation-related action for a subsurface formation of interest includes: receiving a plurality of sets of fracture data for a subsurface rock; generating a discrete fracture network (DFN) for each set of fracture data; and determining a property of each DFN that corresponds to each set of fracture data. The method also includes: mapping the plurality of sets of fracture data to the corresponding property using artificial intelligence (AI) to provide an AI model; inputting a set of fracture data for the subsurface formation of interest into the AI model; outputting a property of the subsurface formation of interest from the AI model; and performing the borehole and/or subsurface formation-related action for the subsurface formation of interest using the property and equipment configured to perform the borehole and/or subsurface formation-related action.
4515,US-9972093-B2,Automated region of interest detection using machine learning and extended Hough transform ,2015,"A method for automatically detecting a region of interest in a digital medical image, comprising over-segmenting the image into a plurality of superpixels through use of an over-segmentation algorithm; for each pair of neighboring superpixels in the plurality of superpixels, computing, through a machine learning algorithm, the probability of each pair being in one of three predetermined classes; for each superpixel in the plurality of superpixels, computing a probability of the superpixel being in the region of interest; generating an edge map from computing each pixel's value based on the computed superpixel probabilities; applying an extended Hough transform to the generated edge map to generate a Hough parameter counting space; determining the optimal quadrilateral in the Hough parameter counting space by excluding false positive edges; and designating the region of interest as being within the boundary of the determined optimal quadrilateral."
4516,US-10552964-B2,Object tracking device and a control method for object tracking device ,2015,"In an object tracking device that obtains image data, detects an object, and tracks a target object, a matching unit collates image data of a characteristic model that represents a tracking object, which is a tracking target, with input image data, and outputs a candidate region of the tracking object. An object region determination unit determines an object region from the candidate region that is output by the matching unit. A depth map calculation unit calculates depth information relating to the input image. An object depth setting unit obtains the object region that has been determined by the object region determination unit in the past and the depth information that has been calculated by the depth map calculation unit, and sets a predetermined depth range where the object can exist. The object region determination unit determines an object region relating to the tracking object based on a region corresponding to the depth in a predetermined range set by the object depth setting unit and the candidate region that is extracted by the matching unit."
4517,US-9740508-B2,Alerting a user of an indicated impact of a command ,2015,"Disclosed aspects include alerting a user of an indicated impact of a command using a weight for the command. Using a set of command data which indicates an impact of a first command, a first weight for the first command is established. By monitoring a user, a predicted execution of the first command is detected. By comparing the first weight with a threshold weight, a determination is made to provide an alert to the user. In response to making the determination, the alert is provided to the user."
4518,US-10499173-B2,Switching binaural sound ,2015,"A method provides binaural sound to a person through electronic earphones. The binaural sound localizes to a sound localization point (SLP) in empty space that is away from but proximate to the person. When an event occurs, the binaural sound switches or changes to stereo sound, to mono sound, or to altered binaural sound."
4519,US-11948115-B2,Systems and methods for monitoring information security effectiveness ,2015,"Systems and methods for automatically assessing and monitoring information security effectiveness using collected indicia of sensitive content and indicia of security measure information for a plurality of networked organizational assets/systems to provide respective asset/system value at risk ratings. Elements of the system include automated asset discovery, automated hosting provider and location discovery, collection of information harvested from public sources and, optionally non-public sources, analysis of the collected information against public, non-public, and proprietary sources, and/or mathematical models used to infer broader security program conclusions and to rank asset/system values at risk. Estimates of values at risk are used to prioritize allocation of security measures."
4520,US-11027352-B2,Systems and methods for analyzing weld signatures using pulse forensic features ,2015,"Systems and methods for welding are described. The welding system can include, for example, a power source, a computer, and a welding torch. The computer and the welding torch can be operatively coupled to the power source. The power source controls a wire feed and one of a current or a voltage to the welding torch. When the welding torch is performing pulsed welding, the computer is configured to receive a weld signature. The computer is configured to synthesize features from the weld signature and to analyze the features for each pulse of the weld signature to determine whether particular limits have been exceeded or met. If particular limits are exceed or met, a weld fault condition is triggered which causes the welding system to stop or to modify the pulsed welding operation, and/or which causes the welding system to send out communications relating to the triggering of the weld fault condition."
4521,US-9986227-B2,Tracked automultiscopic 3D tabletop display ,2015,An apparatus for displaying three dimensional (3D) images to a viewer without the need for 3D glasses. The apparatus includes a display element with a lenticular display surface that is supported to be horizontal and face upward into a viewing space. The apparatus includes a location tracking element tracking a location of a viewer in the viewing space relative to the lenticular display surface. The apparatus includes a display controller generating reprojected content for operating the display element to display 3D images via the lenticular display surface. The reprojected content is generated by determining for each pixel of the display element the content or images passing through tracked and/or determined eye locations and then remapping content delivered to each of the pixels of the display element to achieve a predefined pattern of content in viewpoints of fixed camera positions for the display element.
4522,US-10403529-B2,Carrier transport device and carrier transport method ,2015,"A carrier transport device capable of delivering a carrier to and from an external transport device which transports the carrier is provided. The carrier transport device includes a housing on which the carrier is mountable, first ports provided in the housing and configured to deliver the carrier to and from the external transport device, second ports provided in the housing and provided with a lid opening/closing mechanism, and a transfer machine provided in the housing and configured to transfer the carrier. The first ports, the transfer machine and the second ports are disposed under a transport path of the external transport device. The first ports and the second ports are disposed on both sides of the transfer machine. The second ports are configured at multiple stages."
4523,US-9978425-B2,Method and device for associating frames in a video of an activity of a person with an event ,2015,"Described are methods and systems for associating frames in a video of an activity of a person with an event. The methods include recording a video of an activity of a person; storing a time-series of a plurality of sensor data (82) obtained from a sensor assembly (12) of at least one sensor (31, 32, 33, 34, 35) coupled to the person while the person is performing the activity; synchronizing the video with the sensor data (82); detecting an event in the time-series; and associating the event with at least one corresponding frame in the video showing the event."
4524,US-10419540-B2,Architecture for internet of things ,2015,The description relates to managing physical locations with IoT devices. One example can include a sensor array assembly comprising an enclosure and a mounting element. The mounting element can include multiple apertures spaced at different distances from the enclosure. The sensor array assembly can also include a connector that is receivable by individual apertures.
4525,US-9924343-B2,BLE beacon advertising a semantic label and IPv6 address ,2015,"A semantic signature serving as an index to a cataloged core semantic concept, and an IPv6 address associated with an entity labeled by a Bluetooth 4.0 Beacon are added to the Beacon's Generic Access Profile (GAP) advertisement enabling direct semantic discovery of the entity and facilitating data transactions relevant to it."
4526,US-10931633-B2,Syntactically and/or semantically relevant alternative domain name generation ,2015,"Provided are methods, devices, and computer-readable media for accessing a domain name; determining, via the processor, at least two words in the domain name; determining at least one alternative word for at least one word in the domain name; determining whether the at least one alternative word is contextually relevant; and generating at least one alternative domain name based on a determination that the at least one alternative word is contextually relevant."
4527,US-10373053-B2,Stream-based accelerator processing of computational graphs ,2015,"Methods, systems, and apparatus, including computer programs encoded on computer storage media, for receiving, by a computational graph system, a request to process a computational graph; obtaining data representing a subgraph of the computational graph, the computational graph comprising a plurality of nodes and directed edges, wherein each node represents a respective operation, wherein each directed edge connects a respective first node to a respective second node, the subgraph assigned to a first device by a placer in the computational graph system; determining that the first device comprises a hardware accelerator having a plurality of streams; in response to determining, generating instructions that when executed by the first device cause the first device to: assign the operation represented by each node in the subgraph to a respective stream; and perform the operations represented by the nodes in the subgraph in accordance with the assignment."
4528,US-9723145-B2,System and method for analysis and correlation of scoring and customer satisfaction ,2015,A system and method include a contact center to provide an interaction between a customer and agent. An analytics server connects with the contact center to parse a text of the interaction and determine an intent and a topic of the interaction based on the parsed text. The analytics server determines an implicit survey score for the interaction based on comparing the intent and the topic of the interaction with an intent and a topic of an interaction that was correlated with an explicit survey score.
4529,US-11829943-B1,Updating a position of a user within a materials handling facility ,2015,"Described is a multiple-camera system and process for re-identifying a user located in a materials handling facility based on user patterns and/or descriptors representative of the user. In one implementation, a user pattern and/or a plurality of descriptors representative of a user are maintained as a position of a user is tracked through a materials handling facility. If the tracking of the user is lost, the last known position is stored with the user pattern and/or descriptors. If a new object is detected and confirmed to be a user, a user pattern and/or descriptors of the new object are compared with the stored user pattern and/or descriptors to determine if the new object is the user."
4530,US-10712158-B2,Open terrain navigation systems and methods ,2015,"Navigation systems and methods are provided. A classifier is configured to transform a received image of a terrain into a classified image in which patches of pixels from the received image are represented as being in one of a specified number of material classes, each associated with respective terrain parameters. A physical traversability module is configured to determine, for the material parameters, a terrain topography and given vehicle parameters, a degree of traversability of the vehicle through the terrain as represented by the received image, to yield a traversability map. A routing module is configured to derive traversability measure(s) for route(s) through the classified image and with respect to the traversability map, between a given origin and a given destination or within a region with respect to a user-defined mission. A graphical user interface is configured to display the route(s) according to the traversability measure(s)."
4531,US-10906530-B2,Automatic parking system and automatic parking method ,2015,"An automatic parking system includes a smart key recognizing sensor recognizing a smart key positioned in a first area, a sensor system sensing presence or absence of a parking section line, and positions of surrounding vehicles when the smart key is recognized, a controller configured to analyze data sensed by the sensor system to calculate parking areas around a subject vehicle, calculate a range allowing generation of a moving path based on the parking areas, determine at least two parking types available at a current position of the subject vehicle in the range allowing generation of a moving path, provide a moving path range for a parking type that is selected among the moving path ranges, and receive a signal transmitted by the smart key to automatically park the subject vehicle in the optimal parking area."
4532,US-9576356-B2,Region clustering forest for analyzing medical imaging data ,2015,Systems and methods for training a region clustering forest include receiving a set of medical training images for a population of patients. A set of image patches is extracted from each image in the set of medical training images. A plurality of region clustering trees are generated each minimizing a loss function based on respective randomly selected subsets of the set of image patches to train the region clustering forest. Each of the plurality of region clustering trees cluster image patches at a plurality of leaf nodes and the loss function measures a compactness of the cluster of image patches at each leaf node in each of the plurality of region clustering trees.
