row_id,id,title,year,abstract
778,US-8396352-B2,Personal video recording with storage space distributed among remote personal video recorders ,2002,"Automated personal video recording comprising scheduling a show for a user having allocated storage space on a personal video recorder (“PVR”), wherein the show has a storage space requirement that exceeds the user's free space, and the PVR is coupled for data communications to a storage space provider; and transmitting to the storage space provider an order to record the show through the storage space provider in storage space on a remote PVR that is coupled for data communications to the storage space provider. Receiving in a storage space provider from a personal video recorder (“PVR”) an order to record a show on a remote PVR, the order comprising an identification of a show and a schedule for recording the show; selecting a remote PVR; and recording the show, in dependence upon the show identification and the schedule for recording the show, in storage space on the selected remote PVR."
779,US-8010402-B1,Method for augmenting transaction data with visually extracted demographics of people using computer vision ,2002,"The present invention is a system and framework for augmenting any retail transaction system with information about the involved customers. This invention provides a method to combine the transaction data records and a customer or a group of customers with the automatically extracted demographic features (e.g., gender, age, and ethnicity), shopping group information, and behavioral information using computer vision algorithms. First, the system detects faces from face view, tracks them individually, and estimates poses of each of the tracked faces to normalize. These facial images are processed by the demographics classification module to determine and record the demographics feature vector. The system detects and tracks customers to analyze the dynamic behavior of the tracked customers so that their shopping group membership and checkout behavior can be recognized. Then the instances of faces and the instances of bodies can be matched and combined. Finally, the transaction data from the transaction data and the demographics, group, and checkout behavior data that belong to the same person or the same group of people are combined."
780,US-7454042-B2,Apparatus for online signature verification using pattern transform technique and method therefor ,2002,"In an apparatus for online signature verification, a signature data input unit digitalizes a locus of a user signature and reads the locus as a sequence of points. A first and a second pattern transform unit performs a speed equalization and a velocity transform on the signature sequence and generates a first and a second transformed pattern sequence, respectively. A characteristics extraction unit extracts three characteristics vectors from the signature sequence, the first and the second transformed pattern sequence, respectively, to thereby generate the three characteristics vectors. A difference vector estimation unit generates a difference vector. A determination unit determines whether an input signature and the reference signature are signed by a single person."
781,US-8031196-B2,"Display, electronic device, data transmitting method, information terminal, host apparatus, program, recording medium ",2002,"A display device comprises a display section, a pattern specifying code input section which receives a pattern specifying code externally, a pattern storage section which stores therein an image of a predetermined pattern, and a pattern display processing section which reads out the image of a pattern specified by the pattern specifying code from the pattern storage section and displays the image on the display section. With this arrangement, the load on a host to display an image can be reduced."
782,US-7165024-B2,Inferring hierarchical descriptions of a set of documents ,2002,"A method automatically determines groups of words or phrases that are descriptive names of a small set of documents, as well as infers concepts in the small set of documents that are more general and more specific than the descriptive names, without any prior knowledge of the hierarchy or the concepts, in a language independent manner. The descriptive names and the concepts may not even be explicitly contained in the documents. The primary application of the invention is for searching of the World Wide Web, but the invention is not limited solely to use with the World Wide Web and may be applied to any set of documents. Classes of features are identified in order to promote understanding of a set of documents. Preferably, there are three classes of features. “Self” features or terms describe the cluster as a whole. “Parent” features or terms describe more general concepts. “Child” features or terms describe specializations of the cluster. The self features can be used as a recommended name for a cluster, while parents and children can be used to place the clusters in the space of a larger collection. Parent features suggest a more general concept, while children features suggest concepts that describe a specialization of the self feature(s). Automatic discovery of parent, self and child features is useful for several purposes including automatic labeling of web directories and improving information retrieval."
783,US-7601978-B2,Fabric wrinkle evaluation ,2002,"Fabric wrinkles are automatically evaluated using a reliable, accurate, affordable, and efficient system. Two algorithms are used, the facet model algorithm and the plane-cutting algorithm, to extract features for evaluating wrinkles in fabrics. These algorithms eliminate the need for independent evaluation of a fabric specimen by a technician."
784,US-7092536-B1,System for transducer compensation based on ambient conditions ,2002,"A system for transducer compensation based on ambient conditions includes a transducer, a signal processor and an ambient condition sensor. The signal processor may process audio signals for the transducer. In addition, the signal processor may receive signals from the ambient condition sensor. The signals may represent ambient conditions being experienced by the transducer. The signal processor may dynamically adjust the equalization of the audio signals based on the ambient conditions to optimize operation of the transducer."
785,ES-2214115-B1,AUTOMATIC OBJECT RECOGNITION SYSTEM BY PROJECTION ON AN ALGEBRAIC BASE AND REMOTELY CONTROLLED BY VIRTUAL REALITY. ,2002,"Automatic object recognition system by projection on an algebraic base and remotely controlled by virtual reality. The invention consists of an object recognition system consisting of a mobile autonomous agent equipped with image capture and processing systems, and an external station where, using virtual reality equipment consisting of glasses and glove, the device can be controlled. visual perception system of the mobile agent. The recognition process is, however, automatic and is based on projecting the shape of the object found on a fixed algebraic basis."
786,US-7171438-B2,Method for recognition of full-word saturating addition and subtraction ,2002,"A method of formulating and solving equations that facilitate recognition of full word saturating addition and subtraction The method includes formulating, for each basis addition statement z=x+y or subtraction statement z=x−y, data flow equations that describe properties of the program statements being analyzed; and solving the data flow equations. The properties may include: (a) the values BITS of program variables as Boolean functions of the sign bits of x, y and z; (b) the condition COND under which program statements are executed as Boolean functions of the sign bits of x, y and z; and (c) the condition REACH of which values of variables reach any given use of z when overflow/underflow/neither occurs."
787,US-6947042-B2,Method for mapping high-dimensional samples to reduced-dimensional manifolds ,2002,A method determines mappings between high-dimensional measured samples and a reduced-dimensional manifold. Samples are acquired of a physical system. The samples have a high number of dimensions. A low number of dimensions are determined for a manifold embedded in a space of the high-dimensional samples. Local charts having the dimensions of the low number of dimensions of the manifold are fitted to selected high-dimensional samples. The charts are then connected to determine a forward mapping from any high-dimensional sample to a coordinate on the manifold and a reverse mapping from any coordinate on the manifold to a corresponding point in high-dimensional sample space.
788,US-7556944-B2,Methods and compositions for use in preparing siRNAs ,2002,"Methods and compositions for producing siRNAs, e.g., in the form of a d-siRNA composition, from dsRNAs are provided. In the subject methods, a dsRNA is contacted with a composition that includes an activity that cleaves dsRNA into siRNAs, where the composition efficiently cleaves dsRNA into siRNAs. siRNAs produced by the subject methods find use in a variety of applications, particularly in applications where the specific reduction or silencing of a gene is desired. Also provided are kits for use in practicing the subject invention."
789,US-7174354-B2,"System and method for garbage collection in a computer system, which uses reinforcement learning to adjust the allocation of memory space, calculate a reward, and use the reward to determine further actions to be taken on the memory space ",2002,"A system and method for use with a virtual machine, including an adaptive, automated memory management process that takes decisions regarding which garbage collector technique should be used, based on information extracted from the currently active applications. Reinforcement learning is used to decide under which circumstances to invoke the garbage collecting processing. The learning task is specified by rewards and penalties that indirectly tell the RLS agent what it is supposed to do instead of telling it how to accomplish the task. The decision is based on information about the memory allocation behavior of currently running applications. Embodiments of the system can be applied to the task of intelligent memory management in virtual machines, such as the Java Virtual Machine (JVM)."
790,US-8047432-B2,Package tracking techniques ,2002,"Method and system for tracking packages including readable indicia in a movable cargo container includes mounting at least one scanner to an interior surface of the container capable of reading the indicia on, in or associated with the packages, operatively reading the indicia from the packages, converting the read indicia into an identification of the packages, and transmitting the package identifications to a remote facility. Each scanner may be controlled to read the indicia at predetermined times, upon command from the remote facility or upon detection of an event which could result in a change in the contents of the container. A positioning system may be arranged on the container to determine its location and the location of the container transmitted with the package identifications. This provides an entity managing the delivery or transport of the packages with an efficient way to track its package in real-time."
791,US-6810655-B2,Performance enhanced control of DLN gas turbines ,2002,"A control system and methodology for a gas turbine having multiple fuel valves for multiple combustion chambers involves tuning the fuel values to associated combustion chambers to optimize nitrous oxide emissions; dynamic pressure, and variation in fuel/air ratio. Further, fine tuning of the fuel values is then used to maintain dynamic pressure oscillations, nitrous oxide emissions or variation in fuel/air ratio within predetermined limits."
