row_id,id,title,year,abstract
4654,US-10578730-B2,"Method, apparatus and system for location detection and object aggregation ",2015,"A positioning determination method using an improved RFID location tag is described the tag including an RFID controller; memory; a power management module; and an accelerometer. The position determination method including the steps of periodically polling the RFID tags for information; receiving information from a plurality of reference RFID tags at a known location; receiving information from the non reference RFID tags, the information including the tag id and sensor data; calculating for each non reference and referenced RFID tag a received signal strength indication; and calculating an initial position for each non reference RFID tag based on the received signal strength indications and the positions of the reference RFID tags."
4655,US-10929492-B2,Utilizing attributes of users to cluster users at a waypoint ,2015,"A method, system and computer program product for assisting a user to meet with other users with complementary attributes. Attributes (e.g., likes, dislikes) of a user, such as a user of a mobile device, are received to populate a profile of the user. The user attributes of profiles of actively participating users that are located in a geographic area are analyzed with respect to the attributes of the user to identify other users with complementary profiles. Those users with complementary profiles as the user are clustered to form a “cluster” at a designated waypoint. Directions are then provided to the user to reach the designated waypoint to meet the other users of the same cluster. In this manner, the user is able to meet other users in the physical world with complementary interests and experiences at a designated waypoint."
4656,US-10884503-B2,VPA with integrated object recognition and facial expression recognition ,2015,"Methods, computing devices, and computer-program products are provided for implementing a virtual personal assistant. In various implementations, a virtual personal assistant can be configured to receive sensory input, including at least two different types of information. The virtual personal assistant can further be configured to determine semantic information from the sensory input, and to identify a context-specific framework. The virtual personal assistant can further be configured to determine a current intent. Determining the current intent can include using the semantic information and the context-specific framework. The virtual personal assistant can further be configured to determine a current input state. Determining the current input state can include using the semantic information and one or more behavioral models. The behavioral models can include one or more interpretations of previously-provided semantic information. The virtual personal assistant can further be configured to determine an action using the current intent and the current input state."
4657,US-10623472-B2,Maintaining control over restricted data during deployment to cloud computing environments ,2015,"Releases to the production environment of a cloud computing environment are deployed in a manner that maintains control over restricted data and the data plane of the cloud computing environment. A DevOps personnel is tasked with developing the release. However, the DevOps personnel is not authorized to deploy the release to the cloud computing environment because the DevOps personnel does not have access to restricted data in the cloud computing environment or the ability to modify the cloud computing environment to gain access to restricted data. Operating personnel who has access to restricted data and the right to modify the cloud computing environment is notified of the release and given release specifications providing details of the release. If the operator approves the release, the release is transferred to the cloud computing environment. A deployment engine then automatically deploys the release to the production environment of the cloud computing environment."
4658,US-10303983-B2,"Image recognition apparatus, image recognition method, and recording medium ",2015,"On the basis of subsidiary information associated with image data, an image for the image data is segmented into multiple subregions, and feature values are extracted for each of the subregions obtained through the segmentation. The category for each of the subregions is determined on the basis of the extracted feature values."
4659,US-10345483-B2,Observer-based meteorology and image identification ,2015,"The disclosure is directed to providing an observer-based scenic and aesthetic meteorology/weather model and service. Examples of observers include but are not limited to: photographers, particularly those who desire to take sunset and sunrise landscape photographs, videographers, motion picture crews, outdoor goers, aviation crews, tour groups, and weather enthusiasts."
4660,US-10664293-B2,Context oriented translation ,2015,"An example non-transitory computer-readable medium to store machine-readable instructions that when accessed and executed by a processing resource cause a computing device to perform operations is described herein. The operations include connecting a first properties file with a corresponding application. The first properties file includes a plurality of text entries and associated location indicators. Text in the application is identified that is to be translated. The text to be translated corresponds to at least some of the text entries in the first properties file. The identified text is presented in the application, which provides context for the translation. The translation is received and a second properties file that includes the translation of the identified text and an associated location indicator is generated."
4661,US-9979619-B2,Identifying a source of packet drops in a network ,2015,"In one embodiment, a device in a network performs a first comparison between observed and expected packet error rates for a first path in the network. The device identifies one or more intersecting paths in the network that intersect the first path. The device performs one or more additional comparisons between observed and expected packet error rates for the intersecting paths that intersect the first path. The device identifies a particular node along the first path as a source of packet drops based on the first comparison between the observed and expected packet error rates for the first path and on the one or more additional comparisons between the observed and expected packet error rates for the intersecting paths that intersect the first path."
4662,US-10718810-B2,Power drive transistor resonance sensor ,2015,A Transistor Resonant Characteristic Sensor (TReCS) includes a sensing element positioned along electronic equipment so that the sensing element is electromagnetically coupled to the electronic equipment. The sensing element includes a coil. The sensing element is configured to detect magnetic oscillations associated with a characteristic signal generated by the electronic equipment. The TReCS sensor further includes an evaluation circuit connected to the sensing element for monitoring health state of the electronic equipment. The evaluation circuit includes one or more processing elements configured to diagnose health state of the electronic equipment based on extracted baseband information associated with the characteristic signal.
4663,US-10650133-B2,Systems and methods for providing image-based security measures ,2015,"Systems, methods, and non-transitory computer-readable media can detect an operation that causes a challenge response process to be initiated. An image category associated with a recognized category label can be identified. At least one image associated with the image category can be displayed during the challenge response process. The operation can be executed when the challenge response process, based on the at least one image, is successfully completed."
4664,US-10438147-B2,Death care management system and method ,2015,A system that provides automated and semi-automated tools and methods that may be used by providers in the death care industry to manage time sensitive tasks and share information with third party providers of goods and services.
4665,US-10172569-B2,System and method for assisting decisions associated with events relative to withdrawal of life-sustaining therapy using variability measurements ,2015,"A system and method are provided that employ the variability of physiological waveforms to estimate the time to death after WLST, or time to inadequate organ perfusion. From the variability data one can derive an index subsequently used to determine the probability of death (or inadequate organ perfusion) within a given time frame in an automated fashion from bedside monitors in the intensive or post-anesthesia care unit. The resulting variability index can also be combined with the clinical variables used in other death prediction tools to enhance the performance and outcome when compared to existing models. In at least one implementation, variability monitoring at the bedside could be used to provide estimates of the probability that a patient will die within a certain time frame after WLST. These estimates could be used to reduce the distress of the patients' families, as well as optimize the use of resources surrounding donation."
4666,US-11418392-B2,Network resource management devices methods and systems ,2015,"A method of managing a configuration of a computer network system includes creating of an instance of a server by a user through an interface of a public cloud service. A management process detects the existence of the instance by regularly polling the cloud service for infrastructure data and analyzing the infrastructure data to determine that the newly created instance exists. The method also includes testing parameters of the server indicated in the infrastructure data, which parameters are fully determined by the request, against predefined one or more infrastructure policies, whereby the parameters are available and testable against the policies during the generating, but are tested after the request is enacted to create the instance without creating policy enforcement encumbrance on the user when the user creates the new instance of the server."
4667,US-11061398-B2,Machine-learning systems and techniques to optimize teleoperation and/or planner decisions ,2015,"A system, an apparatus or a process may be configured to implement an application that applies artificial intelligence and/or machine-learning techniques to predict an optimal course of action (or a subset of courses of action) for an autonomous vehicle system (e.g., one or more of a planner of an autonomous vehicle, a simulator, or a teleoperator) to undertake based on suboptimal autonomous vehicle performance and/or changes in detected sensor data (e.g., new buildings, landmarks, potholes, etc.). The application may determine a subset of trajectories based on a number of decisions and interactions when resolving an anomaly due to an event or condition. The application may use aggregated sensor data from multiple autonomous vehicles to assist in identifying events or conditions that might affect travel (e.g., using semantic scene classification). An optimal subset of trajectories may be formed based on recommendations responsive to semantic changes (e.g., road construction)."
4668,US-9547908-B1,Feature mask determination for images ,2015,"Implementations relate to feature mask determination for images. In some implementations, a computer-implemented method to determine a feature mask for an image includes estimating one or more prior regions in the image that define a feature in the image. The method determines superpixels based on multiple pixels of the image similar in color. The method constructs a graph, each node of the graph corresponding to a superpixel, and determines a superpixel score for each superpixel based on a number of pixels of the superpixel. The method determines one or more segmented regions in the image based on applying a graph cut technique to the graph based at least on the superpixel scores, and determines the feature mask based on the segmented regions. The feature mask indicates a degree to which pixels of the image depict the feature. The method modifies the image based on the feature mask."
4669,US-11197195-B2,Load balancing of data traffic in a communications network ,2015,There is provided mechanisms for load balancing data traffic between at least two carriers in a communications network supporting the at least two carriers. A method is performed by a system. The method comprises obtaining current channel quality information for a wireless device of the at least two carriers. The method comprises predicting a future volume of a data flow of the wireless device. The method comprises determining whether to offload the wireless device to a second carrier of the at least two carriers or not according to the current channel quality information and the predicted future volume.
4670,US-11224981-B2,Staged advice for optimal use of a shaving device ,2015,"A method, a personal care system and a shaving device for providing staged shaving advice include a processor configured to receive usage data from the shaving device and personal assessment data from a user. The processor is further configured to determine and provide a shaving advice instruction presented to the user based on the usage data and/or the personal assessment data."
4671,US-10440435-B1,Performing searches while viewing video content ,2015,Disclosed are various embodiments for performing searches while users are viewing video content. An explicit request from a user to initiate a search relative to video content is detected. An item in the video content is identified. The search is executed in a database to obtain information regarding the item. The information is presented to the user.
4672,US-9729571-B1,"System, method, and computer program for detecting and measuring changes in network behavior of communication networks utilizing real-time clustering algorithms ",2015,"A system, method, and computer program product are provided for detecting and measuring changes in network behavior of communication networks utilizing real-time clustering algorithms. In use, network traffic associated with at least one communication network is received. Additionally, the network traffic is characterized and classified based on similarities in the network traffic utilizing one or more real-time clustering algorithms. Further, changes in network behavior of the at least one communication network are detected and measured utilizing information associated with the classified network traffic."
4673,US-10445386-B2,Search result refinement ,2015,System and techniques for search result refinement are described herein. Search results and a search context may be obtained. A context dependent facet set may be added to a search result in the search results. A user interface of the context dependent facet set may be presented in conjunction with displaying the search results. A selection of a facet in the context dependent facet set may be received from a user. The search results being displayed may be filtered such that search results that meet a measurement of the facet are included in the displayed search results and the remaining search results are excluded from the display.
4674,US-10902115-B2,Neuromorphic system for authorized user detection ,2015,"Described is neuromorphic system for authorized user detection. The system includes a client device comprising a plurality of sensor types providing streaming sensor data and one or more processors. The one or more processors include an input processing component and an output processing component. A neuromorphic electronic component is embedded in or on the client device for continuously monitoring the streaming sensor data and generating out-spikes based on the streaming sensor data. Further, the output processing component classifies the streaming sensor data based on the out-spikes to detect an anomalous signal and classify the anomalous signal."
4675,US-10349212-B2,Using intrabody signal propagation to infer wearable device location on the body for sensor optimization and configuration ,2015,"An electronic device is operated by determining its location on a body of a human or an animal, as an ending point of a path from another electronic device. The path is predetermined by measuring at multiple frequencies, a property indicative of loss of an AC signal that propagates through the body along the path between the pair of electronic devices, to obtain measurements. The multiple measurements are thereafter used to select a particular path through the body, from among a group of paths through the body which are characterized in one or more training phases, e.g. by use of a classifier. After a particular path through the body is identified, based on an ending point of the particular path, an electronic device at that ending point is configured, e.g. by turning on or turning off a specific sensor, or by setting a rate of transmission of data."
4676,US-10803137-B2,Method and apparatus for grouping web page labels in a web browser ,2015,"Disclosed in the embodiments of the disclosure are methods and apparatuses for grouping web page labels. The method comprises: extracting titles of a plurality of web page labels in a tab bar of a browser; calculating semantic distances between the extracted plurality of titles; clustering web page labels corresponding to the plurality of titles based on the semantic distances between the plurality of titles; obtaining at least one label group based on the clustering, the one label group comprising at least one web page label; and sequentially arranging the at least one label group in the tab bar, the web page labels belonging to the same label group being successively arranged in the tab bar. After grouping, the web page labels are still presented in the format of web page labels in the tab bar and a web page label can be selected with a single click. Moreover, web page labels belonging to the same label group are successively arranged together in the tab bar, such that the web page labels in the tab bar are arranged and ordered and a user can find a needed web page label quickly through the tab bar, thus improving user experience."
4677,US-11956516-B2,System and method for creating and distributing multimedia content ,2015,"A system and method may analyze an input video content to produce analysis results. An event captured in the input video content may be identified based on the analysis results. A start time and an end time of a segment of the input video content, the segment including the event, may be determined and, an output video content may be generated by including the segment in the output video content."
4678,US-10536352-B1,Systems and methods for tuning cross-platform data collection ,2015,"In one embodiment, a method includes extracting a cross-platform data-collection schema based, at least in part, on information available via heterogeneous interfaces of a plurality of source platforms. The cross-platform data-collection schema identifies a plurality of collectable data points in relation to particular source platforms. The method further includes configuring a cross-platform data-collection schedule for the plurality of source platforms. The cross-platform data-collection schedule indicates a collected subset of the plurality of collectable data points in relation to collection frequencies. The method also includes causing data values for the collected subset to be collected on an ongoing basis as dictated by the cross-platform data-collection schedule. Furthermore, the method includes processing a proposed change to at least one of the collected subset and the collection frequencies. In addition, the method includes modifying the cross-platform data-collection schedule to reflect the proposed change."
4679,US-10742624-B2,Sentinel appliance in an internet of things realm ,2015,"There is disclosed in one example a sentinel device, including: a hardware platform including at least a processor and configured to provide a trusted execution environment (TEE); and a security engine operable to instruct the hardware platform to: determine that an internet of things (IoT) device in a first realm R1requires a secure communication channel with a second device in a second realm R2; query a key server for a service appliance key for the secure communication channel; establish a secure communication channel with the endpoint device using the service appliance key and the TEE; and provide a security service function within R1including brokering communication via the secure communication channel between the IoT device and the second device."
4680,US-10521210-B1,Programming language conversion ,2015,Systems and methods for converting an application to new programming language or framework is provided. A source application written in a legacy framework is analyzed and divided into smaller segments of code. The smaller segments are evaluated for quality in view of best practices design for writing applications. A rubric is determined for each segment and compared to a best practice threshold. Segments can be evaluated for features that can be passed through a model. The model converts the features into code in the new programming language. Machine learning and rules databases are updated with details of the conversion.
4681,US-10628740-B2,Asynchronous stochastic gradient descent ,2015,"The example computer-implemented method may comprise computing, by a generator processor on each of a plurality of learners, a gradient for a mini-batch using a current weight at each of the plurality of learners. The method may also comprise generating, by the generator processor on each of the plurality of learners, a plurality of triples, wherein each of the triples comprises the gradient, the weight index of the current weights used to compute the gradient, and a mass of the gradient. The method may further comprise performing, by a reconciler processor on each of the plurality of learners, an allreduce operation on the plurality of triples to obtain an allreduced triple sequence. Additionally, the method may comprise updating, by the reconciler processor on each of the plurality of learners, the current weight at each of the plurality of learners to a new current weight using the allreduced triple sequence."
4682,US-10741170-B2,Speech recognition method and apparatus ,2015,"A speech recognition method comprises: generating, based on a preset speech knowledge source, a search space comprising preset client information and for decoding a speech signal; extracting a characteristic vector sequence of a to-be-recognized speech signal; calculating a probability at which the characteristic vector corresponds to each basic unit of the search space; and executing a decoding operation in the search space by using the probability as an input to obtain a word sequence corresponding to the characteristic vector sequence."
4683,US-10726060-B1,Classification accuracy estimation ,2015,"A technology for determining accuracy estimates for classifications used in an electronic catalog. In one example, classifications for product groupings included in an electronic catalog may be updated as a result of the classifications inaccurately representing products included in the product groupings. The electronic catalog of products may be grouped into a plurality of product groupings using classifications. Classifications of product groupings that inaccurately represent products included in the product grouping may be updated with suggested classifications. Update metrics for updates made to the grouping classifications may be collected and the update metrics may be used to calculate an accuracy estimate for the classifications used in the electronic catalog."
4684,US-11721192-B2,System and method of detecting chemicals in products or the environment of products using sensors ,2015,"Systems and methods for detecting, monitoring or measuring chemical concentrations in products intended for consumption or the environment of products intended for consumption throughout the supply chain, beginning with producers, processors, packagers, transporters, distributors and ending with retailers and consumers."
4685,US-10515462-B2,Pixel wise illuminant estimation ,2015,"The disclosure concerns estimating an illumination spectrum of a pixel of hyperspectral or multispectral image data. A processor determines an optimised illumination spectrum for a first point based on an initial illumination spectrum and based on associations between the first point and multiple second points of multiple instances of the image data, wherein each of the multiple instances is associated with a refined amount of image information. It is possible to determine the illumination spectrum per pixel of the original image data without clustering pixels or restrictive assumptions but instead by utilising the associations for the statistical inference on the illumination spectrum."
