row_id,id,title,year,abstract
2706,US-9688286-B2,System and method for integrating smartphone technology into a safety management platform to improve driver safety ,2009,"Identifying risky driving situations in the context of a driver's real-time operating environment and providing effective interventions and countermeasures that mitigate the risky situation to reduce the likelihood of the driver having a vehicular accident. A driver monitoring and mentoring system includes mobile safety centers individually installed on driver-assigned smartphones or other mobile devices. The mobile safety centers collect real-time driving data and compute a risk of a driver in a specific situation being involved in an accident and provide mentoring to drivers in a driver risk situation above a risk threshold to reduce the likelihood of an accident. The mobile safety centers communicate with a master safety analytics center that collects data, collects and stores information relating to detected risk situations, creates risk algorithms, creates driving mentoring communications, and communicates the algorithms and communications to the mobile safety centers."
2707,US-9495460-B2,Merging search results ,2009,"Merging search results is required, for example, where an information retrieval system issues a query to multiple sources and obtains multiple results lists. In an embodiment a search engine at an Enterprise domain sends a query to the Enterprise search engine and also to a public Internet search engine. In embodiments, results lists obtained from different sources are merged using a merging model which is learnt using a machine learning process and updates when click-through data is observed for example. In examples, user information available in the Enterprise domain is used to influence the merging process to improve the relevance of results. In some examples, the user information is used for query modification. In an embodiment a user is able to impersonate a user of a specified group in order to promote particular results."
2708,US-8929209-B2,Quantum and promiscuous user agents ,2009,"A call processing system includes a call processing server. The call processing server processes calls for an internal network that employs SIP features and functions. The call processing server can receive calls from or send calls to one or more external communication endpoints that are not part of the internal network. However, the call processing server can associate a floating user agent with the communication from the external communication endpoint and lock the floating user agent to a gateway. After locking onto a gateway and initiating the call, the floating user agent can then publish call event status and receive SIP primitives similar to other SIP-enabled devices."
2709,US-8676784-B2,Relevant individual searching using managed property and ranking features ,2009,"Embodiments are configured to provide information relevant to individuals of interest to a searching user. In an embodiment, a method includes identifying relevant individuals of a network using a relevance model that includes the use of a number of managed properties and ranking features to identify relevant individuals of a defined network. The relevance model of one embodiment is defined by a schema that includes a textual matching ranking feature, social distance ranking feature, a levels to top ranking feature, and a proximity ranking feature."
2710,US-11237637-B2,Gesture recognition systems ,2009,"A method and apparatus for performing gesture recognition. In one embodiment of the invention, the method includes the steps of receiving one or more raw frames from one or more cameras, each of the one or more raw frames representing a time sequence of images, determining one or more regions of the one or more received raw frames that comprise highly textured regions, segmenting the one or more determined highly textured regions in accordance textured features thereof to determine one or more segments thereof, determining one or more regions of the one or more received raw frames that comprise other than highly textured regions, and segmenting the one or more determined other than highly textured regions in accordance with color thereof to determine one or more segments thereof. One or more of the segments are then tracked through the one or more raw frames representing the time sequence of images."
2711,US-8310520-B2,Flexible decomposition and recomposition of multimedia conferencing streams using real-time control information ,2009,"A multimedia conferencing system is presented that can modify the composite multimedia stream into separate multimedia streams. Two or more video conference participants send multimedia streams, capturing and encoding the conference at the participant's location, to a multimedia server. The multimedia server includes a multipoint control unit that creates a composite multimedia display, which includes video regions corresponding to at least two of the multimedia streams from the participants. A composite multimedia stream describes the composite multimedia display. The ancillary server receives the composite multimedia stream from the multipoint control unit together with static and dynamic control information, which describes the format and layout of the composite multimedia display and the composite multimedia stream. Using the dynamic and static control information, the ancillary server decomposes the composite multimedia stream into two or more constituent streams. The two or more constituent streams may then be separately processed."
2712,US-8306807-B2,"Structured data translation apparatus, system and method ",2009,An apparatus is provided that includes a processor and a memory. The processor is configured to determine a category for a group of isolated noun phrases in a structured or semi-structured data source stored in the memory. The group of isolated noun phrases includes one or more isolated noun phrases. The processor is also configured to translate the group of isolated noun phrases from a source language to a target language using a category-driven isolated noun phrase translation. The determination of the category and the category-driven isolated noun phrase translation are performed based on context derived from the group of isolated noun phrases.
2713,US-8249394-B2,Method and system for shift-map image editing ,2009,"Natural looking output images are computed from input images based on given user constraints. Pixels in the output images are assigned a shift such that the respective output pixel value is derived from the value of the input pixel whose location is related to that of the output pixel by the shift, at least one shift being non-zero. The shift is determined by an optimization process adapted to minimize a cost function that includes a data term on the shifts of single pixels and a smoothness term on the shifts of pixel pairs. The output image is computed by applying the optimized shift-map between the input and output pixels. The data term can include shift constraints that limit the location in the output images of selected input pixels, and saliency constraints, indicating a preference that selected pixels in the input images will or will not appear in the output image."
2714,US-8554696-B2,Efficient computation of ontology affinity matrices ,2009,"In one embodiment, generating an ontology includes accessing an inverted index comprising a plurality of inverted index lists. An inverted index list may correspond to a term of a language. Each inverted index list may comprise a term identifier of the term and one or more document identifiers indicating one or more documents of a document set in which the term appears. The embodiment also includes generating a term identifier index according to the inverted index. The term identifier index comprises a plurality of sections and each section corresponds to a document. Each section may comprise one or more term identifiers of one or more terms that appear in the document."
2715,US-8527223-B2,Methods and systems for energy prognosis ,2009,"In one embodiment, a method for managing an industrial process wherein a processor transforms electronic data into an energy prognosis is provided. An energy related test signal including effective power test data indicative of electrical energy consumed by an energy consuming machine may be received. The energy related test signal may be partitioned into an energy related test sub-signal. Mathematical functions may be applied to the energy related test sub-signal to extract a feature set of data from the energy related test sub-signal. The feature set of data may be transformed with a transformation matrix into a reduced test feature set. The reduced test feature set may be input into a performance assessment algorithm based at least in part upon a reduced training feature set derived from data indicative of electrical energy consumed during healthy operation. A power-based performance index may be generated with the performance assessment algorithm."
2716,US-8782035-B2,Syndicated data stream content provisioning ,2009,"Apparatus for syndicated data stream content provisioning, the apparatus comprising: an interaction tracker, configured to track at least one interaction of a user with at least one content object of a respective one of a group consisting of at least one syndicated data stream received on a computer device, the interaction being implicitly indicative of a preference of the user, a ranking function calculator, in communication with the interaction tracker, configured to calculate a ranking function based on the tracked interaction, and a content ranker, in communication with the ranking function calculator, configured to rank a plurality of content objects of the syndicated data streams of the group, in an order based on the calculated ranking function."
2717,US-9727312-B1,Providing subject information regarding upcoming images on a display ,2009,"Methods are described for presenting in a user interface information regarding the subject faces that will appear in upcoming images. In general, many of the images available to display will be comprised of images containing subject faces. Based on a subject affinity score between the viewer and the subjects, and image affinity is computed. Based on the image affinity scores, images are selected for presentation on the display. As images are displayed, the system analyzes some portion of the upcoming images to determine the subject information to display. As each image is displayed, subject information comprised of the subjects face and subject prominence information may be shown in an area of the display adjacent to the current image. The subject prominence information may be determined as a function of a face size ratio value and a zone value."
2718,US-8370142-B2,Real-time transcription of conference calls ,2009,"Described herein are embodiments of systems, methods and computer program products for real-time transcription of conference calls that employ voice activity detection, audio snippet capture, and multiple transcription instances to deliver practical real-time or near real-time conference call transcription."
2719,DE-112010000775-B4,INDUSTRIAL ROBOT SYSTEM ,2009,"An industrial robot system comprising a robot having a manipulator (31) and a hand and used for a production system for mounting a product which is an object to be manufactured, comprising: a temporary stop action planning section (4) for generating task information and a first working path to address a first temporary stop, which is an obstacle to a training task when a production line is started up and set, and an unmanned continuous operation; An error introduction task prevention section (5) for generating error information used for preventing a task that introduces an error based on the task information; A training task section (6) for generating a second working route which accurately indicates absolute coordinates based on the first working route and the error information; An operation management section (7) for generating a robot optimized third working path based on the second working route; A reference library (8) formed by associating a mounting task of the robot and control software with each other; An optimal task operation generating section (11) for generating an operation of specific tasks; ..."
2720,US-8699075-B2,Printer image log system for document gathering and retention ,2009,"A system and method for document image acquisition and retrieval find application in litigation for responding to discovery requests. The method includes receiving automatically acquired electronic image logs comprising image data and associated records for documents processed by a plurality of image output devices within an organization. When a request for document production is received, the image logs (and/or information extracted therefrom) are automatically filtered through at least one classifier trained to return documents responsive to the document request, and documents corresponding to the filtered out image logs are output. One of the filters may be configured for filtering out documents that include attorney-client exchanges."
2721,US-8332070-B2,Learning and use of schemata in robotic devices ,2009,"A robotic controller using schemata, the schemata being a set of parameterized sequences of motor commands in order to make a robot to achieve a set goal, the parameters of the sequences being gained from the state variables of the robotic controller, a robotic controller comprising an interface for supplying sensory input to the robotic controller. A schemata state memory (1) structure supplied with either input from a schemata recognition module (4) or input from an inverse model module (2) or combinations of them. An inverse model module (2) for generating motor commands based on state variables and stored schemata, a forward model module (3) for predicting state variables based on state variables and stored schemata, and a schemata recognition module (4) for selecting a schemata based on supplied state variables of the robot controlled by the robotic controller."
2722,US-8972878-B2,Screen icon manipulation by context and frequency of Use ,2009,"Dynamic device management is provided based on a change in context. The management can be for one or more of icons, application, operating system(s), preferences, display characteristics, and the like. Detection and/or monitoring of one or more of presence information, environmental information, user information, recent activity information, inbound/outbound communication information, external stimuli information, geopositional information, temporal information, calendar information, user information, biometric information, and security information can be used as inputs to determining a change in this context."
2723,US-9395707-B2,Dynamic contingency avoidance and mitigation system ,2009,"The disclosed subject matter provides systems and methods for allocating resources within an infrastructure, such as an electrical grid, in response to changes to inputs and output demands on the infrastructure, such as energy sources and sinks. A disclosed system includes one or more processors, each having respective communication interfaces to receive data from the infrastructure, the data including infrastructure network data, one or more software applications, operatively coupled to and at least partially controlling the one or more processors, to process and characterize the infrastructure network data; and a display, coupled to the one or more processors, for visually presenting a depiction of at least a portion of the infrastructure including any changes in condition thereof, and one or more controllers in communication with the one or more processors, to manage processing of the resource, wherein the resource is obtained and/or distributed based on the characterization of the real time infrastructure data."
2724,US-8842267-B2,Device for determining particle sizes ,2009,"A method for measuring particle size distributions of bulk materials such as cereals, cereal milling products, cereal products and the like, which is intended to enable the measurement of particle size distributions which vary by orders of magnitude. A sample of isolated particles is optically detected in an arrangement by at least two measurement methods. Preferably, detection of the contours of the particles and laser diffraction take place at the same time."
2725,US-8934663-B2,Digital watermarking ,2009,A device for applying or extracting a digital watermark of two or more dimensions and a method of applying or extracting the digital watermark. The digital watermark is generated by adding a suitable number of watermarking arrays. Each watermarking array is constructed by convolving a multi-periodic shift array having a correlation bounded by a constant (two or greater) with a balanced periodic substitution sequence.
2726,US-8447272-B2,Authentication and human recognition transaction using a mobile device with an accelerometer ,2009,"Methods, devices, and systems are presented for screen locking or delaying the screen locking of mobile devices, such as smart phones, based on whether the gait of the current user match that of its true, authorized owner. A user's gait can be measured using accelerometers embedded in the device. Other movements, such as where a user normally goes to work, can be measured using GPS or other positional location data and used to lock or delay locking of the screen."
2727,US-8909609-B2,"Methods, systems and computer program products for providing a distributed associative memory base ",2009,"Systems, methods and computer program products are provided for a distributed associative memory base. Such methods may include providing a distributed memory base that includes a network of networks of associative memory networks. The memory base may include a network of associative memory networks, a respective associative memory network comprising associations among a respective observer entity and a plurality of observed entities that are observed by the respective observer entity. Ones of the associative memory networks are physically and/or logically independent from other ones of the associative memory networks. Methods include imagining associations from the associative memory base using a plurality of streaming queues that correspond to ones of a plurality of rows of ones of the associative memory networks."
2728,US-8478582-B2,Server for automatically scoring opinion conveyed by text message containing pictorial-symbols ,2009,"A server is disclosed for computing a score of an opinion that a message in a text file is expected to convey regarding a subject to be evaluated, wherein the message is written using literal strings and pictorial symbols. In this server, by the use of a pictorial-symbol dictionary memory storing a correspondence between designated pictorial-symbols to be rated and scores of opinions expressed by the respective pictorial-symbols, at least one of the used pictorial-symbols in the message which is coincident with at least one of the designated pictorial-symbols stored in the pictorial-symbol dictionary memory, is extracted from the message, at least one of the opinion scores which corresponds to the at least one extracted pictorial-symbol is retrieved within the pictorial-symbol dictionary memory, and an aggregate net opinion score for the message is calculated, based on an aggregate opinion score for the at least one extracted pictorial-symbol."
2729,US-11931131-B2,"Apparatus, system and method for chronic disease monitoring ",2009,"An apparatus, system, and method for monitoring a person suffering from a chronic medical condition predicts and assesses physiological changes which could affect the care of that subject. Examples of such chronic diseases include (but are not limited to) heart failure, chronic obstructive pulmonary disease, asthma, and diabetes. Monitoring includes measurements of respiratory movements, which can then be analyzed for evidence of changes in respiratory rate, or for events such as hypopneas, apneas and periodic breathing. Monitoring may be augmented by the measurement of nocturnal heart rate in conjunction with respiratory monitoring. Additional physiological measurements can also be taken such as subjective symptom data, blood pressure, blood oxygen levels, and various molecular markers. Embodiments for detection of respiratory patterns and heart rate are disclosed, together with exemplar implementations of decision processes based on these measurements."
2730,US-8660193-B2,"Parallel, pipelined, integrated-circuit implementation of a computational engine ",2009,"Embodiments of the present invention are directed to parallel, pipelined, integrated-circuit implementations of computational engines designed to solve complex computational problems. One embodiment of the present invention is a family of video encoders and decoders (“codecs”) that can be incorporated within cameras, cell phones, and other electronic devices for encoding raw video signals into compressed video signals for storage and transmission, and for decoding compressed video signals into raw video signals for output to display devices. A highly parallel, pipelined, special-purpose integrated-circuit implementation of a particular video codec provides, according to embodiments of the present invention, a cost-effective video-codec computational engine that provides an extremely large computational bandwidth with relatively low power consumption and low-latency for decompression and compression of compressed video signals and raw video signals, respectively."
2731,US-8340435-B2,Method and system for object recognition search ,2009,A method for object recognition using shape and color features of the object to be recognized. An adaptive architecture is used to recognize and adapt the shape and color features for moving objects to enable object recognition.
2732,US-9484027-B2,Using pitch during speech recognition post-processing to improve recognition accuracy ,2009,"A method of automated speech recognition in a vehicle. The method includes receiving audio in the vehicle, pre-processing the received audio to generate acoustic feature vectors, decoding the generated acoustic feature vectors to produce at least one speech hypothesis, and post-processing the at least one speech hypothesis using pitch to improve speech recognition accuracy. The speech hypothesis can be accepted as recognized speech during post-processing if pitch is present in the received audio. Alternatively, a pitch count for the received audio can be determined, N-best speech hypotheses can be post-processed by comparing the pitch count to syllable counts associated with the speech hypotheses, and the speech hypothesis having a syllable count equal to the pitch count can be accepted as recognized speech."
2733,US-8200671-B2,Generating a dictionary and determining a co-occurrence context for an automated ontology ,2009,"According to one embodiment, generating a dictionary and determining a co-occurrence context includes accessing a domain corpus comprising articles. Each article corresponds to a particular topic and comprises one or more terms that link to one or more other articles corresponding to one or more other topics. Each topic is designated as a term to yield a dictionary. A co-occurrence context is defined for the domain corpus. At least two terms appearing in the co-occurrence context are considered co-occurring. Co-occurrences among the terms are calculated according to the co-occurrence context."
2734,US-8845187-B2,Zero heat flux temperature sensing device ,2009,"The invention relates to a zero heat flux temperature sensing device (100) for sensing a core body temperature of an object (113). The zero heat flux temperature sensing device (100) comprises a layer (107), a first temperature gradient sensor (105), a first heat flux modulator (103) and a heat flux modulator controller (102). The layer (107) has an opposing first side (112) and second side (108). In use the first side (112) is nearest to the object (113). The layer (107) is for obtaining a first temperature difference over the layer (107) in response to a first heat flux in a first direction from the first side (112) to the second side (108). The first temperature gradient sensor (105) senses at the first side (112) of the layer (107) a second temperature difference in a second direction. The second direction extends from a first border of the first side (112) towards a second border of the first side (112). The first heat flux modulator (103) is arranged at the first side (112) of the layer (107) and is constructed to change a second heat flux in a second direction at the first side (112) of the layer (107) in order to influence the second temperature difference. The heat flux modulator controller (102) controls the first heat flux modulator (103) on basis of the sensed second temperature difference in order to decrease an absolute value of the second temperature difference. The effect of the measures according to the invention is that the zero heat flux temperature sensing device (100) senses the core body temperature of the object (113) more accurately."
