row_id,id,title,year,abstract
2854,US-8694453-B2,"Dialogue control system, method and computer readable storage medium, and multidimensional ontology processing system, method and computer readable storage medium ",2009,"A dialogue control system that uses an ontology that systematically expresses domain knowledge representing concepts and relationships between concepts to determine questions for a user and implements the questions, and implements a dialogue in accordance with received user answers. One or more dimension-classified ontologies and a basic ontology are stored, a concept from a user response is specified as a condition, and one or a plural number of the dimension-classified ontologies that meet the specified condition are fetched. The content of the fetched dimension-classified ontology/ies is overwritten on the basic ontology, in order according to dimension priorities from the dimension-classified ontology with the lowest dimension priority, and a multidimensional ontology is generated. The dialogue control system uses this multidimensional ontology to control the dialogue."
2855,US-8762131-B1,Systems and methods for managing a complex lexicon comprising multiword expressions and multiword inflection templates ,2009,"In some embodiments, linguistic knowledge bases including multiword lexicon entries belonging to various natural languages are generated and maintained. Multiword lexicon entries include representations of multiword expressions (e.g. composite words such as “expectation value”, verbal phrases such as “to stumble upon”, and idiomatic phrases such as “to hit the nail on the head”), and multiword inflection templates (e.g. “more adjective” as a symbolic representation for the comparative form of adjectives). A representation of a multiword lexicon entry, including a dependency tree and/or an attribute-value tree, is displayed within a graphical user interface, allowing a user to verify, update, and correct lexical data. Computer-readable encodings (e.g. XML) of dependency tree and/or attribute-value tree data are saved as part of each lexicon entry."
2856,ES-2676502-T3,Provision of image sensors to detect image information for automatic image data processing ,2009,"Arrangement of image sensors (1) for detecting image information for automatic image data processing with a plurality of sensor cells of the same type (2), each of which has an image sensor (3) with a own sensor optics (8), an image memory for storing image information from the image sensor (3) and an evaluation unit (4) for processing the image information, wherein the sensor cells (2) are arranged in at least one row, such that the detection zones (7) of the image sensors (3) of the directly adjacent sensor cells (2) overlap, characterized in that each sensor cell (2) has for at least one data interface (5) to an adjacent sensor cell (2) and is configured to access the image data of the overlapping detection area (7) of the adjacent sensor cell (2) via the corresponding data interface (5), where the evaluation units ation (4) are configured in each case to determine a correlation of these image data."
2857,US-8306931-B1,"Detecting, classifying, and tracking abnormal data in a data stream ",2009,"The present invention extends to methods, systems, and computer program products for detecting, classifying, and tracking abnormal data in a data stream. Embodiments include an integrated set of algorithms that enable an analyst to detect, characterize, and track abnormalities in real-time data streams based upon historical data labeled as predominantly normal or abnormal. Embodiments of the invention can detect, identify relevant historical contextual similarity, and fuse unexpected and unknown abnormal signatures with other possibly related sensor and source information. The number, size, and connections of the neural networks all automatically adapted to the data. Further, adaption appropriately and automatically integrates unknown and known abnormal signature training within one neural network architecture solution automatically. Algorithms and neural networks architecture are data driven, resulting more affordable processing. Expert knowledge can be incorporated to enhance the process, but sufficient performance is achievable without any system domain or neural networks expertise."
2858,US-9002077-B2,Visualization of stained samples ,2009,"Methods and systems are disclosed that include: applying an immunohistochemical stain, eosin, and a counterstain to a sample; obtaining a plurality of images of the sample, each of the plurality of images corresponding to radiation from the sample in a different wavelength band; decomposing the plurality of images of the sample to obtain component images corresponding to the immunohistochemical stain, eosin, and the counterstain; and generating a sample image based on the component images, where the sample image includes contributions from the counterstain and from one of the immunohistochemical stain and eosin, and substantially not from the other of the immunohistochemical stain and eosin."
2859,US-8805953-B2,Differential file and system restores from peers and the cloud ,2009,"Provided herein are systems and methodologies for highly efficient restoration in a network-based backup system. As described herein, differential-based analysis can be utilized such that a new complete differential is calculated based on signatures and/or other information relating to a given item to be restored prior to retrieving backup data. Based on the differential, only blocks determined to be unique between the current version of the item and the desired version are transmitted, which can then be merged with non-unique locally present blocks to obtain the fully restored version of the item. Further, a hybrid architecture can be employed, wherein signatures and/or data are stored at a global location within a network as well as one or more local peers. Accordingly, a backup client can obtain information necessary for restoration from either the global location or a nearby peer, thus further reducing latency and bandwidth consumption."
2860,US-8482520-B2,"Method for tap detection and for interacting with and a handheld electronic device, and a handheld electronic device configured therefor ",2009,"A method for tap detection and for interacting with a handheld electronic device, and a handheld electronic device configured therefore are described. In accordance with one embodiment, there is provided a method for tap detection on a handheld electronic device, comprising: measuring acceleration using an accelerometer of the handheld electronic device; determining when measured acceleration exceeds an upper limit threshold and a lower limit threshold within a predetermined duration of each other; when the upper limit threshold and lower limit threshold have been exceeded, determining a rate of change of acceleration between the upper limit threshold and lower limit threshold and registering a tap input when the rate of change of acceleration exceeds a predetermined tap threshold."
2861,US-8468112-B2,Factored envisioning for decision support ,2009,"A system and method provides decision support for planning in an environment where a competition for use of resources exist and events affecting the planning are occurring dynamically. A system model of an actual system is provided. Then in a dynamic factored manner, an envisionment related to at least some aspects of the system model is built. From this envisionment output is generated related to at least some aspects of the system model. Finally, changes are made to the actual system, based on the generated output thereby changing a configuration and/or operation of the actual system."
2862,US-11135277-B2,Antigen specific multi epitope-based anti-infective vaccines ,2009,The invention provides peptide vaccines comprising the signal peptide domain of selected target antigens of intracellular pathogens. The peptide vaccines of the invention contain multiple class II and class I-restricted epitopes and are recognized and presented by the majority of the vaccinated human population. The invention provides in particular anti tuberculosis vaccines. The invention further provides compositions comprising the vaccines as well as their use to treat or prevent infection.
2863,US-8400677-B2,"Image processing apparatus, image forming system, image processing method and computer readable medium for calibrating profiles of multiple sheets ",2009,"The image processing apparatus includes: a color conversion unit color-converting an image signal of a first color space into that of a second color space with a color conversion characteristic defining a correspondence relationship between the image signals; an adjustment unit adjusting the image signal of the second color space with adjustment conversion factor groups that is for adjusting it in accordance with a change in the color conversion characteristic, and is set for respective types of sheets on which an image is to be printed according to the image signal of the second color space; a calculation unit calculating the adjustment conversion factor groups; a memory storing an associating factor group associating, with each other, the adjustment conversion factor groups; and an update unit updating the adjustment conversion factor groups according to the calculated adjustment conversion factor group of one sheet and the stored associating factor group."
2864,US-8072686-B2,UV laser beamlett on full-windshield head-up display ,2009,"An apparatus to project graphical images upon a substantially transparent windscreen head-up display of a vehicle includes an excitation light source projecting a laser beam based upon a graphical image command and a telescope for expanding the laser beam. The apparatus further includes a multi-mirror device including a plurality of mirrors sequentially irradiated by the expanded laser beam to simultaneously scan a plurality of laser beamlettes and the windscreen including a surface receiving the plurality of laser beamlettes, each of the received plurality of laser beamlettes emitting visible light upon the surface."
2865,US-8218452-B2,Network detection of real-time applications using incremental linear regression ,2009,Method and apparatus using incremental linear regression to derive a traffic flow signature indicative of a particular application within a packet stream.
2866,US-8429097-B1,Resource isolation using reinforcement learning and domain-specific constraints ,2009,"Systems and methods for providing resource isolation in a shared computing environment using reinforcement learning (RL) techniques are disclosed. A resource isolation mechanism may be applied in a shared storage system, or database service, that limits the resource utilization of each namespace to its specified allocation. For example, the mechanism may be used to limit the I/O utilization of database applications in a shared computing system to a specified limit, and may apply RL techniques, along with domain-specific constraints, to the system to automatically control the rate of queries made by an application. RL techniques, such as those based on the State-Action-Reward-State-Action (SARSA) method, may be effective in controlling resource utilization for different workloads, and may be enhanced by their application in conjunction with domain-specific business rules. RL techniques may be applied globally by the service, or may be applied to particular subscribers, applications, shared resources, namespaces, or query types."
2867,US-10198942-B2,Traffic routing display system with multiple signal lookahead ,2009,"A traffic routing display system provides a visual display of a speed or series of speeds suggested to the driver such that the driver may pass through multiple consecutive traffic signal devices without stopping at a red light. In one aspect, the display depicts the expected state of an upcoming traffic light. In another aspect, the display is an icon colored to correspond to the expected state. In another aspect, the time remaining before the state of a traffic light changes is displayed. The effect that an indicator has on driver behavior is used to determine the type of indicator to provide to the driver. Certain indicators may not be displayed by the system depending on the effect they have on the driver."
2868,US-9014440-B2,Dental cysts detector ,2009,"A system and method for detecting a cyst from a dental radiographic image is provided. The system and method comprises comparing the radiographic image to a plurality of template images, calculating a cross correlation coefficient between a plurality of regions in the radiographic image and a corresponding plurality of regions in the template image, determining a cyst region in the radiographic image based on a value of the cross correlation coefficient and computing a severity level of the cyst."
2869,US-8771189-B2,Valve assessment from medical diagnostic imaging data ,2009,"Heart valve operation is assessed with patient-specific medical diagnostic imaging data. To deal with the complex motion of the passive valve tissue, a hierarchal model is used. Rigid global motion of the overall valve, non-rigid local motion of landmarks of the valve, and surface motion of the valve are modeled sequentially. For the non-rigid local motion, a spectral trajectory approach is used in the model to determine location and motion of the landmarks more efficiently than detection and tracking. Given efficiencies in processing, more than one valve may be modeled at a same time. A graphic overlay representing the valve in four dimensions and/or quantities may be provided during an imaging session. One or more of these features may be used in combination or independently."
2870,US-8483702-B2,Chromatic scheduler for network traffic with disparate service requirements ,2009,"System(s) and method(s) are provided for managing network capacity in a wireless network that serves various traffic flows with disparate quality of service requirements. Management can be based on multi-stage scheduling in frequency-time domain. A first scheduling stage can generate an allocation of radio resources that minimizes inter-cell interference amongst a plurality of base stations. Based on the first-stage allocation of radio resources, a second scheduling stage can compute flow capacity for a set of radio resources specific to a base station, and acquire guaranteed-bit-rate (GBR) and non-guaranteed GBR traffic flows. GBR traffic flows can be matched to computed flow capacity to generate an allocation of frequency-time resources. In second scheduling stage, GBR traffic flows can be scheduled based at least in part on allocated resources and priority queuing. Based on allocation(s) in first and second scheduling stages, a third scheduling stage can schedule non-GBR traffic flows based at least in part on fair scheduling."
2871,US-9513797-B2,Locking and unlocking of an electronic device using a sloped lock track ,2009,"Securing an electronic device and associated information is facilitated. A security component facilitates display and operation of a lock track comprising a locked portion having a positive slope and an unlocked portion, including a chasm, that is adjacent to a high point of the positive-sloped unlocked portion of the lock track. A lock facilitator component (LFC) can be moved along the track between a low point of the locked portion and the unlocked portion. The LFC can be moved in response to received input, and if the input is not sufficient to move the LFC from the locked region to the unlocked region, the LFC can be moved back down the positive-sloped lock track to the low point. The security component can control information to be displayed in an overlay display region in accordance with security level(s) of the device or application."
2872,US-8078617-B1,Model based ad targeting ,2009,"System and method for quickly selecting content items (e.g., documents) having highest ranking scores in response to a query for content items. Base scores for a plurality of content items are determined based on attributes of the content items. One or more attributes are extracted from the query, the base scores of at least some of the content items are adjusted based on relationships between the query attributes and the content item attributes. A subset of the plurality of content items having the highest adjusted scores are selected, and the selected subset of content items are output."
2873,US-8880422-B1,Energy high performance capability assessment ,2009,"A high performance capability assessment model helps an energy industry business meet the challenges of the global marketplace. As a result, the energy industry business can achieve the clarity, consistency, and well-defined execution of core processes that reduce inefficiencies and waste that result from unnecessary process complexity and exceptions. In addition, the high performance capability assessment model helps the energy industry business to identify specific areas in which improvements may be made and understand how to make the improvements, and establishes levels of capability along the way to reaching an ultimate capability goal."
2874,US-8298905-B2,"Method for forming functional element using metal-to-insulator transition material, functional element formed by method, method for producing functional device, and functional device produced by method ",2009,"A method for forming a functional element includes a first step of forming an insulating layer composed of an insulator phase of a transition metal oxide serving as a metal-to-insulator transition material, the transition metal oxide being mainly composed of vanadium dioxide, and a second step of causing part of the insulating layer to transition to a metallic phase, in which the insulator phase differs from the metallic phase in terms of electrical resistivity and/or light transmittance."
2875,US-8761966-B2,Trajectory tracking flight controller ,2009,"A six degree-of-freedom trajectory linearization controller (TLC) architecture (30) for a fixed-wing aircraft (46) is set forth. The TLC architecture (30) calculates nominal force and moment commands by dynamic inversion of the nonlinear equations of motion. A linear time-varying (LTV) tracking error regulator provides exponential stability of the tracking error dynamics and robustness to model uncertainty and error. The basic control loop includes a closed-loop, LTV stabilizing controller (12), a pseudo-inverse plant model (14), and a nonlinear plant model(16). Four of the basic control loops (34, 36, 40, 42) are nested to form the TLC architecture (30)."
2876,US-11533456-B2,Group display system ,2009,"A system for generating an image display comprising a digital camera for capturing digital images, a computer for automatically selecting a digital image template having a designated location for disposing one of the captured digital images, and the computer for selecting one of the captured digital images to be disposed therein, an electronic display for displaying the digital template with the captured digital image disposed in the designated location, and a transmission channel for transmitting to the electronic display the captured digital images."
2877,US-8289366-B2,Conference annotation system ,2009,"Embodiments of the present invention are directed to a system and method for annotating a media stream from a live voice conversation, such as a conference call."
2878,US-8594813-B2,Dream controller ,2009,"A method and apparatus for intelligently controlling continuous process variables. A Dream Controller comprises an Intelligent Engine mechanism and a number of Model-Free Adaptive (MFA) controllers, each of which is suitable to control a process with specific behaviors. The Intelligent Engine can automatically select the appropriate MFA controller and its parameters so that the Dream Controller can be easily used by people with limited control experience and those who do not have the time to commission, tune, and maintain automatic controllers."
2879,US-9957505-B2,"Polynucleotides for multivalent RNA interference, compositions and methods of use thereof ",2009,"The present invention includes bivalent or multivalent nucleic acid molecules or complexes of nucleic acid molecules having two or more target-specific regions, in which the target-specific regions are complementary to a single target gene at more than one distinct nucleotide site, and/or in which the target regions are complementary to more than one target gene or target sequence. Also included are compositions comprising such nucleic acid molecules and methods of using the same for multivalent RNA interference and the treatment of a variety of diseases and infections."
2880,US-10381110-B2,Molecules ,2009,"A method for computational drug design using an evolutionary algorithm, comprises evaluating virtual molecules according to vector distance (VD) to at least one achievement objective that defines a desired ideal molecule. In one method the invention comprises defining a set of n achievement objectives (OA1-n), where n is at least one; defining a population (PG=0) of at least one molecule; selecting an initial population (Pparent) of at least one molecule (I1-In) from the population (PG=0); and evaluating members (I1-In) of the initial population (Pparent) against at least one of the n achievement objectives (OA1-x), where x is from 1 to n."
2881,US-10565510-B2,"Information processing apparatus, information processing method, program ",2009,"There is provided an information processing apparatus including: a sensor data generator sensing a user behavior and generating sensor data corresponding to the user behavior; a behavior recognizing unit performing a predetermined threshold value process on the sensor data to recognize the behavior exhibited by the user and generating behavior information that is information indicating the behavior exhibited by the user; a behavior manager managing the behavior information generated by the behavior recognizing unit in correspondence with the time point at which the behavior corresponding to the behavior information is exhibited; and a behavior information post-processing unit performing a predetermined post-process on the behavior information managed by the behavior manager, wherein the behavior recognizing unit further includes a plurality of behavior determination units specified to specific behaviors exhibited by the user and generates the behavior information based on the determination results of the plurality of behavior determination units."
2882,US-10628847-B2,Search-enhanced semantic advertising ,2009,"Systems and methods for enhanced advertising using semantic search are disclosed. In one aspect, embodiments of the present disclosure include a method, which may be implemented on a system, of identifying a semantic group with which content of a search result relates, further determining a facet of the semantic group with which the content of the search result relates, identifying an advertisement based on the facet of the semantic group, assigning an index to the advertisement as being associated with the facet of the semantic group, storing the index of the advertisement in a machine-readable storage medium, and/or presenting the advertisement to the user for viewing in a user interface in conjunction with the search result."
2883,US-8296292-B2,Internal ranking model representation schema ,2009,"A markup language schema utilized to represent internal ranking models. In one implementation, the schema developed utilizes XML (extensible markup language) for internal ranking model representation. Other markups languages can be employed."
2884,US-9345412-B2,System and method for multiclass discrimination of neural response data ,2009,Systems and methods are described herein for analyzing neural response data that can be assigned to multiple classes. The systems and methods begin with a set of training data from which optimal weight factors are derived. The derived weight factors are used in a classifier which is then applied to test data from test subjects. The classifier filters out the effects of less relevant data in the test data and provides a result in the form of probabilities associated with classes for the test data.
2885,US-8189925-B2,Geocoding by image matching ,2009,"Embodiments of the present invention relate to systems, methods and computer storage media for associating a known geographic location with a known identity. Feature matching, of at least two images, is performed in at least two iterations. The iterations are based on an orientation of feature vectors associated with points of interest in each image. A geometric model is applied to the matched points of interest to improve the matched pairs. Two images are identified as being related. As a result, the known geographic location is associated with the known identity. Additional embodiments include augmenting feature vectors with a coordinate location of a related point of interest based on a geometric model. Further, an exemplary embodiment includes an additional matching iteration based on the augmented feature vectors. In an exemplary embodiment, the feature matching utilizes a Scale-Invariant Feature Transform (SIFT)."
