row_id,id,title,year,abstract
4805,US-11157014-B2,Multi-channel sensor simulation for autonomous control systems ,2016,"An autonomous control system combines sensor data from multiple sensors to simulate sensor data from high-capacity sensors. The sensor data contains information related to physical environments surrounding vehicles for autonomous guidance. For example, the sensor data may be in the form of images that visually capture scenes of the surrounding environment, geo-location of the vehicles, and the like. The autonomous control system simulates high-capacity sensor data of the physical environment from replacement sensors that may each have lower capacity than high-capacity sensors. The high-capacity sensor data may be simulated via one or more neural network models. The autonomous control system performs various detection and control algorithms on the simulated sensor data to guide the vehicle autonomously."
4806,US-11210777-B2,System and method for detection of mobile device fault conditions ,2016,"There is presented a system and method for detecting mobile device fault conditions, including detecting fault conditions by software operating on the mobile device. In one embodiment, the present invention provides for systems and methods for using a neural network to detect, from an image of the device, that the mobile device has a defect, for instance a cracked or scratched screen. Systems and methods also provide for, reporting the defect status of the device, working or not, so that appropriate action may be taken by a third party."
4807,US-10460721-B2,"Dialogue act estimation method, dialogue act estimation apparatus, and storage medium ",2016,"A dialogue act estimation method, in a dialogue act estimation apparatus, includes acquiring first training data indicating, in a mutually associated manner, text data of a first sentence that can be a current uttered sentence, and text data of a second sentence that can be an uttered sentence immediately previous to the first sentence. The method also includes speaker change information indicating whether a speaker of the first sentence is the same as a speaker of the second sentence, and dialogue act information indicating a class of the first sentence. The method further includes learning an association between the current uttered sentence and the dialogue act information by applying the first training data to a model, and storing a result of the learning as learning result information in a memory."
4808,US-11606516-B2,"Image processing device, image processing method, and image processing system ",2016,"Methods and apparatus for image processing. The method comprises generating a first image having a first resolution, searching, by processing circuitry, the first image to determine whether a target object can be identified in the first image, specifying, when it is determined that the target object can be identified in the first image, a region-of-interest in the first image, generating, when it is determined that the target object cannot be identified in the first image, a second image having a second resolution higher than the first resolution, searching, by the processing circuitry, the second image to determine whether the target object can be identified in the second image, and specifying, when it is determined that the target object can be identified in the second image, a region-of-interest in the second image."
4809,US-9971737-B2,Identifying substitute ingredients using a natural language processing system ,2016,"A first food ingredient may be received. The first food ingredient may comprise a first plurality of chemical constituents. A plurality of candidate food ingredient substitutes may be received. Each candidate food ingredient substitute may comprise a second plurality of chemical constituents. For each of the plurality of candidate food ingredient substitutes, a quantity of the second plurality of chemical constituents that match the first plurality of chemical constituents may be determined. One or more food ingredient substitutes may be identified based on at least the quantity of the second plurality of chemical constituents that match the first plurality of chemical constituents."
4810,US-9978003-B2,Utilizing deep learning for automatic digital image segmentation and stylization ,2016,"Systems and methods are disclosed for segregating target individuals represented in a probe digital image from background pixels in the probe digital image. In particular, in one or more embodiments, the disclosed systems and methods train a neural network based on two or more of training position channels, training shape input channels, training color channels, or training object data. Moreover, in one or more embodiments, the disclosed systems and methods utilize the trained neural network to select a target individual in a probe digital image. Specifically, in one or more embodiments, the disclosed systems and methods generate position channels, training shape input channels, and color channels corresponding the probe digital image, and utilize the generated channels in conjunction with the trained neural network to select the target individual."
4811,US-10685253-B2,Advanced cloud detection using neural networks and optimization techniques ,2016,"Techniques for automatically determining, on a pixel by pixel basis, whether imagery includes ground images or is obscured by cloud cover. The techniques include training a Neural Network, making an initial determination of cloud or ground by using the Neural Network, and performing a max-flow, min-cut operation on the image to determine whether each pixel is a cloud or ground imagery."
4812,US-11822899-B2,Block floating point for neural network implementations ,2016,"Apparatus and methods are disclosed for performing block floating-point (BFP) operations, including in implementations of neural networks. All or a portion of one or more matrices or vectors can share one or more common exponents. Techniques are disclosed for selecting the shared common exponents. In some examples of the disclosed technology, a method includes producing BFP representations of matrices or vectors, at least two elements of the respective matrices or vectors sharing a common exponent, performing a mathematical operation on two or more of the plurality of matrices or vectors, and producing an output matrix or vector. Based on the output matrix or vector, one or more updated common exponents are selected, and an updated matrix or vector is produced having some elements that share the updated common exponents."
4813,US-10131053-B1,Real time robot collision avoidance ,2016,"Methods and apparatus related to robot collision avoidance. One method may include: receiving robot instructions to be performed by a robot; at each of a plurality of control cycles of processor(s) of the robot: receiving trajectories to be implemented by actuators of the robot, wherein the trajectories define motion states for the actuators of the robot during the control cycle or a next control cycle, and wherein the trajectories are generated based on the robot instructions; determining, based on a current motion state of the actuators and the trajectories to be implemented, whether implementation of the trajectories by the actuators prevents any collision avoidance trajectory from being achieved; and selectively providing the trajectories or collision avoidance trajectories for operating the actuators of the robot during the control cycle or the next control cycle depending on a result of the determining."
4814,US-10130307-B2,Electrocardiogram (ECG) authentication method and apparatus ,2016,"Disclosed are an electrocardiogram (ECG) authentication method and apparatus, and a training method and apparatus for training a neural network model used for ECG authentication, the ECG authentication apparatus being configured to acquire an ECG signal of a subject, extract a semantic feature of the ECG signal, and authenticate the subject based on the extracted semantic feature."
4815,US-9754205-B1,Using classified text or images and deep learning algorithms to identify risk of product defect and provide early warning ,2016,"Deep learning is used to identify specific, potential risks to an enterprise (of which product liability is the prime example here) while such risks are still internal electronic communications. The system involves mining and using existing classifications of data (e.g., from an internal litigation database, or from external sources such as customer complaints, and/or warranty claims) to train one or more deep learning algorithms, and then examining the enterprise's internal electronic communications with the trained algorithm, to generate a scored output that will enable enterprise personnel to be alerted to risks and take action in time to prevent the risks from resulting in harm to the enterprise or others."
4816,US-11055497-B2,Natural language generation of sentence sequences from textual data with paragraph generation model ,2016,"Disclosed are an apparatus and method for generating a natural language. According to an embodiment of the present disclosure, the method for generating the natural language includes receiving a plurality of pieces of data, generating a sentence ID sequence including one or more sentence IDs from the plurality of pieces of data, and generating a sentence corresponding to each of the sentence IDs included in the sentence ID sequence from the sentence ID sequence and the plurality of pieces of data."
4817,US-10068188-B2,Machine learning techniques that identify attribution of small signal stimulus in noisy response channels ,2016,"A method, system, and computer program product identifies attribution of small signal stimulus in noisy response channels. Using machine-learning techniques in a computer, a small signal correlation engine correlates time series stimuli data vectors to time series response data vectors, and generates correlation coefficients that identify contributions of event notifications, including small signal attributes, to aggregated response data. Also using machine-learning techniques in a computer, a learning model simulates variations of stimuli data to predict user responses using the correlation coefficients, including computing a contribution of the small signal attributes of an event notification."
4818,US-10032092-B2,Training data to increase pixel labeling accuracy ,2016,"Techniques are described to generate improved training data for pixel labeling. To generate training data, objects are displayed in a user interface by a computing device, e.g., iteratively. The objects are taken from a structured object representation associated with a respective one of a plurality of images. The structured object representation defines a hierarchical relationship of the objects within the respective image. Inputs are then received that are originated through user interaction with the user interface. The inputs label respective ones of the iteratively displayed objects, e.g., as text, a graphical element, background, foreground, and so forth. A model is trained by the computing device using machine learning."
4819,US-11720223-B2,Virtual user input controls in a mixed reality environment ,2016,"A wearable display system can automatically recognize a physical remote or a device that the remote serves using computer vision techniques. The wearable system can generate a virtual remote with a virtual control panel viewable and interactable by user of the wearable system. The virtual remote can emulate the functionality of the physical remote. The user can select a virtual remote for interaction, for example, by looking or pointing at the parent device or its remote control, or by selecting from a menu of known devices. The virtual remote may include a virtual button, which is associated with a volume in the physical space. The wearable system can detect that a virtual button is actuated by determining whether a portion of the user's body (e.g., the user's finger) has penetrated the volume associated with the virtual button."
4820,US-10845809-B2,Automatic driving device ,2016,"Achieving safety and natural automatic driving needs a control platform using intelligence (such as learning function and artificial intelligence), but it is difficult to ensure operations suited for the behavior of a vehicle by the output of intelligence. An automatic driving device according to the present invention includes a control program for inputting outside information and vehicle information, and outputting a target control value for a vehicle. The control program has a first program for generating a first target control amount on the basis of a dynamically changing algorithm (which outputs operations based on learning function or artificial intelligence), and a second program for generating a second target control amount on the basis of a prescribed algorithm (which outputs operations according to traffic rules or driving morals)."
4821,US-11113398-B2,Deployment of machine learning models for discernment of threats ,2016,"A mismatch between model-based classifications produced by a first version of a machine learning threat discernment model and a second version of a machine learning threat discernment model for a file is detected. The mismatch is analyzed to determine appropriate handling for the file, and taking an action based on the analyzing. The analyzing includes comparing a human-generated classification status for a file, a first model version status that reflects classification by the first version of the machine learning threat discernment model, and a second model version status that reflects classification by the second version of the machine learning threat discernment model. The analyzing can also include allowing the human-generated classification status to dominate when it is available."
4822,US-11143522-B2,"Travel time prediction method, apparatus and server ",2016,"A method and an apparatus for estimating travel time are provided. A request, via interface circuitry of the apparatus, is obtained to estimate the travel time of a target travel route from a starting point to an end point. The apparatus subsequently obtains, via the interface circuitry, road traffic information along the target travel route at a current time. The estimated travel time of the target travel route is calculated by processing circuitry of the apparatus according to the obtained road traffic information and historical travel data. The historical travel data includes a plurality of historical travel routes, respective road traffic information for each of the plurality of historical travel routes, and a respective actual travel time of each of the plurality of historical travel routes."
4823,US-10846618-B2,Smart replies using an on-device model ,2016,"A computing device may receive a communication sent from an external computing device. At least one processor of the computing device may determine, using an on-device machine-trained model and based at least in part on the communication, one or more candidate responses to the communication. The at least one processor may receive an indication of a user input that selects a candidate response from the one or more candidate responses. Responsive to receiving the indication of the user input that selects the candidate response, the at least one processor may send the candidate response to the external computing device."
4824,US-10187252-B2,Configuring heterogeneous computing environments using machine learning ,2016,"In one embodiment, a device receives data regarding a plurality of heterogeneous computing environments. The received data comprises measured application metrics for applications executed in the computing environments and indications of processing capabilities of the computing environments. The device generates a training dataset by applying a machine learning-based classifier to the received data regarding the plurality of existing heterogeneous environments. The device trains a machine learning-based configuration engine using the training dataset. The device uses the configuration engine to generate configuration parameters for a particular heterogeneous computing environment based on one or more system requirements of the particular heterogeneous computing environment. The device provides the configuration parameters to the particular heterogeneous computing environment."
4825,US-10878458-B2,Associating taste with consumable records ,2016,"A method for operating a health tracking system, a health tracking system, and non-transitory computer-readable medium for operating a health tracking system are disclosed. The method comprises receiving a data record comprising at least a descriptive string and nutritional data regarding a consumable item to which the data record corresponds; determining a taste associated to the consumable item based on an evaluation of at least one of: (i) the descriptive string, and (ii) the nutritional data; and associating the determined taste with the data record in a database."
4826,US-10554680-B2,Forecasting and classifying cyber-attacks using analytical data based neural embeddings ,2016,"A first collection including an analytical feature vector and a Q&A feature vector is constructed. A second collection is constructed from the first collection by inserting noise in at least one of the vectors. A third collection is constructed by crossing over at least one of vectors of the second collection with a corresponding vector of a fourth collection, migrating at least one of the vectors of the second collection with a corresponding vector of a fifth collection. Using a forecasting configuration, an analytical feature vector of the third collection is aged to generate a changed analytical feature vector containing analytical feature values expected at a future time. The changed analytical feature vector is input into a trained neural network to predict a probability of the cyber-attack occurring at the future time."
4827,US-10404549-B2,Applying machine learning to heterogeneous data of existing services to generate a new service ,2016,"A method, computer-readable medium, and apparatus for modeling data of a plurality of services for providing a new service are disclosed. For example, a method may include a processor for generating a first policy from a first service by a first policy model using machine learning for processing first data of the first service, generating a second policy from a second service by a second policy model using machine learning for processing second data of the second service, wherein the first service and the second service are different, and implementing one or more functions for a new service using the first policy and the second policy."
4828,US-11003987-B2,Audio processing with neural networks ,2016,"Methods, systems, and apparatus, including computer programs encoded on computer storage media, for audio processing using neural networks. One of the systems includes multiple neural network layers, wherein the neural network system is configured to receive time domain features of an audio sample and to process the time domain features to generate a neural network output for the audio sample, the plurality of neural network layers comprising: a frequency-transform (F-T) layer that is configured to apply a transformation defined by a set of F-T layer parameters that transforms a window of time domain features into frequency domain features; and one or more other neural network layers having respective layer parameters, wherein the one or more neural network layers are configured to process frequency domain features to generate a neural network output."
4829,US-11157828-B2,Tomography and generative data modeling via quantum boltzmann training ,2016,"Quantum neural nets, which utilize quantum effects to model complex data sets, represent a major focus of quantum machine learning and quantum computing in general. In this application, example methods of training a quantum Boltzmann machine are described. Also, examples for using quantum Boltzmann machines to enable a form of quantum state tomography that provides both a description and a generative model for the input quantum state are described. Classical Boltzmann machines are incapable of this. Finally, small non-stoquastic quantum Boltzmann machines are compared to traditional Boltzmann machines for generative tasks, and evidence presented that quantum models outperform their classical counterparts for classical data sets."
4830,US-11011266-B2,Health provider matching service ,2016,"A health provider matching service is provided to match patients to health providers based on a semantic relationship graph of data associated with conditions of patients. Using natural language processing, the service identifies terms describing symptoms, treatments, and health providers associated with a condition. The service then identifies semantic relations among the terms and probability distributions of the terms to generate a semantic relationship graph. Quality information of therapists is combined with machine learning techniques to identify features that are used to distinguish high quality and low quality providers. Based on the semantic relationship graph and the derived quality information, the service matches a patient to a health provider suitable to treat the particular needs of the patient. The service also handles social, behavioral, or emotional issues for which medications are not appropriate."
4831,US-9858496-B2,Object detection and classification in images ,2016,"Systems, methods, and computer-readable media for providing fast and accurate object detection and classification in images are described herein. In some examples, a computing device can receive an input image. The computing device can process the image, and generate a convolutional feature map. In some configurations, the convolutional feature map can be processed through a Region Proposal Network (RPN) to generate proposals for candidate objects in the image. In various examples, the computing device can process the convolutional feature map with the proposals through a Fast Region-Based Convolutional Neural Network (FRCN) proposal classifier to determine a class of each object in the image and a confidence score associated therewith. The computing device can then provide a requestor with an output including the object classification and/or confidence score."
4832,US-11510022-B2,Wearable electronic device that displays a boundary of a three-dimensional zone ,2016,A wearable electronic device (WED) includes one or more sensors and cameras that determine a location of a physical object in a zone where the user is located and that track movement of an electronic device that moves to define a boundary of the zone. The WED includes a processor that generates binaural sound and a display that displays a virtual image of the boundary of the zone and a visual warning that notifies the user of the physical object.
4833,ES-2914787-T3,Method for protein corona sensor array for early disease detection ,2016,"A method of distinguishing states of a complex biological sample from a subject using a plurality of particles, the method comprising: (a) exposing the complex biological sample to the plurality of particles to allow binding of a plurality of proteins of the complex biological sample to the surfaces of the plurality of particles to form distinct biomolecule corona signatures, wherein the plurality of particles have surfaces with different physicochemical properties, and wherein a binding pattern of the plurality of proteins among the plurality of particles differs based on the physicochemical properties of the surfaces of the plurality of particles; (b) defining a representative biomolecule fingerprint of a combination of biomolecule corona signatures by separating and identifying at least a subset of proteins from the plurality of particles; and (c) associating the imprint of the biomolecule with a biological state of the subject."
4834,US-10761991-B2,Apparatus and methods for circular shift operations ,2016,"Aspects for vector circular shifting in neural network are described herein. The aspects may include a direct memory access unit configured to receive a vector that includes multiple elements. The multiple elements are stored in a one-dimensional data structure. The direct memory access unit may store the vector in a vector caching unit. The aspects may further include an instruction caching unit configured to receive a vector shifting instruction that includes a step length for shifting the elements in the vector. Further still, the aspects may include a computation module configured to shift the elements of the vector toward one direction by the step length."
4835,US-10104227-B2,Automatically altering characteristics of audio alerts ,2016,"In general, a computing device is described that receives an indication of a particular communication from a particular sender. The computing device determines a relationship score based at least in part on a relationship context between the particular sender and a user of the computing device. The relationship score indicates a degree of strength of a relationship between the particular sender and the user of the computing device. While outputting an alert indicative of the communication, the computing device adjusts one or more characteristics of the alert based at least in part on the relationship score."
